,Reg no.,Name,"Incorp-
orated",Dissolved,Type
752,1110971,"ABLE FAIR PRODUCTS LIMITED
寶發日用製品有限公司",2007-02-16,2012-10-12,"Private, ltd by shares"
753,1168293,"ABLE FAITH LIMITED (d2013-03-01)
行信有限公司",2007-09-18,2013-03-01,"Private, ltd by shares"
754,1176233,"ABLE FAME LIMITED (d2016-06-03)
基榮有限公司",2007-10-17,2016-06-03,"Private, ltd by shares"
755,1153407,"ABLE FIRST PROPERTY INVESTMENT COMPANY LIMITED
第一置業投資有限公司",2007-07-26,2011-04-08,"Private, ltd by shares"
756,1118225,"ABLE GAIN INDUSTRIES LIMITED
寶盈實業有限公司",2007-03-26,2008-10-03,"Private, ltd by shares"
757,1147432,"ABLE GARDEN (HONG KONG) HOLDINGS LIMITED
香港可園集團有限公司",2007-07-06,2012-05-04,"Private, ltd by shares"
758,1178859,"ABLE GENIUS INVESTMENTS LIMITED
寶亨投資有限公司",2007-10-25,2013-03-28,"Private, ltd by shares"
759,1127012,"ABLE GLOBAL GROUP LIMITED
環豐集團有限公司",2007-04-25,,"Private, ltd by shares"
760,1107293,"ABLE HONEST DEVELOPMENT LIMITED
寶安發展有限公司",2007-02-02,,"Private, ltd by shares"
761,1186153,"ABLE INDUSTRIAL LIMITED
愛寶實業有限公司",2007-11-16,,"Private, ltd by shares"
762,1161527,"ABLE INTERNATIONAL DEVELOPMENT LIMITED
奧寶國際發展有限公司",2007-08-24,,"Private, ltd by shares"
763,1188294,"ABLE INTERNATIONAL HOLDING LIMITED
安波國際控股有限公司",2007-11-23,2013-03-28,"Private, ltd by shares"
764,1134027,"Able King Investment Limited
寶京投資有限公司",2007-05-18,,"Private, ltd by shares"
765,1127294,"ABLE KING LIMITED
寶京有限公司",2007-04-26,,"Private, ltd by shares"
766,1178157,"ABLE LINE LIMITED
緯明有限公司",2007-10-24,,"Private, ltd by shares"
767,1130559,"ABLE LINKAGE LIMITED (d2012-07-20)
雅合有限公司",2007-05-08,2012-07-20,"Private, ltd by shares"
768,1192765,"ABLE MONEY LIMITED
啓財有限公司",2007-12-06,,"Private, ltd by shares"
769,1141726,"Able Network Design Limited
愛保網絡設計有限公司",2007-06-15,2011-02-11,"Private, ltd by shares"
770,1121636,"ABLE PACIFIC LIMITED
嘉寶太平洋有限公司",2007-04-10,,"Private, ltd by shares"
771,1176624,"ABLE POWER TECH COMPANY LIMITED
愛普能源有限公司",2007-10-17,2011-06-30,"Private, ltd by shares"
772,1182786,"ABLE RAYS LIMITED
毅瑋有限公司",2007-11-07,,"Private, ltd by shares"
773,1186186,"ABLE RICH DEVELOPMENT LIMITED (d2014-02-28)
雅豐發展有限公司",2007-11-16,2014-02-28,"Private, ltd by shares"
774,1195910,"ABLE RICH GLOBAL LIMITED
雅豐環球有限公司",2007-12-17,2010-09-03,"Private, ltd by shares"
775,1153781,"ABLE RICH HOLDINGS LIMITED (d2013-10-11)
雅豐集團有限公司",2007-07-27,2013-10-11,"Private, ltd by shares"
776,1118185,"ABLE SIGN LIMITED
雅兆有限公司",2007-03-26,,"Private, ltd by shares"
777,1189415,"ABLE STAR (H.K.) LIMITED
達星(香港)有限公司",2007-11-28,,"Private, ltd by shares"
778,1187451,"ABLE STATE LIMITED (d2011-09-16)
悅邦有限公司",2007-11-21,2011-09-16,"Private, ltd by shares"
779,1114679,"ABLE SUPPLY (CHINA) LIMITED
利寶(中國)有限公司",2007-03-13,,"Private, ltd by shares"
780,1175507,"ABLE TEAM INTERNATIONAL LIMITED
振添國際有限公司",2007-10-15,,"Private, ltd by shares"
781,1198941,"ABLE TEC INTERNATIONAL LIMITED
得宜國際有限公司",2007-12-28,,"Private, ltd by shares"
782,1188284,"ABLE TECH LIMITED
衛科有限公司",2007-11-23,,"Private, ltd by shares"
783,1195469,"ABLE TOP INVESTMENT LIMITED
英德投資有限公司",2007-12-14,,"Private, ltd by shares"
784,1173856,"ABLE UNION SHIPPING COMPANY LIMITED
浚滙船務有限公司",2007-10-09,2018-11-02,"Private, ltd by shares"
785,1178863,"ABLE VICTORY INTERNATIONAL LIMITED
寶勝國際有限公司",2007-10-25,,"Private, ltd by shares"
786,1129123,"ABLE WAY INVESTMENTS LIMITED
毅穎投資有限公司",2007-05-03,2017-01-27,"Private, ltd by shares"
787,1193018,"ABLE WISDOM HOLDINGS LIMITED (d2014-03-21)
寶智集團有限公司",2007-12-07,2014-03-21,"Private, ltd by shares"
788,1190424,"ABLEMAX INTERNATIONAL LIMITED
寶名國際有限公司",2007-11-30,2010-12-03,"Private, ltd by shares"
789,1131187,"Ablerex International Corporation Limited
愛普瑞斯國際有限公司",2007-05-09,,"Private, ltd by shares"
790,1182845,"ABLEREX OVERSEAS CORPORATION LIMITED
盈正豫順海外有限公司",2007-11-07,,"Private, ltd by shares"
791,1170349,"ABLTY BUSINESS LEADER (H.K.) LIMITED
淳濤偉業科技(香港)有限公司",2007-09-25,2012-05-11,"Private, ltd by shares"
792,1177829,"ABLYTEK LIMITED
首碁科技有限公司",2007-10-23,2011-07-08,"Private, ltd by shares"
793,1102017,"abm fashion sourcing (asia) Limited
美國服飾(亞洲)有限公司",2007-01-15,,"Private, ltd by shares"
794,1145096,ABM GROUP (HK) LIMITED,2007-06-28,2018-03-09,"Private, ltd by shares"
795,1170915,"ABM HOLDING (HONG KONG) CO., LIMITED
艾麗斯股份(香港)有限公司",2007-09-28,2014-01-10,"Private, ltd by shares"
796,1141943,"ABM MAGNETICS CO., LIMITED
星創磁業有限公司",2007-06-15,,"Private, ltd by shares"
797,1135464,"ABM Services Limited
安保曼商務有限公司",2007-05-25,,"Private, ltd by shares"
798,1101517,ABOARD HOLDINGS LIMITED (d2011-11-11),2007-01-11,2011-11-11,"Private, ltd by shares"
799,1106633,ABOBI (ASIA) LIMITED,2007-02-01,2017-09-22,"Private, ltd by shares"
800,1105155,ABOBI LIMITED,2007-01-25,,"Private, ltd by shares"
801,1152729,"ABOOM INDUSTRIAL CO., LIMITED
怡邦企業有限公司",2007-07-25,2013-09-27,"Private, ltd by shares"
802,1186926,"ABOUND INDUSTRIAL COMPANY LIMITED
豐富製品有限公司",2007-11-20,,"Private, ltd by shares"
803,1117556,"ABOUND PEARL INVESTMENT LIMITED
嶺寶投資有限公司",2007-03-22,2009-03-13,"Private, ltd by shares"
804,1191908,"ABOUTIME (HK) CO., LIMITED
寶泰(香港)實業有限公司",2007-12-05,,"Private, ltd by shares"
805,1196848,"ABOVE & BEYOND LIMITED
亞洲再生資源有限公司",2007-12-19,,"Private, ltd by shares"
806,1158280,ABOVE AND BEYOND (HK) LIMITED,2007-08-14,2018-06-01,"Private, ltd by shares"
807,1141826,ABP HONG KONG LIMITED,2007-06-15,,"Private, ltd by shares"
808,1150139,"ABP INTERNATIONAL LIMITED
澳博森國際有限公司",2007-07-17,,"Private, ltd by shares"
809,1154251,"ABRACARDABRA (H.K.) LIMITED
香港阿貝卡爾有限公司",2007-07-31,2013-10-11,"Private, ltd by shares"
810,1157512,ABRAX Limited (HK),2007-08-10,,"Private, ltd by shares"
811,1198994,"ABRELLA CORPORATION LIMITED
宏翊股份有限公司",2007-12-28,2009-01-02,"Private, ltd by shares"
812,1148325,ABS Advisors Limited (d2011-09-09),2007-07-10,2011-09-09,"Private, ltd by shares"
813,1181013,ABS Investment Management (Asia) Limited,2007-11-01,,"Private, ltd by shares"
814,1135041,ABSOLUT DESIGN LIMITED,2007-05-23,2014-11-21,"Private, ltd by shares"
815,1126609,ABSOLUT MARINE CONSULTING LIMITED,2007-04-24,,"Private, ltd by shares"
816,1121110,ABSOLUTE (H.K.) LIMITED,2007-04-04,2017-04-07,"Private, ltd by shares"
817,1128943,ABSOLUTE APARTMENTS LIMITED,2007-05-03,,"Private, ltd by shares"
818,1190252,"ABSOLUTE CONCEPTS LIMITED (HK)
傑出創意有限公司",2007-11-29,,"Private, ltd by shares"
819,1156087,ABSOLUTE CONSULTING LIMITED (HK),2007-08-06,,"Private, ltd by shares"
820,1154242,ABSOLUTE GOLF LIMITED,2007-07-31,2017-02-24,"Private, ltd by shares"
821,1144356,"ABSOLUTE INTELLIGENCE ENGINEERING LIMITED
才至工程有限公司",2007-06-26,2017-02-17,"Private, ltd by shares"
822,1159901,ABSOLUTE LASER SKIN CARE LIMITED,2007-08-20,,"Private, ltd by shares"
823,1189886,Absolute Return Investments Limited,2007-11-29,2017-08-18,"Private, ltd by shares"
824,1126949,"ABSOLUTE WIN LIMITED (d2017-04-28)
定紅有限公司",2007-04-25,2017-04-28,"Private, ltd by shares"
825,1188473,"ABT (HK) GROUP CO., LIMITED
安本泰(香港)集團有限公司",2007-11-23,2011-12-02,"Private, ltd by shares"
826,1176293,"ABTEC PRODUCTS LIMITED
安泰科有限公司",2007-10-17,2017-06-30,"Private, ltd by shares"
827,1159068,"Abterra Coal & Coke Limited
天益煤焦有限公司",2007-08-16,,"Private, ltd by shares"
828,1134943,"ABU AYESH FOR TRADING CO., LIMITED",2007-05-22,2014-09-19,"Private, ltd by shares"
829,1132786,"ABUNDANT (HK) INTERNATIONAL ELECTRONICS LIMITED
中盛(香港)國際電子有限公司",2007-05-16,2019-09-13,"Private, ltd by shares"
830,1107368,"ABUNDANT CHIP TECHNOLOGY CO., LIMITED
浩芯電子科技有限公司",2007-02-02,,"Private, ltd by shares"
831,1102839,ABUNDANT CLUB MARCO POLO HOLDINGS LIMITED,2007-01-17,2017-12-01,"Private, ltd by shares"
832,1186217,"ABUNDANT GRACE CHRISTIAN ASSEMBLY LIMITED
基督教豐盛恩典堂有限公司",2007-11-16,,Ltd by guarantee
833,1100305,ABUNDANT GREEN LIMITED,2007-01-05,2018-01-12,"Private, ltd by shares"
834,1117520,"ABUNDANT GROUP LIMITED (d2012-04-20)
豐禾集團有限公司",2007-03-22,2012-04-20,"Private, ltd by shares"
835,1136902,"ABUNDANT INTELLIGENCE GLOBAL LIMITED
豐盛環球智能有限公司",2007-05-30,2009-04-03,"Private, ltd by shares"
836,1187006,ABV HONG KONG LIMITED,2007-11-20,,"Private, ltd by shares"
837,1126409,"ABYSM ENERGY (INTERNATIONAL) LIMITED
雅美紳能源(國際)有限公司",2007-04-24,,"Private, ltd by shares"
838,1139084,AC & T LIMITED,2007-06-06,2018-02-15,"Private, ltd by shares"
839,1113569,AC Associate Limited,2007-03-08,2009-11-20,"Private, ltd by shares"
840,1139218,AC CHEMISTRY LIMITED,2007-06-07,,"Private, ltd by shares"
841,1183282,AC DESIGN LIMITED,2007-11-08,2015-06-05,"Private, ltd by shares"
842,1168670,"AC Forster (HK) Limited
科斯達(香港)有限公司",2007-09-19,,"Private, ltd by shares"
843,1143796,"AC FORSTER LIMITED
科斯達有限公司",2007-06-25,2008-04-25,"Private, ltd by shares"
844,1111235,AC JAPAN LIMITED,2007-02-22,2013-08-16,"Private, ltd by shares"
845,1107876,AC Jet International Limited,2007-02-06,2015-10-13,"Private, ltd by shares"
846,1181728,AC NET UNITED INVESTMENT (HK) LIMITED,2007-11-05,2018-07-13,"Private, ltd by shares"
847,1163196,"AC SALES LIMITED
香港裕豐行有限公司",2007-08-30,,"Private, ltd by shares"
848,1144820,"AC TECHNIK LIMITED
天力建設有限公司",2007-06-27,,"Private, ltd by shares"
849,1127315,"AC TRADING CO., LIMITED",2007-04-26,2010-09-24,"Private, ltd by shares"
850,1153726,ACA Financial Marketing & PR Limited,2007-07-27,2013-10-11,"Private, ltd by shares"
851,1182294,ACA II Advisors (Beijing Holdings) Limited,2007-11-06,,"Private, ltd by shares"
852,1195957,ACA INTERNATIONAL LIMITED (d2014-05-23),2007-12-17,2014-05-23,"Private, ltd by shares"
853,1170522,ACA Marketing Communications Limited,2007-09-27,2014-01-10,"Private, ltd by shares"
854,1192345,"Acacia Wood Investment Company Limited
曜木投資(香港)有限公司",2007-12-06,2019-11-08,"Private, ltd by shares"
855,1125284,ACADEMIC ENHANCER LIMITED,2007-04-20,2009-08-14,"Private, ltd by shares"
856,1195232,"ACADEMICHEM INTERNATIONAL GROUP LIMITED
中馳國際集團有限公司",2007-12-14,2015-04-30,"Private, ltd by shares"
857,1147227,Academy Guru Limited (The),2007-07-05,,"Private, ltd by shares"
858,1174657,"ACADEMY INTERNATIONAL DEVELOPMENT FUND LIMITED
翰林國際發展基金有限公司",2007-10-10,2019-06-21,Ltd by guarantee
859,1159978,"ACADEMY KINDERGARTEN (TIN SHUI WAI) LIMITED
翰林幼稚園(天水圍)有限公司",2007-08-20,,Ltd by guarantee
860,1188942,ACADEMY OF ASIAN SCHOLARS LIMITED,2007-11-26,,"Private, ltd by shares"
861,1196893,"ACADEMY OF SCIENCES OF INTERNATIONAL ECO-BEER LIMITED
國際生態啤酒科學院有限公司",2007-12-20,2011-12-30,"Private, ltd by shares"
862,1193028,ACAJOU SERVICES LIMITED,2007-12-07,2013-01-25,"Private, ltd by shares"
863,1182093,ACASA LIMITED,2007-11-06,,"Private, ltd by shares"
864,1153721,"ACC INTERNATIONAL CONSULTANCY LIMITED
雅思國際顧問有限公司",2007-07-27,,"Private, ltd by shares"
865,1189148,"ACC PAVILION LIMITED
德郡有限公司",2007-11-27,2011-07-15,"Private, ltd by shares"
866,1163353,ACCEDO BROADBAND ASIA LIMITED,2007-08-31,,"Private, ltd by shares"
867,1165488,"ACCEL CAPITAL LIMITED
和盛資本有限公司",2007-09-07,,"Private, ltd by shares"
868,1175255,"ACCEL INDUSTRIAL LIMITED
澳珂實業有限公司",2007-10-12,,"Private, ltd by shares"
869,1144566,"ACCELA CHEMBIO CO., LIMITED",2007-06-27,,"Private, ltd by shares"
870,1153310,"ACCELERATION (HONG KONG) CORPORATION LIMITED
新幹綫(香港)有限公司",2007-07-26,,"Private, ltd by shares"
871,1162987,ACCENT ASIA LIMITED,2007-08-30,2015-04-17,"Private, ltd by shares"
872,1177422,"ACCENT DESIGNS CHINA LIMITED
恒信工藝(中國)有限公司",2007-10-22,2008-06-27,"Private, ltd by shares"
873,1189235,"ACCENTO DEVELOPMENT LIMITED
雅滔發展有限公司",2007-11-27,2018-03-19,"Private, ltd by shares"
874,1188145,"ACCES IMPORT & EXPORT CO., LIMITED",2007-11-22,,"Private, ltd by shares"
875,1099812,ACCES TRADING INTERNATIONAL LIMITED,2007-01-04,2017-09-01,"Private, ltd by shares"
876,1171577,"Acceso International Company Limited
香港艾思國際貿易有限公司",2007-10-02,2014-04-04,"Private, ltd by shares"
877,1125358,"ACCESORIOS 98, C.A. LIMITED
98汽車精品進出口有限公司",2007-04-20,2014-10-24,"Private, ltd by shares"
878,1143984,ACCESS ACCOUNTING LIMITED (HK),2007-06-25,2018-11-16,"Private, ltd by shares"
879,1187385,ACCESS AIR LIMITED,2007-11-21,,"Private, ltd by shares"
880,1184748,"ACCESS ASIAN PRODUCT LIMITED
聯亮亞洲有限公司",2007-11-13,,"Private, ltd by shares"
881,1195959,ACCESS BRIGHT LIMITED,2007-12-17,,"Private, ltd by shares"
882,1153694,ACCESS CHINA (HZ) LIMITED,2007-07-27,2014-10-31,"Private, ltd by shares"
883,1161933,"ACCESS CHINA ENTERPRISE CONSULTING (HONG KONG) LIMITED
歐諾信(香港)企業咨詢有限公司",2007-08-27,2015-03-27,"Private, ltd by shares"
884,1178232,Access China Holding (HK) Limited,2007-10-24,,"Private, ltd by shares"
885,1128176,"ACCESS Electronics (HongKong) Co., Limited
雅柯電子(香港)有限公司",2007-04-30,,"Private, ltd by shares"
886,1104369,"ACCESS FACILITY MANAGEMENT SERVICES ENGINEERING LIMITED
雅西施工程有限公司",2007-01-23,2012-01-20,"Private, ltd by shares"
887,1129962,"ACCESS GLOBAL LIMITED (HK)
嘉益寶有限公司",2007-05-07,,"Private, ltd by shares"
888,1174577,"ACCESS LEATHER GLOBAL LIMITED
成功皮具國際有限公司",2007-10-10,,"Private, ltd by shares"
889,1167358,"ACCESS POINT GROUP LIMITED
振栢集團有限公司",2007-09-14,2015-01-23,"Private, ltd by shares"
890,1121219,ACCESS POINT MEDICAL H.K. LIMITED,2007-04-04,2010-12-03,"Private, ltd by shares"
891,1170563,AccessEast International Limited,2007-09-27,2018-05-04,"Private, ltd by shares"
892,1170684,"ACCESSORIES FAST (HK) COMPANY LIMITED
浩進實業(香港)有限公司",2007-09-27,2012-06-22,"Private, ltd by shares"
893,1150766,"ACCESSORY SOURCE COMPANY LIMITED
炬光國際貿易有限公司",2007-07-18,,"Private, ltd by shares"
894,1169920,ACCESSORY SOURCING (HK) LIMITED,2007-09-24,,"Private, ltd by shares"
895,1146578,ACCESSWAY HOLDINGS LIMITED,2007-07-04,,"Private, ltd by shares"
896,1172103,"ACCI GROUP LIMITED
賢振投資有限公司",2007-10-04,,"Private, ltd by shares"
897,1105633,"ACCION CORPORATION (ASIA) LIMITED
逸群 (亞洲) 有限公司",2007-01-29,2010-09-03,"Private, ltd by shares"
898,1164440,ACCLARO LIMITED,2007-09-04,2015-07-24,"Private, ltd by shares"
899,1185091,"ACCOM PROFESSIONAL EDUCATION LIMITED
展能專業教育有限公司",2007-11-13,2015-09-18,"Private, ltd by shares"
900,1176381,"ACCOMPLISH EAGLE LIMITED
竣鵬有限公司",2007-10-17,2016-04-01,"Private, ltd by shares"
901,1110584,"ACCOR INTERNATIONAL HOTEL GROUP LIMITED
雅高國際酒店集團有限公司",2007-02-15,2013-03-28,"Private, ltd by shares"
902,1120769,"ACCORD GROUP HOLDINGS LIMITED
協和控股有限公司",2007-04-03,2017-05-05,"Private, ltd by shares"
903,1112206,Accord Pacific Asia Limited,2007-02-28,2015-05-15,"Private, ltd by shares"
904,1116195,"ACCORD SUN INTERNATIONAL LIMITED
合輝國際發展有限公司",2007-03-19,,"Private, ltd by shares"
905,1167735,"ACCORD TALENT INVESTMENT LIMITED
秉智投資有限公司",2007-09-17,2009-11-13,"Private, ltd by shares"
906,1161689,"ACCOUNTING & FINANCE LEARNING CENTRE LIMITED
會計財務學習中心有限公司",2007-08-27,2016-12-09,"Private, ltd by shares"
907,1138335,"ACCPRO CORPORATE SERVICES LIMITED
嘉信企業管理有限公司",2007-06-04,,"Private, ltd by shares"
908,1140520,"ACCRETE CAPITAL ASSET MANAGEMENT LIMITED
華祺資産管理有限公司",2007-06-12,2011-01-28,"Private, ltd by shares"
909,1121321,"ACCRUE FORTUNE LIMITED
迎富有限公司",2007-04-04,,"Private, ltd by shares"
910,1133520,"AccTec Consulting Limited
薈達顧問有限公司",2007-05-17,,"Private, ltd by shares"
911,1137449,"ACCU VISION MANUFACTURING CO. LIMITED
安捷信有限公司",2007-06-01,2012-09-14,"Private, ltd by shares"
912,1190509,ACCUCORE CONSULTING LIMITED,2007-11-30,,"Private, ltd by shares"
913,1150676,ACCUON GROUP LIMITED,2007-07-18,2012-11-16,"Private, ltd by shares"
914,1163687,"ACCUPDESA ELECTRONICS (ASIA) CO., LIMITED
金嗓子電子(亞洲)有限公司",2007-08-31,2019-01-25,"Private, ltd by shares"
915,1165610,ACCURA MANUFACTURING CO. LIMITED,2007-09-07,,"Private, ltd by shares"
916,1184519,Accura Technology Limited,2007-11-12,2019-07-12,"Private, ltd by shares"
917,1123392,"Accuracy Hong Kong Limited
昇智企業（香港）有限公司",2007-04-13,,"Private, ltd by shares"
918,1152583,"ACCURATE (HK) MOULD TECHNOLOGY LIMITED
艾克(香港)模具技術有限公司",2007-07-24,2020-07-17,"Private, ltd by shares"
919,1166756,Accuver APAC Limited,2007-09-12,,"Private, ltd by shares"
920,1198620,ACCW INVESTMENT LIMITED,2007-12-28,,"Private, ltd by shares"
921,1117528,ACE AHEAD LIMITED,2007-03-22,2013-04-29,"Private, ltd by shares"
922,1134523,"ACE ANTENNA CO., LIMITED",2007-05-21,,"Private, ltd by shares"
923,1134522,Ace Antenna Corporation Limited,2007-05-21,2010-10-22,"Private, ltd by shares"
924,1159655,ACE AUSTRALIA LIMITED,2007-08-20,2010-04-09,"Private, ltd by shares"
925,1154614,"ACE BLOSSOM LIMITED
茵威有限公司",2007-08-01,,"Private, ltd by shares"
926,1140364,"ACE BUDDY INDUSTRIAL CO., LIMITED
愛思寶實業有限公司",2007-06-11,2019-03-15,"Private, ltd by shares"
927,1132016,"ACE BUSINESS CONSULTING INTERNATIONAL LIMITED
凱思國際企業顧問有限公司",2007-05-14,2019-03-01,"Private, ltd by shares"
928,1122819,"ACE CROWN LIMITED
千冠有限公司",2007-04-12,,"Private, ltd by shares"
929,1176913,"ACE DYNAMIC INTERNATIONAL LIMITED
龍獁國際有限公司",2007-10-18,2013-01-04,"Private, ltd by shares"
930,1156956,"ACE EXIM (H.K.) CO., LIMITED
愛司國際貿易(香港)有限公司",2007-08-08,2011-04-01,"Private, ltd by shares"
931,1177281,ACE Financial Consultants Limited (HK),2007-10-18,2020-07-24,"Private, ltd by shares"
932,1180359,ACE FINANCIAL SERVICES LIMITED (d2013-01-04),2007-10-31,2013-01-04,"Private, ltd by shares"
933,1115184,"ACE FORD LIMITED
愛潔有限公司",2007-03-15,,"Private, ltd by shares"
934,1129185,"ACE GAIN GROUP LIMITED
碧湖集團有限公司",2007-05-03,,"Private, ltd by shares"
935,1122133,ACE GOAL LIMITED,2007-04-11,,"Private, ltd by shares"
936,1142818,"ACE INDUSTRY CO., LIMITED (d2018-09-14)
安澤實業有限公司",2007-06-20,2018-09-14,"Private, ltd by shares"
937,1155466,"ACE INTERNATIONAL CORP. LIMITED
阿爾法國際實業有限公司",2007-08-03,2015-07-17,"Private, ltd by shares"
938,1145950,"ACE LAND HOLDINGS LIMITED
霖藝集團有限公司",2007-07-03,2017-02-24,"Private, ltd by shares"
939,1124721,"ACE LEGEND LIMITED (d2011-11-18)
榮雋有限公司",2007-04-18,2011-11-18,"Private, ltd by shares"
940,1129543,"ACE LUCKY LIMITED (d2012-08-10)
六福有限公司",2007-05-04,2012-08-10,"Private, ltd by shares"
941,1168211,"ACE MANUFACTORY LIMITED
優越製造廠有限公司",2007-09-18,,"Private, ltd by shares"
942,1121040,"Ace Medical Components Company Limited
精英醫療製品有限公司",2007-04-04,,"Private, ltd by shares"
943,1132612,"ACE MOON INTERNATIONAL LIMITED
毅月國際有限公司",2007-05-15,2013-02-22,"Private, ltd by shares"
944,1162417,"ACE RAYS LIMITED
霖瑋有限公司",2007-08-28,2013-09-13,"Private, ltd by shares"
945,1161880,Ace Right Limited,2007-08-27,,"Private, ltd by shares"
946,1146627,"ACE RISE INTERNATIONAL LIMITED
騰通國際有限公司",2007-07-04,,"Private, ltd by shares"
947,1181325,"ACE SUCCESS DEVELOPMENT LIMITED
達成發展有限公司",2007-11-02,2017-05-26,"Private, ltd by shares"
948,1125452,"ACE SUPER INVESTMENTS LIMITED
全都投資有限公司",2007-04-20,,"Private, ltd by shares"
949,1124320,ACE TIMES LIMITED,2007-04-18,2018-01-18,"Private, ltd by shares"
950,1136791,ACE TRADING (INTERNATIONAL) LIMITED,2007-05-30,2009-10-30,"Private, ltd by shares"
951,1176934,"ACE UNIVERSAL LIMITED (d2011-05-27)
毅宇有限公司",2007-10-18,2011-05-27,"Private, ltd by shares"
952,1196595,"ACE VISION DEVELOPMENT LIMITED
三順發展有限公司",2007-12-19,2015-01-23,"Private, ltd by shares"
953,1196554,"ACE VISION INTERNATIONAL LIMITED (d2011-12-30)
三順國際有限公司",2007-12-19,2011-12-30,"Private, ltd by shares"
954,1196571,"ACE VISION LIMITED (b2007-12-19)
三順有限公司",2007-12-19,2019-06-28,"Private, ltd by shares"
955,1170144,"ACE WAI HOLDINGS LIMITED
冠惠集團有限公司",2007-09-25,2013-02-08,"Private, ltd by shares"
956,1139833,"ACE WIRELESS (ASIA) LIMITED
冠通無線(亞洲)有限公司",2007-06-08,2017-03-03,"Private, ltd by shares"
957,1106615,"ACE-TEC (HK) CO., LIMITED
雅思科技(香港)有限公司",2007-02-01,2010-09-03,"Private, ltd by shares"
958,1185051,ACEA CONSULTANTS LIMITED,2007-11-13,2011-03-11,"Private, ltd by shares"
959,1134385,"ACEBO INTERNATIONAL LIMITED (HK)
藝寶國際有限公司",2007-05-21,,"Private, ltd by shares"
960,1189682,"ACEC (HK) Co., Limited",2007-11-28,2010-02-26,"Private, ltd by shares"
961,1198371,"ACECHEM (HK) INDUSTRY LIMITED
國壹化工(香港)實業有限公司",2007-12-27,2019-06-28,"Private, ltd by shares"
962,1167693,"ACECOM ELECTRONICS (HK) CO., LIMITED",2007-09-17,2009-05-08,"Private, ltd by shares"
963,1131307,"ACEFORT INSPECTION & SURVEY LIMITED
安福特公證行有限公司",2007-05-10,2019-03-01,"Private, ltd by shares"
964,1197881,"ACEKING MOULD CO. LIMITED
金源鴻精密模具有限公司",2007-12-24,2015-04-17,"Private, ltd by shares"
965,1121153,"ACELINK TECHNOLOGY CO., LIMITED
晨達科技有限公司",2007-04-04,,"Private, ltd by shares"
966,1193321,"ACELLENT GROUP (HONG KONG) HOLDINGS CO., LIMITED
飛黃集團(香港)控股有限公司",2007-12-10,2011-12-23,"Private, ltd by shares"
967,1188436,ACEMARK DISTRIBUTORS LIMITED,2007-11-23,,"Private, ltd by shares"
968,1164200,"ACEMAX INVESTMENT LIMITED (d2009-03-13)
展明投資有限公司",2007-09-04,2009-03-13,"Private, ltd by shares"
969,1147157,"ACEMED MEDICAL PRODUCTS LIMITED
愛斯美醫療用品有限公司",2007-07-05,2011-03-04,"Private, ltd by shares"
970,1152084,ACEPAC INTERNATIONAL (HK) LIMITED,2007-07-23,2011-04-29,"Private, ltd by shares"
971,1134786,"ACEPOW ELECTRONICS CO., LIMITED
愛科普電子(香港)有限公司",2007-05-22,,"Private, ltd by shares"
972,1176327,"ACERICH ENTERPRISES LIMITED
雅發企業有限公司",2007-10-17,,"Private, ltd by shares"
973,1145276,"ACESON INTERNATIONAL LIMITED
雅信國際有限公司",2007-06-28,2016-09-15,"Private, ltd by shares"
974,1173963,"ACESTAR DEVELOPMENT LIMITED
俊星發展有限公司",2007-10-09,,"Private, ltd by shares"
975,1180179,"ACESTAR HOLDINGS LIMITED (HK)
輝星集團有限公司",2007-10-30,,"Private, ltd by shares"
976,1159723,"ACESTAR INTERNATIONAL LIMITED
鼎毅國際有限公司",2007-08-20,,"Private, ltd by shares"
977,1101416,"ACETECH ENGINEERING PLASTIC CO., LIMITED",2007-01-11,2013-05-24,"Private, ltd by shares"
978,1153913,"ACETECH SILICONES COMPANY LIMITED
魯躍科技(香港)有限公司",2007-07-30,2017-09-15,"Private, ltd by shares"
979,1182439,"ACETIME ENTERPRISES LIMITED
彩泰企業有限公司",2007-11-06,,"Private, ltd by shares"
980,1182476,"ACETIME INVESTMENT LIMITED
時光投資有限公司",2007-11-06,,"Private, ltd by shares"
981,1145271,"ACETON INVESTMENT LIMITED
安東投資有限公司",2007-06-28,2012-04-05,"Private, ltd by shares"
982,1129151,ACEVIEW INVESTMENTS LIMITED,2007-05-03,,"Private, ltd by shares"
983,1110061,"ACEWELL INTERNATIONAL LIMITED
艾士維國際有限公司",2007-02-14,2012-03-02,"Private, ltd by shares"
984,1198910,"ACEWIN INDUSTRY LIMITED
榮利源實業有限公司",2007-12-28,,"Private, ltd by shares"
985,1136149,"ACEWOOD PRODUCTIONS COMPANY LIMITED
藝朗森製作有限公司",2007-05-29,,"Private, ltd by shares"
986,1109931,ACF (HONG KONG) LIMITED,2007-02-13,2009-06-12,"Private, ltd by shares"
987,1127374,ACG ASIA LIMITED,2007-04-26,,"Private, ltd by shares"
988,1115180,ACG Limited (HK),2007-03-14,2020-08-18,"Private, ltd by shares"
989,1191512,Ache Research Limited,2007-12-04,,"Private, ltd by shares"
990,1139444,"ACHEVE INTERNATIONALS LIMITED
成就國際有限公司",2007-06-07,,"Private, ltd by shares"
991,1101585,"ACHIEVE (CHINA) LIMITED
滙展(中國)有限公司",2007-01-11,,"Private, ltd by shares"
992,1141330,"ACHIEVE GLASS ENGINEERING COMPANY LIMITED
創暉玻璃工程有限公司",2007-06-14,2011-08-25,"Private, ltd by shares"
993,1143321,"ACHIEVE GLORY LIMITED
榮欽有限公司",2007-06-21,,"Private, ltd by shares"
994,1176430,"ACHIEVE LUXURY INVESTMENT LIMITED
創濠投資有限公司",2007-10-17,,"Private, ltd by shares"
995,1153185,"ACHIEVE SOURCING & LOGISTICS SERVICE CO., LIMITED
匯晟商貿發展有限公司",2007-07-26,2019-04-26,"Private, ltd by shares"
996,1176450,"ACHIEVE VIEW (HONG KONG) LIMITED
創景(香港)有限公司",2007-10-17,,"Private, ltd by shares"
997,1151669,"ACHIEVE WELL INTERNATIONAL LIMITED
眾達國際有限公司",2007-07-20,2010-12-10,"Private, ltd by shares"
998,1163726,"ACHIEVE WELL LIMITED
威齊有限公司",2007-09-03,,"Private, ltd by shares"
