,Reg no.,Name,"Incorp-
orated",Dissolved,Type
1249,913320,"ALL STARS SEA FREIGHT CO., LIMITED
全星船務代理有限公司",2004-07-23,2009-12-18,"Private, ltd by shares"
1250,892305,"ALL SUCCESS CONSTRUCTION COMPANY LIMITED
八達設計裝修工程有限公司",2004-03-29,,"Private, ltd by shares"
1251,887803,"ALL SUCCESSFUL LIMITED
逸成有限公司",2004-03-09,,"Private, ltd by shares"
1252,918190,"ALL THE BEST TRAVEL LIMITED
創新天地旅遊有限公司",2004-08-20,,"Private, ltd by shares"
1253,934930,"ALL TIME HEALTHY COMPANY LIMITED
常康健工房有限公司",2004-11-19,,"Private, ltd by shares"
1254,912032,"ALL UNION LIMITED (d2011-09-30)
上聯有限公司",2004-07-16,2011-09-30,"Private, ltd by shares"
1255,885862,"ALL WEATHER TRADING DEVELOPMENT LIMITED
全天候貿易發展有限公司",2004-03-02,2018-12-28,"Private, ltd by shares"
1256,895605,"ALL WIN TRADING (HONG KONG) CO LIMITED
香港眾盈貿易有限公司",2004-04-16,2009-07-10,"Private, ltd by shares"
1257,926670,"ALL WORLD POWER INTERNATIONAL GROUP LIMITED
全華通國際集團有限公司",2004-10-08,,"Private, ltd by shares"
1258,908241,"ALL-DO INTERNATIONAL CO., LIMITED
奧都國際有限公司",2004-06-23,2015-07-03,"Private, ltd by shares"
1259,935754,ALL-IN DEVELOPMENT LIMITED,2004-11-24,2015-11-27,"Private, ltd by shares"
1260,881679,"ALL-IN-ONE HOME SERVICE LIMITED
優閒家居服務有限公司",2004-02-06,,"Private, ltd by shares"
1261,887429,"ALL-IN-ONE TRADING CO., LIMITED (THE)
百匯(亞洲)有限公司",2004-03-08,,"Private, ltd by shares"
1262,894383,"ALL-SURPASSING POWER LIMITED
腦智心有限公司",2004-04-08,2009-10-02,"Private, ltd by shares"
1263,890604,ALLACTION CONSOLIDATORS (HK) LIMITED,2004-03-22,2010-11-26,"Private, ltd by shares"
1264,919870,ALLAMBIE COMPANY LIMITED,2004-08-30,2014-04-04,"Private, ltd by shares"
1265,889107,ALLAN & ASSOCIATES LIMITED (HK),2004-03-15,,"Private, ltd by shares"
1266,911020,ALLBEES ELECTRONICS LIMITED,2004-07-09,2007-07-13,"Private, ltd by shares"
1267,935900,"ALLBUDDY LIMITED
香港動能多媒體娛樂有限公司",2004-11-24,2007-02-02,"Private, ltd by shares"
1268,887071,"ALLCHEMICALS INDUSTRY COMPANY LIMITED
奧凱實業有限公司",2004-03-05,,"Private, ltd by shares"
1269,902851,"ALLE BUSINESS SOLUTIONS COMPANY LIMITED
一燃顧問有限公司",2004-05-24,,"Private, ltd by shares"
1270,929887,"Allen & PING Company Limited
途樂國際有限公司",2004-10-27,,"Private, ltd by shares"
1271,906671,"ALLEN ELECTRONIC COMPANY LIMITED
艾倫電子有限公司",2004-06-14,2009-11-06,"Private, ltd by shares"
1272,926694,"ALLERGY RELIEF (ASIA) LIMITED
寧康抗敏產品(亞洲)有限公司",2004-10-08,2007-08-24,"Private, ltd by shares"
1273,909520,ALLERHAND LIMITED (d2011-12-16),2004-06-30,2011-12-16,"Private, ltd by shares"
1274,897809,"ALLEZ COMPANY LIMITED
雅利興業有限公司",2004-04-28,,"Private, ltd by shares"
1275,880804,ALLFRESH TECHNOLOGIES LIMITED,2004-01-27,2012-01-20,"Private, ltd by shares"
1276,891211,ALLIANCE A INTERNATIONAL COMPANY LIMITED,2004-03-23,2008-09-05,"Private, ltd by shares"
1277,910684,"ALLIANCE ARTS&CRAFT CO., LIMITED
香港益邦工藝品有限公司",2004-07-09,,"Private, ltd by shares"
1278,939851,"ALLIANCE ASIA INVESTMENT LIMITED
盟亞投資有限公司",2004-12-13,,"Private, ltd by shares"
1279,880921,"ALLIANCE BUSINESS SERVICES LIMITED
匯泰商業服務有限公司",2004-01-28,,"Private, ltd by shares"
1280,925046,"ALLIANCE CHINA INTERNATIONAL HOLDINGS LIMITED
華頤國際有限公司",2004-09-28,2010-02-19,"Private, ltd by shares"
1281,892022,"ALLIANCE COMPANY LIMITED
盟友有限公司",2004-03-26,2007-04-04,"Private, ltd by shares"
1282,879446,"ALLIANCE CONSTRUCTION MATERIALS LIMITED
友盟建築材料有限公司",2004-01-14,,"Private, ltd by shares"
1283,892563,"ALLIANCE DESIGN COMPANY LIMITED
亞聯工程設計有限公司",2004-03-29,,"Private, ltd by shares"
1284,908417,"ALLIANCE FAR EAST LIMITED (d2009-10-09)
滙漢遠東有限公司",2004-06-25,2009-10-09,"Private, ltd by shares"
1285,881550,"ALLIANCE FINANCE COMPANY LIMITED
聯業財務有限公司",2004-02-04,,"Private, ltd by shares"
1286,880280,ALLIANCE FINANCE CORPORATION (HONG KONG) LIMITED,2004-01-21,2011-12-23,"Private, ltd by shares"
1287,906144,"ALLIANCE FRANCAISE EN CHINA LIMITED
法國-中國經貿文化發展集團有限公司",2004-06-11,2008-11-21,"Private, ltd by shares"
1288,909762,"ALLIANCE GARMENT LIMITED (d2005-08-05)
華滙製衣有限公司",2004-07-05,2005-08-05,"Private, ltd by shares"
1289,878117,"ALLIANCE GLOBAL LIMITED (d2011-06-17)
暉盟有限公司",2004-01-07,2011-06-17,"Private, ltd by shares"
1290,899170,"ALLIANCE INDUSTRIES (H.K.) LIMITED
華信工業(香港)有限公司",2004-05-03,2010-12-17,"Private, ltd by shares"
1291,900292,"ALLIANCE INTERNATIONAL COMMUNICATIONS (HOLDINGS) LIMITED
國信控股有限公司",2004-05-07,2010-12-24,"Private, ltd by shares"
1292,917929,"ALLIANCE INTERNATIONAL DEVELOPMENT LIMITED (d2005-12-23)
信邦國際發展有限公司",2004-08-18,2005-12-23,"Private, ltd by shares"
1293,902275,ALLIANCE INTERNATIONAL ELECTRONICS LIMITED,2004-05-19,,"Private, ltd by shares"
1294,917501,"ALLIANCE INTERNATIONAL INVESTMENTS LIMITED
永聯國際投資有限公司",2004-08-18,2017-06-02,"Private, ltd by shares"
1295,932023,"ALLIANCE NEWS INTERNATIONAL LIMITED
盟訊國際有限公司",2004-11-05,2012-04-27,"Private, ltd by shares"
1296,923639,ALLIANCE OF LUXURY SERVICES COMPANY LIMITED,2004-09-20,,"Private, ltd by shares"
1297,937921,"ALLIANCE POLYMER LIMITED
聯合塑料有限公司",2004-12-03,2006-08-11,"Private, ltd by shares"
1298,924645,"ALLIANCE PROPERTIES LIMITED (HK)
聯邦置業有限公司",2004-09-24,,"Private, ltd by shares"
1299,897904,"ALLIANCE RAISE INTERNATIONAL LIMITED
盟揚國際有限公司",2004-04-28,2010-09-24,"Private, ltd by shares"
1300,923462,ALLIANCE SALES LIMITED (HK),2004-09-17,,"Private, ltd by shares"
1301,941054,"ALLIANCE STAR ENTERPRISES LIMITED
忠星企業有限公司",2004-12-20,,"Private, ltd by shares"
1302,888942,"ALLIANCE STAR INTERNATIONAL LIMITED
聚星國際有限公司",2004-03-15,,"Private, ltd by shares"
1303,942930,"ALLIANCE START HOLDINGS LIMITED
協創集團有限公司",2004-12-30,,"Private, ltd by shares"
1304,942144,"ALLIANCE SUN STAR INVESTMENT HOLDINGS LIMITED
世邦聖達投資控股有限公司",2004-12-24,2019-10-25,"Private, ltd by shares"
1305,928736,"ALLIANCE TEAMWORK MARKETING (H.K.) LIMITED
小草國際企業(香港)有限公司",2004-10-20,2008-02-01,"Private, ltd by shares"
1306,918999,"ALLIANCE TECHNOLOGY LIMITED (d2011-04-21)
聯營科技有限公司",2004-08-25,2011-04-21,"Private, ltd by shares"
1307,929661,"ALLIANCE WEALTH FINANCIAL CONSULTANTS LIMITED
合發融資顧問有限公司",2004-10-25,2010-07-30,"Private, ltd by shares"
1308,932121,"ALLIANCE WEALTHY SHIPPING LIMITED
滙裕航運有限公司",2004-11-05,,"Private, ltd by shares"
1309,921096,"ALLICK ENTERPRISE CO., LIMITED
阿力克企業有限公司",2004-09-06,2007-09-07,"Private, ltd by shares"
1310,942972,"ALLIED (HK) LIMITED
卓建(香港)有限公司",2004-12-31,,"Private, ltd by shares"
1311,943093,"ALLIED ASIA GROUP LIMITED (d2015-09-11)
亞洲聯合(貿易)集團有限公司",2004-12-31,2015-09-11,"Private, ltd by shares"
1312,914642,"ALLIED ASSET (HONG KONG) LIMITED
聯置(香港)有限公司",2004-07-30,2009-12-24,"Private, ltd by shares"
1313,897146,"ALLIED ASSET INTERNATIONAL ENTERPRISE LIMITED
聯置國際企業有限公司",2004-04-23,,"Private, ltd by shares"
1314,925857,"ALLIED BASE LIMITED (d2011-06-17)
聯建有限公司",2004-10-04,2011-06-17,"Private, ltd by shares"
1315,927109,"ALLIED BEST SHIPPING LIMITED
昌滙船務有限公司",2004-10-11,,"Private, ltd by shares"
1316,910783,"ALLIED CHAIN LIMITED (d2009-01-09)
聯橋有限公司",2004-07-09,2009-01-09,"Private, ltd by shares"
1317,914415,"ALLIED CHINA INVESTMENTS LIMITED
聯華投資有限公司",2004-07-30,2016-12-02,"Private, ltd by shares"
1318,933601,"ALLIED CITY DEVELOPMENT LIMITED
聯城發展有限公司",2004-11-12,2011-03-25,"Private, ltd by shares"
1319,927144,"ALLIED COMMUNICATION LIMITED
聯合通訊科技有限公司",2004-10-11,2018-03-16,"Private, ltd by shares"
1320,894615,"ALLIED CONCORD ENTERPRISES LIMITED
合創企業有限公司",2004-04-13,2017-06-16,"Private, ltd by shares"
1321,888712,Allied Concord Logistics Limited,2004-03-12,2015-05-22,"Private, ltd by shares"
1322,908931,"ALLIED CONSULTANTS LIMITED (d2007-11-30)
聯威顧問有限公司",2004-06-28,2007-11-30,"Private, ltd by shares"
1323,926830,"ALLIED CORP INTERNATIONAL LIMITED
協營國際有限公司",2004-10-08,,"Private, ltd by shares"
1324,883567,"ALLIED COSMOS LIMITED (d2005-04-29)
信統有限公司",2004-02-18,2005-04-29,"Private, ltd by shares"
1325,924452,"ALLIED DEVELOPMENT LIMITED (d2010-03-19)
永聯發展有限公司",2004-09-24,2010-03-19,"Private, ltd by shares"
1326,914711,"ALLIED EAGLE INDUSTRIAL LIMITED (d2013-10-11)
鷹聯實業有限公司",2004-07-30,2013-10-11,"Private, ltd by shares"
1327,922014,"ALLIED EAGLE TRADING LIMITED
鷹聯貿易有限公司",2004-09-10,2007-06-15,"Private, ltd by shares"
1328,899064,"ALLIED ELECTRIC LIMITED
聯電有限公司",2004-05-03,2010-09-24,"Private, ltd by shares"
1329,914712,"ALLIED ELEGANT ENTERPRISE LIMITED
錦聯企業有限公司",2004-07-30,2014-01-16,"Private, ltd by shares"
1330,884411,"ALLIED ENVIROTECH LIMITED
聯發環保科技有限公司",2004-02-23,2019-06-14,"Private, ltd by shares"
1331,886877,"ALLIED FAITH INTERNATIONAL LIMITED
誠悅國際有限公司",2004-03-05,2011-12-02,"Private, ltd by shares"
1332,890739,"ALLIED FAITH INTERNATIONAL TRADING LIMITED
滙信國際貿易有限公司",2004-03-22,,"Private, ltd by shares"
1333,886385,"ALLIED FORD LIMITED (d2006-07-14)
統科有限公司",2004-03-03,2006-07-14,"Private, ltd by shares"
1334,921637,"ALLIED FORTUNE (H.K.) LIMITED
福豐(香港)有限公司",2004-09-08,,"Private, ltd by shares"
1335,893582,"ALLIED FRERES FINE WINE LIMITED
明豐洋酒有限公司",2004-04-02,,"Private, ltd by shares"
1336,929778,"ALLIED FULLY INVESTMENT LIMITED
協宏投資有限公司",2004-10-27,2009-03-13,"Private, ltd by shares"
1337,912533,"ALLIED GAIN LIMITED (d2008-12-24)
聯啟有限公司",2004-07-20,2008-12-24,"Private, ltd by shares"
1338,934839,"ALLIED GEAR LIMITED (d2009-04-09)
雅協有限公司",2004-11-19,2009-04-09,"Private, ltd by shares"
1339,939778,"ALLIED GLORY (CHINA) LIMITED
集安(中國)有限公司",2004-12-13,,"Private, ltd by shares"
1340,933600,"ALLIED HERO PROPERTIES LIMITED
豪滙置業有限公司",2004-11-12,2008-11-21,"Private, ltd by shares"
1341,914643,"ALLIED HILL (HONG KONG) LIMITED
滙峰(香港)有限公司",2004-07-30,2008-02-01,"Private, ltd by shares"
1342,937694,"ALLIED HONEST CORPORATION LIMITED
統誠有限公司",2004-12-03,2012-04-05,"Private, ltd by shares"
1343,889994,ALLIED IDEA INTERNATIONAL LIMITED,2004-03-19,2008-08-29,"Private, ltd by shares"
1344,918949,"ALLIED INDUSTRIES LIMITED (d2010-01-15)
聯亞工業有限公司",2004-08-25,2010-01-15,"Private, ltd by shares"
1345,938653,"ALLIED INTERNATIONAL DEVELOPMENT LIMITED
美聯國際發展有限公司",2004-12-07,2015-08-21,"Private, ltd by shares"
1346,918578,"ALLIED INTERNATIONAL INVESTMENT LIMITED (d2010-02-26)
聯業國際投資有限公司",2004-08-23,2010-02-26,"Private, ltd by shares"
1347,899229,"ALLIED INTERNATIONAL TRADING LIMITED (d2015-10-16)
聯嘉國際貿易有限公司",2004-05-03,2015-10-16,"Private, ltd by shares"
1348,938066,"ALLIED JOY INTERNATIONAL LIMITED (d2013-06-28)
滙逸國際有限公司",2004-12-03,2013-06-28,"Private, ltd by shares"
1349,885288,"ALLIED LEADING LIMITED
美卓有限公司",2004-02-27,2012-03-30,"Private, ltd by shares"
1350,886537,"ALLIED LINK INVESTMENT LIMITED (d2009-08-14)
志聯投資有限公司",2004-03-04,2009-08-14,"Private, ltd by shares"
1351,914644,"ALLIED LUCK INDUSTRIAL LIMITED (d2009-06-26)
集福實業有限公司",2004-07-30,2009-06-26,"Private, ltd by shares"
1352,924892,"ALLIED MERIT INTERNATIONAL INVESTMENT LIMITED
聯德國際投資有限公司",2004-09-27,,"Private, ltd by shares"
1353,888077,"ALLIED MOIST CHINA INVESTMENT GROUP HOLDINGS LIMITED
聯合潤華投資集團股份有限公司",2004-03-10,2008-08-15,"Private, ltd by shares"
1354,891919,"ALLIED NOBLE LIMITED
環駿有限公司",2004-03-25,,"Private, ltd by shares"
1355,933319,"ALLIED PLUS INTERNATIONAL DEVELOPMENT LIMITED
薈聚國際發展有限公司",2004-11-12,2011-12-23,"Private, ltd by shares"
1356,890514,"ALLIED POWER CORPORATION LIMITED (d2005-08-19)
聯霸有限公司",2004-03-19,2005-08-19,"Private, ltd by shares"
1357,893201,"ALLIED PREMIUM (HK) LIMITED
聯昇(香港)有限公司",2004-04-01,,"Private, ltd by shares"
1358,941864,"ALLIED PROFIT ENTERPRISES LIMITED
旭溢企業有限公司",2004-12-24,,"Private, ltd by shares"
1359,916922,"ALLIED RAINBOW LIMITED
聯虹有限公司",2004-08-13,,"Private, ltd by shares"
1360,934410,"ALLIED REGAL (HONG KONG) LIMITED
豪陞(香港)有限公司",2004-11-17,2011-06-30,"Private, ltd by shares"
1361,934344,"ALLIED REGAL DEVELOPMENT LIMITED
豪陞發展有限公司",2004-11-17,2010-06-25,"Private, ltd by shares"
1362,934359,"ALLIED REGAL HOLDINGS LIMITED
豪陞集團有限公司",2004-11-17,2009-10-30,"Private, ltd by shares"
1363,934348,"ALLIED REGAL INTERNATIONAL LIMITED
豪陞國際有限公司",2004-11-17,,"Private, ltd by shares"
1364,908650,"ALLIED RICH GROUP HOLDINGS LIMITED
富聯集團控股有限公司",2004-06-28,2019-02-01,"Private, ltd by shares"
1365,935432,"ALLIED RICHLY LIMITED (d2010-04-16)
協運有限公司",2004-11-22,2010-04-16,"Private, ltd by shares"
1366,912804,"ALLIED SHINE LIMITED (d2011-03-18)
寶趣實業有限公司",2004-07-21,2011-03-18,"Private, ltd by shares"
1367,911131,"ALLIED SIGN DEVELOPMENT LIMITED
匯誌發展有限公司",2004-07-12,2020-01-03,"Private, ltd by shares"
1368,926750,"ALLIED SKY INVESTMENT LIMITED
天集投資有限公司",2004-10-08,2008-09-05,"Private, ltd by shares"
1369,919215,"ALLIED SKY LIMITED (d2010-01-15)
合天有限公司",2004-08-25,2010-01-15,"Private, ltd by shares"
1370,888943,"ALLIED STAR INVESTMENT LIMITED
聚星投資有限公司",2004-03-15,,"Private, ltd by shares"
1371,942418,"ALLIED STRATEGIC LIMITED
協滙策略有限公司",2004-12-29,2015-02-13,"Private, ltd by shares"
1372,929317,"ALLIED STRONG LIMITED (d2006-04-13)
統強有限公司",2004-10-21,2006-04-13,"Private, ltd by shares"
1373,901108,"ALLIED SUN INVESTMENT LIMITED
雅順投資有限公司",2004-05-12,2011-11-11,"Private, ltd by shares"
1374,889683,ALLIED TACTICAL EQUIPMENTS LIMITED,2004-03-18,2010-02-12,"Private, ltd by shares"
1375,938641,"ALLIED TECH HOLDINGS LIMITED
恒科集團有限公司",2004-12-07,,"Private, ltd by shares"
1376,910140,ALLIED TELESIS SALES & MARKETING (HONG KONG) LIMITED,2004-07-07,,"Private, ltd by shares"
1377,910139,ALLIED TELESYN ASIA PACIFIC LIMITED,2004-07-07,,"Private, ltd by shares"
1378,889049,"ALLIED TOP DEVELOPMENT LIMITED
豪德發展有限公司",2004-03-15,,"Private, ltd by shares"
1379,917867,"ALLIED TOP INTERNATIONAL ENTERPRISE LIMITED
滙翔國際企業有限公司",2004-08-18,2006-12-08,"Private, ltd by shares"
1380,926744,"ALLIED VANTAGE HK LIMITED
集益香港有限公司",2004-10-08,2006-11-10,"Private, ltd by shares"
1381,904158,"ALLIED VISION CONSULTANTS LIMITED
偉倫顧問有限公司",2004-06-02,2009-07-31,"Private, ltd by shares"
1382,878489,"ALLIED WEALTH (H.K.) LIMITED
彩富(香港)有限公司",2004-01-09,2010-06-04,"Private, ltd by shares"
1383,877956,"ALLIED WEALTH INTERNATIONAL LIMITED
浩富國際有限公司",2004-01-05,2010-06-04,"Private, ltd by shares"
1384,935884,"ALLIED WELL (HK) TRADING LIMITED
匯億香港貿易有限公司",2004-11-24,2009-04-24,"Private, ltd by shares"
1385,878488,"ALLIED WELL ENTERPRISES LIMITED (d2012-09-14)
偉創企業有限公司",2004-01-07,2012-09-14,"Private, ltd by shares"
1386,904812,"ALLIED WELL INTERNATIONAL INVESTMENT HOLDINGS LIMITED
聯益國際投資集團有限公司",2004-06-04,2008-11-14,"Private, ltd by shares"
1387,916142,"ALLIED WELL INTERNATIONAL INVESTMENT LIMITED
滙益國際投資有限公司",2004-08-09,2009-03-20,"Private, ltd by shares"
1388,931829,"ALLIED WINNER TRADING LIMITED (d2009-02-20)
凱聯貿易有限公司",2004-11-05,2009-02-20,"Private, ltd by shares"
1389,913539,"ALLIMETER TECHNOLOGY (H.K.) CO., LIMITED
聯電科技(香港)有限公司",2004-07-26,,"Private, ltd by shares"
1390,909400,ALLIN DECOR LIMITED,2004-06-30,2011-03-04,"Private, ltd by shares"
1391,939115,"ALLINK INVESTMENT LIMITED (d2009-01-23)
藝聯投資有限公司",2004-12-10,2009-01-23,"Private, ltd by shares"
1392,915178,"ALLMART FOOD LIMITED
萬有食品有限公司",2004-08-04,2006-08-18,"Private, ltd by shares"
1393,903900,"ALLOCHINE ENTERPRISE COMPANY LIMITED
加華愛隆企業有限公司",2004-06-02,2017-11-03,"Private, ltd by shares"
1394,923121,ALLOS DESIGN LIMITED,2004-09-17,,"Private, ltd by shares"
1395,896110,ALLPORT CHINA LIMITED,2004-04-19,,"Private, ltd by shares"
1396,928983,"ALLPOWER INDUSTRIAL LIMITED
萬能實業有限公司",2004-10-20,,"Private, ltd by shares"
1397,892386,"ALLRIGHT MEDIA PRODUCTION LIMITED
安威製作有限公司",2004-03-29,2005-08-26,"Private, ltd by shares"
1398,879069,ALLRIGHTSRESERVED LIMITED,2004-01-12,,"Private, ltd by shares"
1399,938170,ALLSEAS CARGO (HONG KONG) LIMITED,2004-12-06,2013-07-26,"Private, ltd by shares"
1400,938387,ALLSEEDS GROUP LIMITED,2004-12-06,2013-03-08,"Private, ltd by shares"
1401,922441,"ALLSIGHT INTERNATIONAL LIMITED
匯景國際企業有限公司",2004-09-13,,"Private, ltd by shares"
1402,942938,"ALLSON TAZA LIMITED
全傑出口有限公司",2004-12-31,2015-04-17,"Private, ltd by shares"
1403,881179,"ALLTOP INVESTMENT (HONG KONG) COMPANY LIMITED
傲挺投資(香港)有限公司",2004-01-30,2016-07-15,"Private, ltd by shares"
1404,892959,ALLWEALTH CORPORATION LIMITED,2004-03-31,2006-12-01,"Private, ltd by shares"
1405,923658,"ALLWELL AUTO & COMMUNICATIONS LIMITED
廣豐通訊汽貿有限公司",2004-09-20,2007-05-18,"Private, ltd by shares"
1406,888208,"ALLWELL INDUSTRIAL COMPANY LIMITED
澳維實業有限公司",2004-03-10,,"Private, ltd by shares"
1407,905874,"ALLWELL PROPERTY LIMITED
溢駿地產有限公司",2004-06-09,,"Private, ltd by shares"
1408,941405,ALLWIN ASIA LIMITED,2004-12-22,2016-03-24,"Private, ltd by shares"
1409,881685,"ALLWIN GLOBAL LIMITED
三贏有限公司",2004-02-06,2011-09-09,"Private, ltd by shares"
1410,931992,"ALLWIN LIMITED (HK)
雅力威有限公司",2004-11-05,,"Private, ltd by shares"
1411,903449,ALLWISE INVESTMENT CORPORATION (H.K.) LIMITED,2004-05-27,2008-11-07,"Private, ltd by shares"
1412,922123,"ALLY CORPORATION LIMITED (d2009-01-30)
雅賢集團有限公司",2004-09-10,2009-01-30,"Private, ltd by shares"
1413,891481,"ALLY ENGINEERING (HK) COMPANY LIMITED
雅麗科技(香港)有限公司",2004-03-24,,"Private, ltd by shares"
1414,896860,ALLY LAND LIMITED,2004-04-23,2015-01-23,"Private, ltd by shares"
1415,932880,"ALLYES (ASIA) CO. LIMITED
永創(亞洲)有限公司",2004-11-10,2007-03-30,"Private, ltd by shares"
1416,900794,ALMA TRADING LIMITED (HK),2004-05-12,,"Private, ltd by shares"
1417,918342,"ALMAS TRADING CO., LIMITED",2004-08-20,2009-01-16,"Private, ltd by shares"
1418,937018,ALMAYOR.COM LIMITED,2004-11-30,2011-08-19,"Private, ltd by shares"
1419,916581,"ALMET INTERNATIONAL (H.K.) CO., LIMITED
亞美國際(香港)有限公司",2004-08-11,2006-11-10,"Private, ltd by shares"
1420,884723,"ALMIGHTY EDUCATION LIMITED
全能教育有限公司",2004-02-25,2007-09-07,"Private, ltd by shares"
1421,920999,"ALODE (Hong Kong) Company Limited
埃爾地(香港)有限公司",2004-09-03,2009-04-24,"Private, ltd by shares"
1422,931952,"ALOEMASTERCARE (HONG KONG) CO., LIMITED
蘆薈護理(香港)有限公司",2004-11-05,2007-07-13,"Private, ltd by shares"
1423,886460,"ALOFT TECHNOLOGY COMPANY LIMITED
邏庫科技有限公司",2004-03-03,,"Private, ltd by shares"
1424,919040,"ALOHA LIMITED (HK)
置友有限公司",2004-08-25,,"Private, ltd by shares"
1425,887227,"ALOT ENTERPRISE COMPANY LIMITED
雅洛企業有限公司",2004-03-08,,"Private, ltd by shares"
1426,899529,ALPAMART HOLDINGS LIMITED,2004-05-05,,"Private, ltd by shares"
1427,921023,ALPEXCO LIMITED,2004-09-03,,"Private, ltd by shares"
1428,923971,"ALPHA & LEADER ASSOCIATES LIMITED
安華理達咨詢事務所有限公司",2004-09-22,,"Private, ltd by shares"
1429,878310,"ALPHA & OMEGA SEMICONDUCTOR (HONG KONG) LIMITED
萬國半導體(香港)股份有限公司",2004-01-07,,"Private, ltd by shares"
1430,903136,"ALPHA BEST LIMITED
偉騰有限公司",2004-05-27,2015-05-08,"Private, ltd by shares"
1431,907883,"ALPHA BEST SERVICES LIMITED
一佳服務有限公司",2004-06-21,,"Private, ltd by shares"
1432,932542,ALPHA CAPITAL TRADING LIMITED,2004-11-08,,"Private, ltd by shares"
1433,884029,ALPHA CHANCE INVESTMENTS LIMITED,2004-02-20,2012-01-13,"Private, ltd by shares"
1434,901631,ALPHA CHINA AVIATION LIMITED,2004-05-17,2012-09-28,"Private, ltd by shares"
1435,882538,"ALPHA CONCEPT INDUSTRIAL (H.K.) LIMITED
卓念實業有限公司",2004-02-13,2006-07-14,"Private, ltd by shares"
1436,887672,"ALPHA CONSORTIUM INVESTMENT CHINA LIMITED
第一國際投資(中國)有限公司",2004-03-09,2012-04-13,"Private, ltd by shares"
1437,916960,"Alpha Contractors Limited
亞洲(香港)屋宇工程有限公司",2004-08-13,,"Private, ltd by shares"
1438,912065,"ALPHA EPOCH LIMITED
江御有限公司",2004-07-16,2008-04-03,"Private, ltd by shares"
1439,919021,"ALPHA EXECUTIVE TRAINING CO., LIMITED
奧華管理培訓有限公司",2004-08-25,,"Private, ltd by shares"
1440,937283,"Alpha Financial Group Limited
首盛資本集團有限公司",2004-11-30,,"Private, ltd by shares"
1441,926225,ALPHA FLOORS LIMITED,2004-10-06,,"Private, ltd by shares"
1442,889125,ALPHA FORCE TECHNOLOGY LIMITED,2004-03-15,2010-02-05,"Private, ltd by shares"
1443,887085,"ALPHA FUTURE DEVELOPMENTS LIMITED
普佳發展有限公司",2004-03-05,2008-03-20,"Private, ltd by shares"
1444,887040,"ALPHA FUTURE INVESTMENTS LIMITED
騰毅投資有限公司",2004-03-05,2010-03-05,"Private, ltd by shares"
1445,930235,"ALPHA GENERAL LIMITED (d2010-03-26)
將軍有限公司",2004-10-27,2010-03-26,"Private, ltd by shares"
1446,889988,ALPHA GLOBAL INVESTMENTS LIMITED (HK),2004-03-19,2018-11-23,"Private, ltd by shares"
1447,930330,"ALPHA IDEA INTERNATIONAL LIMITED
星滿國際有限公司",2004-10-29,,"Private, ltd by shares"
1448,925767,"ALPHA INTERNATIONAL HONG KONG LIMITED
歐樺國際香港有限公司",2004-10-04,,"Private, ltd by shares"
1449,891702,"ALPHA LOGIC LIMITED (d2006-12-01)
絮意有限公司",2004-03-25,2006-12-01,"Private, ltd by shares"
1450,890631,"ALPHA MERIT LIMITED
美毅有限公司",2004-03-22,2006-12-08,"Private, ltd by shares"
1451,930341,"ALPHA MIND HOLDINGS LIMITED
興智控股有限公司",2004-10-29,2014-10-24,"Private, ltd by shares"
1452,901073,ALPHA PARTNERS COMPANY LIMITED,2004-05-12,,"Private, ltd by shares"
1453,927389,"ALPHA PINE LIMITED
松益有限公司",2004-10-13,2012-11-16,"Private, ltd by shares"
1454,930460,"ALPHA PLUS CO., LIMITED",2004-10-29,2010-03-26,"Private, ltd by shares"
1455,943132,"ALPHA START LIMITED (HK)
建翔有限公司",2004-12-31,,"Private, ltd by shares"
1456,922103,ALPHA TACTICS COMPANY LIMITED,2004-09-10,2010-09-24,"Private, ltd by shares"
1457,924286,"ALPHA TEAM INVESTMENT LIMITED
冠君投資有限公司",2004-09-22,2011-04-15,"Private, ltd by shares"
1458,911358,"ALPHA TECH EDUCATION CENTRE LIMITED
甲子園電腦教育中心有限公司",2004-07-12,,"Private, ltd by shares"
1459,903422,"ALPHA TECHNOLOGY LIMITED (HK)
創新科技有限公司",2004-05-27,,"Private, ltd by shares"
1460,917277,"ALPHA TIME LIMITED (d2007-10-12)
翔泰有限公司",2004-08-16,2007-10-12,"Private, ltd by shares"
1461,923647,"ALPHA VICTORY TRADING CO., LIMITED",2004-09-20,2010-07-16,"Private, ltd by shares"
1462,918027,ALPHA WAY INVESTMENT & CONSULTANT LIMITED,2004-08-20,,"Private, ltd by shares"
1463,880938,"ALPHA WIN INTERNATIONAL LIMITED
青雲國際有限公司",2004-01-28,2007-12-14,"Private, ltd by shares"
1464,901500,"Alpha-C Group Limited
原創力集團有限公司",2004-05-17,,"Private, ltd by shares"
1465,937419,"ALPHA-MOBILE CO., LIMITED
毅達移動通信有限公司",2004-12-01,2010-08-27,"Private, ltd by shares"
1466,939424,"ALPHABET COMPANY LIMITED (d2011-07-29)
阿法貝有限公司",2004-12-10,2011-07-29,"Private, ltd by shares"
1467,932501,"ALPHALAND HOLDINGS COMPANY LIMITED
佳來控股有限公司",2004-11-08,2011-04-01,"Private, ltd by shares"
1468,891010,"ALPHAMAX LIMITED (d2016-03-11)
滙庭國際有限公司",2004-03-23,2016-03-11,"Private, ltd by shares"
1469,896585,ALPHAPLUS CAPITAL LIMITED (d2006-09-29),2004-04-21,2006-09-29,"Private, ltd by shares"
1470,923459,"ALPHARD TIME COMPANY LIMITED
創時錶業有限公司",2004-09-17,2011-05-13,"Private, ltd by shares"
1471,913008,"ALPHARX LIFE SCIENCES LIMITED
康發生物科技有限公司",2004-07-21,2020-05-29,"Private, ltd by shares"
1472,939452,"ALPHATEK INTERNATIONAL LIMITED
逸華科技有限公司",2004-12-10,2008-06-20,"Private, ltd by shares"
1473,921554,"ALPHATIME MANUFACTURING COMPANY LIMITED
雅發時計有限公司",2004-09-08,2016-07-15,"Private, ltd by shares"
1474,936470,ALPHEUS ACCOUNTING SERVICES LIMITED,2004-11-26,2010-04-23,"Private, ltd by shares"
1475,903415,ALPHINE INVESTMENT LIMITED,2004-05-27,2015-11-27,"Private, ltd by shares"
1476,895223,"ALPHORN (HK) LIMITED (d2007-12-28)
晟業(香港)有限公司",2004-04-15,2007-12-28,"Private, ltd by shares"
1477,906449,"ALPINE TRADING (HK) LIMITED
埃派貿易(香港)有限公司",2004-06-11,2008-05-02,"Private, ltd by shares"
1478,878821,"ALPS ENGINEERING CO. LIMITED
恒地建設有限公司",2004-01-09,,"Private, ltd by shares"
1479,937417,ALPS FINANCIAL GROUP (ASIA) LIMITED,2004-12-01,2010-04-23,"Private, ltd by shares"
