,Reg no.,Name,"Incorp-
orated",Dissolved,Type
3171,1757423,"ALICE INTERNATION INC LIMITED
愛佳國際有限公司",2012-06-08,2019-03-29,"Private, ltd by shares"
3172,1752235,"ALICE MEDIA CO., LIMITED",2012-05-29,,"Private, ltd by shares"
3173,1699626,ALICIA BIANCA GROUP LIMITED,2012-01-16,2013-08-30,"Private, ltd by shares"
3174,1781608,ALICODESTINY FURNITURE NIG LIMITED,2012-08-02,2018-04-20,"Private, ltd by shares"
3175,1699663,ALICOM LIMITED (d2016-09-09),2012-01-16,2016-09-09,"Private, ltd by shares"
3176,1821168,ALICORN SEARCH LIMITED,2012-11-05,2018-07-13,"Private, ltd by shares"
3177,1749066,"Alifecom International Limited
華壹國際有限公司",2012-05-23,2019-03-08,"Private, ltd by shares"
3178,1791969,Alifield Limited,2012-08-27,,"Private, ltd by shares"
3179,1729588,ALIGATOR HK LIMITED,2012-04-16,,"Private, ltd by shares"
3180,1739669,"Alightek Co., Limited
奧萊特科技有限公司",2012-05-03,,"Private, ltd by shares"
3181,1800763,Align International Education Limited,2012-09-14,,"Private, ltd by shares"
3182,1719872,"ALIGN PROJECT CONSULTANCY LIMITED
創聯工程顧問有限公司",2012-03-23,,"Private, ltd by shares"
3183,1698647,"ALIK PROMOTION LIMITED
阿力推廣製作有限公司",2012-01-12,,"Private, ltd by shares"
3184,1700292,Alike Limited (HK),2012-01-18,2019-11-29,"Private, ltd by shares"
3185,1740157,"Aliko (HK) Limited
雅力高(香港)有限公司",2012-05-04,2020-07-03,"Private, ltd by shares"
3186,1837745,"Alilo Digital Technology Co., Limited
阿李羅數碼科技有限公司",2012-12-12,,"Private, ltd by shares"
3187,1742920,"ALIM PRIMA EMPLOYMENT AGENCY LIMITED
易佳行僱傭有限公司",2012-05-10,2016-11-18,"Private, ltd by shares"
3188,1818940,"ALIM TRADING CO., LIMITED",2012-10-31,,"Private, ltd by shares"
3189,1758608,"ALIMAMA INTERNATIONAL GROUP LIMITED
阿裏瑪瑪國際集團有限公司",2012-06-12,2020-04-29,"Private, ltd by shares"
3190,1761619,ALIMAN CO. LIMITED,2012-06-18,2018-11-23,"Private, ltd by shares"
3191,1843645,ALIMARE INTERNATIONAL LIMITED,2012-12-27,2018-09-07,"Private, ltd by shares"
3192,1723982,ALIMART GROUP LIMITED,2012-04-05,,"Private, ltd by shares"
3193,1707926,"ALIN GROUP TRADING CO., LIMITED
粵淩貿易有限公司",2012-02-21,,"Private, ltd by shares"
3194,1724806,"ALIN OVERSEA TRADING CO., LIMITED
艾林海外貿易有限公司",2012-04-08,2013-09-13,"Private, ltd by shares"
3195,1794140,"Alink Interior Design Limited
連城工程設計有限公司",2012-08-31,2013-07-12,"Private, ltd by shares"
3196,1744392,ALIOCHA LIMITED,2012-05-14,2017-01-06,"Private, ltd by shares"
3197,1836940,"Aliot Technology Group Co., Limited
奕帆科技集團有限公司",2012-12-10,,"Private, ltd by shares"
3198,1806137,"Alioth Marketing Company Limited
天衡文化推廣有限公司",2012-09-27,2018-08-03,"Private, ltd by shares"
3199,1797807,ALIPAY LIMITED,2012-09-10,2013-08-23,"Private, ltd by shares"
3200,1715624,"ALIQAPU (HK) HOLDINGS LIMITED
阿里卡普(香港)集團有限公司",2012-03-12,2016-11-04,"Private, ltd by shares"
3201,1718426,Aliquantum Partners Limited,2012-03-20,2019-12-13,"Private, ltd by shares"
3202,1840761,"ALIREZA TRADING CO., LIMITED",2012-12-18,,"Private, ltd by shares"
3203,1799902,Alis Pharma Limited,2012-09-13,,"Private, ltd by shares"
3204,1777766,"ALISA PROMO INDUSTRIAL LIMITED
艾麗莎貿易有限公司",2012-07-24,,"Private, ltd by shares"
3205,1837199,"ALISER COMPANY LIMITED
愛莉莎有限公司",2012-12-11,2015-10-16,"Private, ltd by shares"
3206,1780147,"ALISH INDUSTRIAL & TRADING CO., LIMITED
愛麗舍工貿有限公司",2012-07-30,2018-04-06,"Private, ltd by shares"
3207,1750199,"ALISIDUN (HK) KITCHEN TOILET ELECTRIC APPLIANCES LIMITED
阿裏斯頓(香港) 廚衛電器有限公司",2012-05-25,2016-01-15,"Private, ltd by shares"
3208,1710733,"ALISON INSTRUMENT (HONGKONG) CO. LIMITED
艾利森儀器(香港)有限公司",2012-02-28,,"Private, ltd by shares"
3209,1791516,"Alisun International Co., Limited
阿里山國際有限公司",2012-08-24,2019-02-15,"Private, ltd by shares"
3210,1761480,"ALITE LIGHTING & ELECTRIC CO., LIMITED
阿裏特照明電器有限公司",2012-06-18,,"Private, ltd by shares"
3211,1713859,ALIXHTE LIMITED,2012-03-07,2018-09-07,"Private, ltd by shares"
3212,1844506,Alize Noire de Nova Limited,2012-12-28,2020-03-27,"Private, ltd by shares"
3213,1699273,"Alizwao Limited
阿思哇有限公司",2012-01-13,,"Private, ltd by shares"
3214,1722388,"ALJAZEERA IMPORT & EXPORT CO., LIMITED",2012-04-02,2017-11-24,"Private, ltd by shares"
3215,1768917,"ALJAZIRA INTERNATIONAL TRADING CO., LIMITED",2012-07-05,,"Private, ltd by shares"
3216,1831621,"ALK LIMITED (HK)
奧來康國際發展有限公司",2012-11-28,2018-08-03,"Private, ltd by shares"
3217,1793924,"ALK WATCHES CO., LIMITED
時影鐘錶禮品有限公司",2012-08-30,,"Private, ltd by shares"
3218,1787987,Alkaline Capital Limited,2012-08-16,2015-02-13,"Private, ltd by shares"
3219,1702908,"ALKAMIL ELECT EQUIP TRADING CO., LIMITED",2012-02-03,2015-10-30,"Private, ltd by shares"
3220,1774238,"ALKARAR TRADING COMPANY LIMITED
艾爾卡拉貿易有限公司",2012-07-17,2020-05-22,"Private, ltd by shares"
3221,1705559,ALKARNAK GROUP LIMITED,2012-02-14,2015-10-02,"Private, ltd by shares"
3222,1779649,"ALKHALIL TRADING CO., LIMITED",2012-07-27,,"Private, ltd by shares"
3223,1748756,ALKIN LIMITED,2012-05-23,,"Private, ltd by shares"
3224,1806083,ALKMAR COMPANY AND ASSOCIATES LIMITED,2012-09-27,2015-04-24,"Private, ltd by shares"
3225,1767225,ALKO INTERNATIONAL LIMITED,2012-06-29,,"Private, ltd by shares"
3226,1731253,"ALKON ELECTRONIC CO., LIMITED
艾強電子有限公司",2012-04-18,2019-02-08,"Private, ltd by shares"
3227,1725340,"ALKOTOOB TRADING CO., LIMITED
庫圖貿易有限公司",2012-04-10,2017-11-24,"Private, ltd by shares"
3228,1705657,ALKRI LIMITED,2012-02-14,2017-05-12,"Private, ltd by shares"
3229,1813197,ALL 4 YOU LIMITED,2012-10-17,,"Private, ltd by shares"
3230,1752465,"ALL ABOUT NATURE (HOLDINGS) LIMITED
尚天然集團有限公司",2012-05-30,,"Private, ltd by shares"
3231,1742423,All About Technology Limited,2012-05-09,2017-07-07,"Private, ltd by shares"
3232,1814056,ALL ABOUT YOU LIMITED (d2015-03-06),2012-10-19,2015-03-06,"Private, ltd by shares"
3233,1771902,"All Access International Travel (HK) Limited
聚眾暢行(香港)國際旅遊有限公司",2012-07-11,2017-02-03,"Private, ltd by shares"
3234,1762435,"ALL ANGLES STRATEGIC CONSULTANCY LIMITED
全方略顧問有限公司",2012-06-20,,"Private, ltd by shares"
3235,1739050,ALL ASSET MANAGEMENT (ASIA) LIMITED,2012-05-02,,"Private, ltd by shares"
3236,1749501,"ALL AWARDS LIMITED (HK)
和全有限公司",2012-05-24,,"Private, ltd by shares"
3237,1739768,"ALL BENEFIT INTERNATIONAL B&T LIMITED
萬益國際商貿有限公司",2012-05-03,2017-12-08,"Private, ltd by shares"
3238,1757796,"All Berries Limited
全莓有限公司",2012-06-11,2014-12-19,"Private, ltd by shares"
3239,1761819,"ALL BEST (CHINA) LIMITED
富力(中國)有限公司",2012-06-19,,"Private, ltd by shares"
3240,1754084,"ALL BEST GLOBAL LIMITED
一片紅環球有限公司",2012-06-01,,"Private, ltd by shares"
3241,1712086,"ALL BEST HOLDINGS LIMITED
通裕集團有限公司",2012-03-01,,"Private, ltd by shares"
3242,1787693,"ALL BEST PROPERTIES LIMITED
駿高置業有限公司",2012-08-16,,"Private, ltd by shares"
3243,1819324,"ALL BESTWAY LIMITED (d2017-07-07)
灃全有限公司",2012-11-01,2017-07-07,"Private, ltd by shares"
3244,1701423,ALL BETTER LIMITED,2012-01-21,2015-09-25,"Private, ltd by shares"
3245,1710349,"ALL BILLION LIMITED
億同有限公司",2012-02-27,,"Private, ltd by shares"
3246,1704883,"ALL BLUE INTERNATIONAL CO., LIMITED",2012-02-10,2016-10-07,"Private, ltd by shares"
3247,1834621,"ALL BRIGHT TRADING DEVELOP LIMITED
全輝貿易拓展有限公司",2012-12-04,,"Private, ltd by shares"
3248,1797873,ALL BRILLIANCE FURNITURE LIMITED,2012-09-10,2016-04-29,"Private, ltd by shares"
3249,1696495,"ALL BUSINESS LIMITED (d2016-02-12)
多業有限公司",2012-01-05,2016-02-12,"Private, ltd by shares"
3250,1758618,"ALL CAPITAL CORPORATION LIMITED
盛京有限公司",2012-06-12,,"Private, ltd by shares"
3251,1797447,"ALL CENTRAL TRADING LIMITED
中心貿易有限公司",2012-09-07,2014-04-17,"Private, ltd by shares"
3252,1723825,"ALL CHAMP (HONG KONG) LIMITED
全旺(香港)有限公司",2012-04-05,,"Private, ltd by shares"
3253,1793562,"ALL CHAMPION INTERNATIONAL DEVELOP LIMITED
百冠國際拓展有限公司",2012-08-30,2017-05-05,"Private, ltd by shares"
3254,1844542,"ALL CHAMPION TRADING DEVELOP LIMITED (d2016-08-19)
全冠貿易拓展有限公司",2012-12-28,2016-08-19,"Private, ltd by shares"
3255,1697688,"ALL CHAMPIONS CORPORATION LIMITED
泛冠有限公司",2012-01-10,,"Private, ltd by shares"
3256,1733441,"ALL CHEER LIMITED
捷澤有限公司",2012-04-20,,"Private, ltd by shares"
3257,1701391,"ALL CHINA LIMITED
萃華有限公司",2012-01-20,,"Private, ltd by shares"
3258,1842312,ALL COMMODITY LIMITED,2012-12-21,,"Private, ltd by shares"
3259,1709390,ALL CORRECT LANGUAGE SOLUTIONS LIMITED,2012-02-24,,"Private, ltd by shares"
3260,1809845,ALL CRANE LIMITED,2012-10-09,2018-11-23,"Private, ltd by shares"
3261,1743159,"All Day Health Products Company Limited
全日保健品專門店有限公司",2012-05-10,,"Private, ltd by shares"
3262,1843759,All Distributions HK Limited,2012-12-27,2019-05-17,"Private, ltd by shares"
3263,1757223,"ALL DRAGON CORPORATION LIMITED
互龍有限公司",2012-06-08,,"Private, ltd by shares"
3264,1811302,"ALL DRAGON PROPERTIES LIMITED
互龍地產有限公司",2012-10-12,2015-03-20,"Private, ltd by shares"
3265,1819311,"ALL DYNAMIC GROUP LIMITED
鴻協集團有限公司",2012-10-31,,"Private, ltd by shares"
3266,1696054,"ALL ELITE LIMITED (b2012-01-04)
暉全有限公司",2012-01-04,,"Private, ltd by shares"
3267,1742572,"ALL ENERGY CONSULTANTS INTERNATIONAL LIMITED
能源咨詢國際有限公司",2012-05-10,2017-02-24,"Private, ltd by shares"
3268,1733297,"ALL ETRADING (HONG KONG) CO., LIMITED
奧易通貿易(香港)有限公司",2012-04-20,2018-08-31,"Private, ltd by shares"
3269,1842441,"ALL EXCEL LIMITED
卓萃有限公司",2012-12-21,,"Private, ltd by shares"
3270,1702106,"ALL EXCELLENCE LIMITED
鴻升國際集團有限公司",2012-01-30,,"Private, ltd by shares"
3271,1746884,"ALL FAITH BUSINESS&INDUSTRY COMPANY LIMITED
信隆工貿有限公司",2012-05-18,,"Private, ltd by shares"
3272,1770903,"ALL FAITH CORPORATION LIMITED
信全有限公司",2012-07-10,,"Private, ltd by shares"
3273,1733896,"ALL FAITH TRADING LIMITED
信隆貿易有限公司",2012-04-20,2017-12-01,"Private, ltd by shares"
3274,1697195,"ALL FAMOUS LIMITED
全丰有限公司",2012-01-06,,"Private, ltd by shares"
3275,1754423,"ALL FANCY LIMITED
聯孚有限公司",2012-06-01,,"Private, ltd by shares"
3276,1815868,"ALL FINE ELECTRIC CO., LIMITED
萬嘉電氣有限公司",2012-10-24,,"Private, ltd by shares"
3277,1836511,ALL FOCUS LIMITED,2012-12-08,,"Private, ltd by shares"
3278,1772209,ALL FOR TRADE COMPANY LIMITED,2012-07-12,2017-03-03,"Private, ltd by shares"
3279,1774620,"ALL FORTUNE (HONG KONG) ELECTRIC CO., LIMITED
安發(香港)電子有限公司",2012-07-17,,"Private, ltd by shares"
3280,1797395,"ALL GENERAL LIMITED
同善有限公司",2012-09-07,,"Private, ltd by shares"
3281,1797425,"ALL GOOD HARVEST LIMITED
多興旺有限公司",2012-09-07,,"Private, ltd by shares"
3282,1844193,"ALL GOODWILL LIMITED
溢泓有限公司",2012-12-28,2016-08-19,"Private, ltd by shares"
3283,1787813,"ALL GRACE INTERNATIONAL LIMITED
嘉滿國際有限公司",2012-08-16,2016-05-27,"Private, ltd by shares"
3284,1758622,"ALL GRAIN LIMITED
禾展有限公司",2012-06-12,2016-12-30,"Private, ltd by shares"
3285,1779446,"ALL GRAND CORPORATION LIMITED
普泰有限公司",2012-07-27,,"Private, ltd by shares"
3286,1796355,"ALL GRAND ENTERPRISE LIMITED
朗加企業有限公司",2012-09-05,2019-04-18,"Private, ltd by shares"
3287,1723524,"ALL GREAT LIMITED (HK)
全良有限公司",2012-04-05,,"Private, ltd by shares"
3288,1766597,"ALL GROUP INVESTMENT LIMITED
滙合投資有限公司",2012-06-28,,"Private, ltd by shares"
3289,1811565,"ALL HAPPINESS LIMITED (d2014-09-26)
喜仁有限公司",2012-10-12,2014-09-26,"Private, ltd by shares"
3290,1698943,"ALL HAPPY CORPORATION LIMITED
樂全有限公司",2012-01-12,,"Private, ltd by shares"
3291,1733108,"ALL HAPPY PROFIT LIMITED
喜利多有限公司",2012-04-20,,"Private, ltd by shares"
3292,1826474,"ALL HARBOUR LIMITED
全港有限公司",2012-11-16,,"Private, ltd by shares"
3293,1826922,"ALL HARVEST CORPORATION LIMITED (d2016-04-08)
豐弘有限公司",2012-11-16,2016-04-08,"Private, ltd by shares"
3294,1813806,"ALL HARVEST HOLDINGS LIMITED
多豐集團有限公司",2012-10-18,2019-01-25,"Private, ltd by shares"
3295,1808380,"ALL HARVEST TECH LIMITED
長旺達有限公司",2012-10-05,2015-07-10,"Private, ltd by shares"
3296,1843753,All Holdings HK Limited,2012-12-27,2016-12-09,"Private, ltd by shares"
3297,1762292,"ALL HONOR TECHNOLOGY (HK) LIMITED
眾信科技(香港)有限公司",2012-06-19,2017-12-29,"Private, ltd by shares"
3298,1777801,"ALL HOSES HOLDING LIMITED
沃爾管業控股有限公司",2012-07-24,2018-07-20,"Private, ltd by shares"
3299,1814292,"ALL HYDRAULICS HK CO., LIMITED",2012-10-19,,"Private, ltd by shares"
3300,1712501,"ALL IMPACT LIMITED
萃力有限公司",2012-03-02,,"Private, ltd by shares"
3301,1824315,"ALL IN ALL CO., LIMITED
國度互聯股份有限公司",2012-11-12,,"Private, ltd by shares"
3302,1818463,"ALL IN ONE ELECTRONICS (HK) CO., LIMITED
環禾電子(香港)股份有限公司",2012-10-30,,"Private, ltd by shares"
3303,1793626,"ALL INTERNATIONAL CO., LIMITED",2012-08-30,,"Private, ltd by shares"
3304,1843899,"ALL IS GOOD LIMITED
甚麼都好有限公司",2012-12-27,2017-08-25,"Private, ltd by shares"
3305,1712514,"ALL JOY CORPORATION LIMITED
欣全有限公司",2012-03-02,,"Private, ltd by shares"
3306,1819509,"ALL KEEN INTERNATIONAL LIMITED
銳豐國際有限公司",2012-11-01,2018-07-06,"Private, ltd by shares"
3307,1756910,"ALL KIND LIMITED (b2012-06-07)
德全有限公司",2012-06-07,2018-03-02,"Private, ltd by shares"
3308,1697647,"ALL KNOWN TECHNOLOGY LIMITED
全能科技有限公司",2012-01-09,2013-12-13,"Private, ltd by shares"
3309,1701013,"ALL LIFTING CO., LIMITED",2012-01-19,,"Private, ltd by shares"
3310,1766881,"All Light Creative Limited
威光文化有限公司",2012-06-28,,"Private, ltd by shares"
3311,1807106,"ALL LIKE INTERNATIONAL TRADING CO., LIMITED
奧萊克國際貿易有限公司",2012-10-03,,"Private, ltd by shares"
3312,1727123,"ALL LOVE ACCESSORIES CO., LIMITED",2012-04-12,2019-04-26,"Private, ltd by shares"
3313,1813381,"ALL LUCK ASIA PACIFIC LIMITED
祥盛亞太有限公司",2012-10-18,2018-07-13,"Private, ltd by shares"
3314,1736366,"ALL LUCK DEVELOP LIMITED
世運拓展有限公司",2012-04-26,2015-12-18,"Private, ltd by shares"
3315,1733814,"ALL LUCK DEVELOPMENT LIMITED
滿福發展有限公司",2012-04-20,2019-01-25,"Private, ltd by shares"
3316,1812236,"All Luck International Source Co., Limited
長運國際資源有限公司",2012-10-16,,"Private, ltd by shares"
3317,1802087,"ALL LUCK SEA PRODUCTS LIMITED
亨運通海產有限公司",2012-09-19,,"Private, ltd by shares"
3318,1713806,"ALL MASTER CORPORATION LIMITED
萬事達興業有限公司",2012-03-06,,"Private, ltd by shares"
3319,1699559,"ALL MOUNT LIMITED
群山有限公司",2012-01-13,,"Private, ltd by shares"
3320,1765917,"ALL NATURAL DEVELOPMENT LIMITED
天然發展有限公司",2012-06-27,,"Private, ltd by shares"
3321,1808347,ALL NIPPON PEARL (HK) LIMITED,2012-10-05,,"Private, ltd by shares"
3322,1792029,ALL OCEAN SERVICES LIMITED (d2014-11-07),2012-08-27,2014-11-07,"Private, ltd by shares"
3323,1712926,"All One Industrial Co., Limited
沃龍實業有限公司",2012-03-05,2020-07-24,"Private, ltd by shares"
3324,1702287,"ALL ONE INTERNATIONAL LIMITED
佑凡國際有限公司",2012-01-30,2018-04-27,"Private, ltd by shares"
3325,1789810,"ALL PARTS INTERNATIONAL LIMITED
奧帕斯國際有限公司",2012-08-21,,"Private, ltd by shares"
3326,1703024,"ALL PEACE LIMITED
豐和有限公司",2012-02-03,,"Private, ltd by shares"
3327,1699571,"ALL PLAN LIMITED
全圖有限公司",2012-01-13,2017-08-11,"Private, ltd by shares"
3328,1792696,"ALL PORT LIMITED
萃港有限公司",2012-08-28,2019-09-27,"Private, ltd by shares"
3329,1698763,"ALL POWER DEVELOPMENT LIMITED
通力發展有限公司",2012-01-12,2015-09-18,"Private, ltd by shares"
3330,1827429,"All Power Electronic Technology (HK) Limited
昊擎電子科技(香港)有限公司",2012-11-19,2016-07-15,"Private, ltd by shares"
3331,1795760,"All Power Energy International Co. Limited
全動力油品國際貿易有限公司",2012-09-04,2017-05-05,"Private, ltd by shares"
3332,1795751,"All Power International Investment Co. Limited
全動力國際投資有限公司",2012-09-04,2017-05-05,"Private, ltd by shares"
3333,1704111,All Products Asia Trading Services Limited,2012-02-08,,"Private, ltd by shares"
3334,1750005,"ALL PROFIT DEVELOP LIMITED
利和拓展有限公司",2012-05-24,,"Private, ltd by shares"
3335,1804731,"ALL PROFIT HONG KONG INVESTMENT LIMITED
時利香港投資有限公司",2012-09-25,,"Private, ltd by shares"
3336,1793563,"ALL PROFIT INTERNATIONAL DEVELOP LIMITED
合利國際拓展有限公司",2012-08-30,2019-06-06,"Private, ltd by shares"
3337,1807085,"ALL PROFIT INTERNATIONAL TRADING LIMITED
利多國際貿易有限公司",2012-10-03,,"Private, ltd by shares"
3338,1733837,"ALL PROFIT TRADING LIMITED
利浩貿易有限公司",2012-04-20,2017-10-13,"Private, ltd by shares"
3339,1840869,"ALL PUMPS MACHINERY COMPANY LIMITED
奧爾泵業機械有限公司",2012-12-18,,"Private, ltd by shares"
3340,1702490,"ALL RED CORPORATION LIMITED
日紅有限公司",2012-02-01,2018-01-19,"Private, ltd by shares"
3341,1827061,"ALL REWARD LIMITED
通勵有限公司",2012-11-17,2016-07-15,"Private, ltd by shares"
3342,1775028,"ALL RICH ASIA PACIFIC LIMITED
時發亞太有限公司",2012-07-18,,"Private, ltd by shares"
3343,1733841,"ALL RICH HOLDINGS LIMITED (d2015-08-14)
全發集團有限公司",2012-04-20,2015-08-14,"Private, ltd by shares"
3344,1728013,"ALL RICH INC. DEVELOPMENT LIMITED
聯發興業發展有限公司",2012-04-13,,"Private, ltd by shares"
3345,1766507,"ALL RICH INTERNATIONAL DEVELOP LIMITED
全富國際拓展有限公司",2012-06-28,2019-04-04,"Private, ltd by shares"
3346,1740788,"ALL RICHFIELD LIMITED
隆全有限公司",2012-05-07,,"Private, ltd by shares"
3347,1841718,"ALL RIGHT CHEMICAL CO., LIMITED
濟南奧潤生物技術有限公司",2012-12-20,,"Private, ltd by shares"
3348,1732207,"All Right Consultants Limited
通行行有限公司",2012-04-18,,"Private, ltd by shares"
3349,1799680,"ALL RIGHT PROPERTIES LIMITED (HK)
滿達置業有限公司",2012-09-13,,"Private, ltd by shares"
3350,1803281,"ALL RISE INVESTMENT DEVELOPMENT LIMITED
萬昇投資發展有限公司",2012-09-21,2016-05-13,"Private, ltd by shares"
3351,1781456,All Royal Investment Co. Limited,2012-08-01,2017-03-31,"Private, ltd by shares"
3352,1787488,"ALL SEASONS CO., LIMITED",2012-08-16,,"Private, ltd by shares"
3353,1745725,ALL SECURITY & NETWORK SCIENCE GROUP LIMITED,2012-05-16,2019-02-22,"Private, ltd by shares"
3354,1836120,"ALL SIGHTS LIMITED
奧賽斯有限公司",2012-12-07,2020-09-04,"Private, ltd by shares"
3355,1824889,"ALL SINO LIMITED
華銓有限公司",2012-11-13,,"Private, ltd by shares"
3356,1810781,"ALL SPORTS INDUSTRY LIMITED
全運實業有限公司",2012-10-11,,"Private, ltd by shares"
3357,1696496,"ALL SPREAD CORPORATION LIMITED
展同有限公司",2012-01-05,,"Private, ltd by shares"
3358,1707418,"ALL STAR BASKETBALL ACADEMY LIMITED
傳奇星籃球教學有限公司",2012-02-20,2019-11-29,"Private, ltd by shares"
3359,1834941,All Star Enterprise Limited (HK),2012-12-05,2020-08-28,"Private, ltd by shares"
3360,1842200,"ALL STAR KNITTING LIMITED
星海針織有限公司",2012-12-20,2019-07-05,"Private, ltd by shares"
3361,1768501,"ALL STAR TECHNOLOGY HOLDING LIMITED
群欣光電科技控股有限公司",2012-07-04,2019-04-04,"Private, ltd by shares"
3362,1779614,"ALL STEP LIMITED
達普有限公司",2012-07-27,,"Private, ltd by shares"
3363,1721128,"ALL SUCCESS DEVELOP LIMITED
全盛拓展有限公司",2012-03-29,2017-11-03,"Private, ltd by shares"
3364,1844393,"ALL SUNNY LIMITED
輝全有限公司",2012-12-28,,"Private, ltd by shares"
3365,1728192,"ALL SUNSHINE LIMITED
合陽有限公司",2012-04-13,2019-01-25,"Private, ltd by shares"
3366,1790603,"ALL TEAM INTERNATIONAL HOLDINGS LIMITED
恒添國際集團有限公司",2012-08-23,,"Private, ltd by shares"
3367,1695968,"ALL TEXTILES INVESTMENT CO., LIMITED
全紡投資有限公司",2012-01-04,2020-04-29,"Private, ltd by shares"
3368,1740251,"ALL THE BEST ONE LIMITED
壹流有限公司",2012-05-04,,"Private, ltd by shares"
3369,1729040,"ALL TOGETHER-INTERNATIONAL CORPORATION LIMITED
世融國際集團有限公司",2012-04-15,2016-12-09,"Private, ltd by shares"
3370,1771601,"ALL TOP CORPORATION LIMITED
頂全有限公司",2012-07-11,2015-12-18,"Private, ltd by shares"
3371,1721933,"ALL TOP INVESTMENT DEVELOPMENT LIMITED
卓高投資發展有限公司",2012-04-01,2019-05-24,"Private, ltd by shares"
3372,1806701,ALL TRADE M&E LIMITED,2012-09-28,2018-05-04,"Private, ltd by shares"
3373,1705941,ALL TRANS GLOBAL LIMITED,2012-02-15,,"Private, ltd by shares"
3374,1721455,"ALL TREASURE CORPORATION LIMITED
寶廣有限公司",2012-04-01,2013-11-22,"Private, ltd by shares"
3375,1828813,"ALL UNION TRADING CO., LIMITED
均聯貿易(香港)有限公司",2012-11-21,2016-07-15,"Private, ltd by shares"
3376,1816250,"ALL VAST LIMITED (d2016-01-15)
可鵬有限公司",2012-10-25,2016-01-15,"Private, ltd by shares"
3377,1705914,"ALL VICTORY INVESTMENT LIMITED
泉勝投資有限公司",2012-02-15,2015-10-09,"Private, ltd by shares"
3378,1719789,"ALL VICTORY LIMITED (d2018-08-10)
全榮有限公司",2012-03-23,2018-08-10,"Private, ltd by shares"
3379,1748972,ALL WAY PTY LIMITED,2012-05-23,2017-01-13,"Private, ltd by shares"
3380,1768039,ALL WAYS PICTURES LIMITED,2012-07-03,,"Private, ltd by shares"
3381,1809994,"ALL WAYS TRADING (HK) LIMITED
約維士貿易(香港)有限公司",2012-10-09,2015-02-27,"Private, ltd by shares"
3382,1727894,"ALL WELL FURNITURE CO., LIMITED
亞威傢俱有限公司",2012-04-12,2019-03-08,"Private, ltd by shares"
3383,1709133,"ALL WELL HOLDINGS LIMITED
全旺集團有限公司",2012-02-23,,"Private, ltd by shares"
3384,1805512,"ALL WELL INTERNATIONAL DEVELOP LIMITED
全威國際拓展有限公司",2012-09-26,2017-06-23,"Private, ltd by shares"
3385,1773505,"ALL WIN INTERNATIONAL (HK) LIMITED
恒威國際(香港)有限公司",2012-07-13,2020-05-15,"Private, ltd by shares"
3386,1775506,"ALL WIN LUCKY ENTERPRISE COMPANY LIMITED
盈贏運通企業有限公司",2012-07-19,2019-04-18,"Private, ltd by shares"
3387,1777367,ALL WINNERS HONG KONG LIMITED,2012-07-24,2020-06-05,"Private, ltd by shares"
3388,1715405,"ALL WINS LIMITED (d2013-02-01)
齊加利有限公司",2012-03-09,2013-02-01,"Private, ltd by shares"
3389,1763813,"ALL WORLD SUPPLIES CO., LIMITED",2012-06-22,2018-03-23,"Private, ltd by shares"
3390,1790419,ALL YOU NEED SUPPORT LIMITED,2012-08-23,,"Private, ltd by shares"
3391,1708158,All's Well Media Company Limited,2012-02-21,,"Private, ltd by shares"
3392,1811568,ALL-BERRIES HONG KONG LIMITED,2012-10-12,,"Private, ltd by shares"
3393,1837209,"ALL-CHINA RETURNEES UNION LIMITED
中華海歸聯盟有限公司",2012-12-11,2018-07-06,"Private, ltd by shares"
3394,1773561,"ALL-FLOURISHING INTERNATIONAL TRADING (HK) CO., LIMITED
香港奧盛國際貿易有限公司",2012-07-13,,"Private, ltd by shares"
3395,1742704,ALL-IN ONE MARKETING & PROMOTION LIMITED,2012-05-10,,"Private, ltd by shares"
3396,1747996,"ALL-INCLUSIVE TRADING CO., LIMITED
澳盈富思貿易有限公司",2012-05-21,2015-07-03,"Private, ltd by shares"
3397,1699755,"ALL-KING CERAMIC CO., LIMITED
奧經進出口有限公司",2012-01-16,2019-08-02,"Private, ltd by shares"
3398,1731978,"ALL-MATCH CO., LIMITED
愛格馬馳有限公司",2012-04-18,2015-10-16,"Private, ltd by shares"
3399,1714184,"All-Pass International Holdings Limited
全通國際控股集團有限公司",2012-03-07,2014-08-08,"Private, ltd by shares"
3400,1764225,"ALL-ROUND GROUP CO., LIMITED
健能集團有限公司",2012-06-22,2014-10-03,"Private, ltd by shares"
3401,1776414,"ALL-STAR INTERNATIONAL EDUCATION LIMITED
星河國際教育有限公司",2012-07-20,2019-12-06,"Private, ltd by shares"
3402,1718657,"ALL-VICTORY ELECTRONIC TECHNOLOGY GROUP LIMITED
奥思睿電子科技集團有限公司",2012-03-20,2017-10-20,"Private, ltd by shares"
3403,1716733,ALL-WAYS LOGISTICS LIMITED (HK),2012-03-14,,"Private, ltd by shares"
3404,1733163,ALL-WINNER GROUP LIMITED,2012-04-20,2015-12-11,"Private, ltd by shares"
3405,1765216,"ALL-WINNER TECHNOLOGY (HK) CO., LIMITED
歐萬能科技(香港)有限公司",2012-06-26,,"Private, ltd by shares"
3406,1842421,"ALLA MODA CASA MFY LIMITED
逸舍家品製造廠有限公司",2012-12-21,,"Private, ltd by shares"
3407,1798638,"ALLA SPORTS TECHNOLOGY CO., LIMITED
全一運動科技有限公司",2012-09-11,2017-05-05,"Private, ltd by shares"
3408,1700539,"ALLA VOLONTA COMPANY LIMITED
隨意國際有限公司",2012-01-18,2019-07-19,"Private, ltd by shares"
3409,1698471,ALLAH WALLI INTERNATIONAL CO. LIMITED,2012-01-11,2018-09-28,"Private, ltd by shares"
3410,1702938,"ALLAH WALLY CO., LIMITED",2012-02-03,2017-09-15,"Private, ltd by shares"
3411,1710014,"ALLAITH IMPORT & EXPORT CO., LIMITED",2012-02-27,2019-06-14,"Private, ltd by shares"
3412,1735623,Allan Warburg (HK) Investment Limited,2012-04-25,,"Private, ltd by shares"
3413,1724648,"ALLBATTERY INTERNATIONAL GROUP LIMITED
奧柏(香港)國際集團有限公司",2012-04-08,,"Private, ltd by shares"
3414,1737777,"ALLBEST HOUSE CO., LIMITED
潛升有限公司",2012-04-28,2015-09-04,"Private, ltd by shares"
