,Reg no.,Name,"Incorp-
orated",Dissolved,Type
2673,1740191,"AIMS-ASIA MERCHANT SERVICES CO., LIMITED",2012-05-04,,"Private, ltd by shares"
2674,1812673,"AIMU (CHINA) CO., LIMITED
愛睦(中國)有限公司",2012-10-16,,"Private, ltd by shares"
2675,1840388,"AIN FOODS HONG KONG INTERNATIONAL COMPANY LIMITED
愛櫻食品香港國際有限公司",2012-12-18,2019-05-31,"Private, ltd by shares"
2676,1767781,"AINFO (HK) LIMITED
銘惠科技(香港)有限公司",2012-07-03,,"Private, ltd by shares"
2677,1730542,"AINIERKE (HK) FINERY CO., LIMITED
艾尼爾克(香港)服飾有限公司",2012-04-17,2020-01-10,"Private, ltd by shares"
2678,1772037,"AINING SHIPPING CO., LIMITED
愛寧船務有限公司",2012-07-11,,"Private, ltd by shares"
2679,1751197,"AINO MARINE SERVICES COMPANY LIMITED
海諾船舶服務有限公司",2012-05-28,2015-11-06,"Private, ltd by shares"
2680,1717187,"AINUO (CHINA) TEXTILE DEVELOPMENT LIMITED
艾諾(中國)紡織品發展有限公司",2012-03-15,,"Private, ltd by shares"
2681,1793550,"AINUO INDUSTRIAL CO., LIMITED
艾諾實業有限公司",2012-08-30,,"Private, ltd by shares"
2682,1798252,"AINUO TECHNOLOGY CO., LIMITED
艾諾科技有限公司",2012-09-10,,"Private, ltd by shares"
2683,1792132,"AINUOYA TRADING CO. LIMITED
艾諾雅貿易有限公司",2012-08-27,2018-05-04,"Private, ltd by shares"
2684,1713072,"Aion Clover Trading Co., Limited",2012-03-05,,"Private, ltd by shares"
2685,1803798,AION CONSULTING PVT LIMITED,2012-09-21,,"Private, ltd by shares"
2686,1781035,"AION HONGKONG LIMITED
艾歐香港有限公司",2012-08-01,2013-09-19,"Private, ltd by shares"
2687,1714389,"AIOUNIA INTERNATIONAL CO., LIMITED
艾歐尼亞國際有限公司",2012-03-07,2018-08-10,"Private, ltd by shares"
2688,1815633,AIP Energy Holdings Limited,2012-10-24,2017-06-23,"Private, ltd by shares"
2689,1813284,"AIPAI (HONG KONG) INT'L HOLDING CO., LIMITED
愛派(香港)國際控股有限公司",2012-10-18,2016-06-10,"Private, ltd by shares"
2690,1700972,"AIPPLE NEW MATERIAL CO., LIMITED
艾普樂新材料有限公司",2012-01-19,,"Private, ltd by shares"
2691,1843256,"AIPU XINQIDIAN INTERNATIONAL GROUP LIMITED
愛普欣奇典國際集團有限公司",2012-12-24,,"Private, ltd by shares"
2692,1757155,"AIQI INTERNATIONAL FASHION LIMITED
艾亓國際服飾有限公司",2012-06-08,,"Private, ltd by shares"
2693,1788903,"AiQi Packaging Products Limited
艾奇包裝製品有限公司",2012-08-20,2019-01-25,"Private, ltd by shares"
2694,1785732,"AiQi Technology Co., Limited
愛琦科技有限公司",2012-08-10,,"Private, ltd by shares"
2695,1800235,"AIR & LAND LOGISTICS LIMITED
天豐物流有限公司",2012-09-14,,"Private, ltd by shares"
2696,1779870,"Air Asia Association Holdings Limited
亞洲航空協會控股有限公司",2012-07-30,,"Private, ltd by shares"
2697,1708533,Air Bay Creative (Hong Kong) Limited,2012-02-22,,"Private, ltd by shares"
2698,1708516,Air Bay Creative Trading Limited,2012-02-22,,"Private, ltd by shares"
2699,1796372,"AIR DIGITAL LIMITED (d2016-04-29)
無線數碼有限公司",2012-09-05,2016-04-29,"Private, ltd by shares"
2700,1819352,"AIR ENERGY TECHNOLOGY EQUIPMENT HOLDINGS COMPANY LIMITED
空能科技設備控股有限公司",2012-11-01,,"Private, ltd by shares"
2701,1705260,Air Fast Tickets Limited (HK),2012-02-13,2018-11-09,"Private, ltd by shares"
2702,1828634,Air Finance Limited,2012-11-21,2018-11-09,"Private, ltd by shares"
2703,1777674,Air Global Logistics Limited,2012-07-24,,"Private, ltd by shares"
2704,1736396,"AIR HOLLYWOOD (HONG KONG) INTERNATIONAL CO., LIMITED
空中好萊塢(香港)國際有限公司",2012-04-26,2019-02-01,"Private, ltd by shares"
2705,1815225,"Air International Group Limited
天空國際集團有限公司",2012-10-22,2015-06-05,"Private, ltd by shares"
2706,1758955,"AIR MANAGEMENT SYSTEMS (ASIA-PACIFIC) CO., LIMITED
艾懋升科技(亞太)有限公司",2012-06-12,2017-02-03,"Private, ltd by shares"
2707,1814773,AIR MARIANAS LIMITED,2012-10-22,2015-07-17,"Private, ltd by shares"
2708,1821936,"AIR OCEAN EXPRESS CO., LIMITED
一通國際物流有限公司",2012-11-06,,"Private, ltd by shares"
2709,1765086,Air Oceanwill Limited,2012-06-26,2016-02-19,"Private, ltd by shares"
2710,1814752,AIR PAPAYA LIMITED,2012-10-22,2015-07-17,"Private, ltd by shares"
2711,1696359,Air Ride Pallets Hong Kong Limited,2012-01-04,,"Private, ltd by shares"
2712,1783340,AIR RISING INTERNATIONAL TRANSPORATION LIMITED (HK),2012-08-07,,"Private, ltd by shares"
2713,1737554,"AIR SILKROAD (HK) E-COMMERCE LIMITED
空中絲路(香港)電子商務有限公司",2012-04-27,,"Private, ltd by shares"
2714,1767094,"Air Support HK Co., Limited",2012-06-29,2013-11-15,"Private, ltd by shares"
2715,1826105,"AIR SUSPENSION INDUSTRY CO., LIMITED
埃爾斯汽車零部件有限公司",2012-11-15,,"Private, ltd by shares"
2716,1829848,"Air Technology Company Limited (d2016-03-04)
風科技有限公司",2012-11-23,2016-03-04,"Private, ltd by shares"
2717,1752090,"AIR TRAVEL HORIZON LIMITED
航旅時空有限公司",2012-05-29,,"Private, ltd by shares"
2718,1731917,"AIR WIN ASSETS LIMITED
天勝資產有限公司",2012-04-18,,"Private, ltd by shares"
2719,1760172,"AIR2O ENVIRONMENTAL EQUIPMENT COMPANY LIMITED
艾諾環境設備有限公司",2012-06-14,,"Private, ltd by shares"
2720,1707317,AIRADYNE INTERNATIONAL GROUP LIMITED,2012-02-17,,"Private, ltd by shares"
2721,1699448,"AIRBAC GROUP LIMITED
愛背客集團有限公司",2012-01-13,2019-10-25,"Private, ltd by shares"
2722,1701104,AIRBNB HONG KONG LIMITED,2012-01-20,2017-01-13,"Private, ltd by shares"
2723,1772663,Airborne China Limited,2012-07-12,,"Private, ltd by shares"
2724,1722771,"AIRBORNE KINGDOM LIMITED
耀邦基業有限公司",2012-04-03,,"Private, ltd by shares"
2725,1826487,AIRBOX SHOE - FASHION LIMITED,2012-11-16,2018-11-30,"Private, ltd by shares"
2726,1716001,AIRBUSAC LIMITED,2012-03-13,,"Private, ltd by shares"
2727,1761332,"AIRCARD INDUSTRY INT'L DEVELOPMENT LIMITED
大唐實業國際發展有限公司",2012-06-18,2018-02-23,"Private, ltd by shares"
2728,1765015,"AIRCHN INTERNATIONAL INVESTMENT CONSULTANT LIMITED
愛辰國際投資顧問有限公司",2012-06-25,2019-04-04,"Private, ltd by shares"
2729,1774898,Aircraft Component Support Services Limited,2012-07-18,2016-03-11,"Private, ltd by shares"
2730,1774360,"AIRER INTERNATIONAL ENTERPRISE LIMITED
艾睿爾國際企業有限公司",2012-07-17,,"Private, ltd by shares"
2731,1761564,"AIRFAST FREIGHT SYSTEM LIMITED
先機航空貨運有限公司",2012-06-18,2017-10-20,"Private, ltd by shares"
2732,1748257,"AIRGEN WIRELESS CO., LIMITED
艾駿科技有限公司",2012-05-22,2019-03-01,"Private, ltd by shares"
2733,1728483,"AIRGRID (HONGKONG) NETWORK TECHNOLOGY LIMITED
艾格瑞(香港)網絡技術有限公司",2012-04-13,2020-01-03,"Private, ltd by shares"
2734,1771740,AirHydro International Company Limited,2012-07-11,2017-06-09,"Private, ltd by shares"
2735,1819082,AIRI Ventures (HK) Limited,2012-10-31,2018-06-01,"Private, ltd by shares"
2736,1810199,"Airious Co., Limited
愛麗鷗有限公司",2012-10-10,2018-09-21,"Private, ltd by shares"
2737,1816639,AIRKOOLED LIMITED,2012-10-26,2015-08-28,"Private, ltd by shares"
2738,1745660,"AIRLINK TECHNOLOGIES LIMITED
凌科智能科技有限公司",2012-05-16,2019-08-16,"Private, ltd by shares"
2739,1697289,Airmail Limited,2012-01-09,,"Private, ltd by shares"
2740,1721107,AIRMARK FREIGHT SERVICES (HK) PTE LIMITED,2012-03-29,2014-11-07,"Private, ltd by shares"
2741,1825413,AIRMEN GROUP HK LIMITED,2012-11-14,,"Private, ltd by shares"
2742,1714729,"AirMenu Limited
互動餐廳有限公司",2012-03-08,2013-02-01,"Private, ltd by shares"
2743,1797268,AirMobile Limited,2012-09-07,2019-05-22,"Private, ltd by shares"
2744,1765219,AIRPART CONSOLIDATE TRADING CO. LIMITED,2012-06-26,,"Private, ltd by shares"
2745,1777471,"Airplux Technologies Limited
艾克普斯科技有限公司",2012-07-24,2015-05-15,"Private, ltd by shares"
2746,1803779,"AIRPOINT TECHNOLOGIES COMPANY LIMITED
艾爾邦科技有限公司",2012-09-21,,"Private, ltd by shares"
2747,1763381,AIRPORT SERVICES INVESTMENTS COMPANY LIMITED,2012-06-21,2014-05-16,"Private, ltd by shares"
2748,1832430,"Airrich Co., Limited
阿瑞奇有限公司",2012-11-29,2015-10-16,"Private, ltd by shares"
2749,1727754,AIRSOFT PIONEER LIMITED,2012-04-12,,"Private, ltd by shares"
2750,1722773,"AIRSOUND LIMITED
雅聲有限公司",2012-04-03,,"Private, ltd by shares"
2751,1757040,"AIRSPACE INDUSTRY CORPORATION OF CHINA GROUP LIMITED
中國空域產業集團有限公司",2012-06-07,,"Private, ltd by shares"
2752,1841689,"AIRSTAR CO., LIMITED
星空商貿有限公司",2012-12-20,,"Private, ltd by shares"
2753,1794279,"AIRSUN INTERNATIONAL LIMITED
艾爾森國際有限公司",2012-08-31,,"Private, ltd by shares"
2754,1700257,AIRSYSTEM - OUTCOMES LIMITED,2012-01-17,2015-12-31,"Private, ltd by shares"
2755,1748094,"AIRUILI ORNAMENTS CO., LIMITED
艾瑞麗飾品有限公司",2012-05-21,2017-01-13,"Private, ltd by shares"
2756,1743555,"AIRUNS (HONG KONG) LIMITED
艾倫思(香港)有限公司",2012-05-11,2019-03-01,"Private, ltd by shares"
2757,1704507,Airwave International Limited,2012-02-09,2019-01-11,"Private, ltd by shares"
2758,1699015,"airweave Hong Kong Co., Limited",2012-01-12,,"Private, ltd by shares"
2759,1718073,"AIRWORLD ELECTRONICS CO., LIMITED
晨峰電子有限公司",2012-03-19,2018-08-31,"Private, ltd by shares"
2760,1702369,"AiryPack Company Limited
輕綠環保包裝有限公司",2012-01-31,,"Private, ltd by shares"
2761,1802510,"AIS company Limited
艾思數碼有限公司",2012-09-19,,"Private, ltd by shares"
2762,1825213,AIS FASHION LIMITED,2012-11-14,2020-05-15,"Private, ltd by shares"
2763,1794021,"Aisa Healthcare Resource Center Co., Limited",2012-08-30,,"Private, ltd by shares"
2764,1749953,"AISA INTERNATIONAL MEDIA SHARE LIMITED
亞太國際傳媒股份有限公司",2012-05-24,2016-01-15,"Private, ltd by shares"
2765,1760041,"AISA MASTER INTERNATIONAL CO., LIMITED
雅世達國際實業有限公司",2012-06-14,,"Private, ltd by shares"
2766,1704988,"Aisaiti Import&Export Trading Co., Limited
義烏市瑪瑞進出口有限公司",2012-02-13,,"Private, ltd by shares"
2767,1774769,"AISEN INDUSTRY (SHENZHEN) CO., LIMITED
艾森實業(深圳)有限公司",2012-07-17,2019-01-04,"Private, ltd by shares"
2768,1781545,"AISHEN INDUSTRIAL (HK) LIMITED
愛深實業(香港)有限公司",2012-08-02,2017-03-24,"Private, ltd by shares"
2769,1825849,"AISHION GROUP HONGKONG LIMITED
艾氏集團香港有限公司",2012-11-15,,"Private, ltd by shares"
2770,1795853,AISHION L&H INTERNATIONAL LIMITED,2012-09-05,,"Private, ltd by shares"
2771,1728610,"AISIDA SANITARY WARE INDUSTRIAL CO., LIMITED
愛思達衛浴實業有限公司",2012-04-13,2019-07-05,"Private, ltd by shares"
2772,1780224,AiSign Limited,2012-07-30,2016-03-24,"Private, ltd by shares"
2773,1729267,"AISIKAI (HK) ELECTRONIC TECHNOLOGY CO., LIMITED
艾斯凱(香港)電子科技有限公司",2012-04-16,,"Private, ltd by shares"
2774,1800127,"AISILI ELECTRONICS DEVELOPMENT CO., LIMITED
艾思力電子發展有限公司",2012-09-14,,"Private, ltd by shares"
2775,1737700,"AISILU LIMITED
香港艾思露有限公司",2012-04-27,2015-12-18,"Private, ltd by shares"
2776,1835328,"AISIMAN IMPORTS & EXPORTS CO., LIMITED
艾絲曼進出口有限公司",2012-12-06,2016-08-05,"Private, ltd by shares"
2777,1829975,"Aisino Capital Holdings Limited
博華資本控股有限公司",2012-11-23,2018-07-20,"Private, ltd by shares"
2778,1761377,"AISKY TRADING CO., LIMITED
愛天貿易有限公司",2012-06-18,2019-03-29,"Private, ltd by shares"
2779,1839638,"AISOLAR CO., LIMITED",2012-12-14,2018-04-20,"Private, ltd by shares"
2780,1767748,"AISONG FOOD (HK) CO., LIMITED
愛松食品(香港)有限公司",2012-07-03,2017-02-17,"Private, ltd by shares"
2781,1764281,"AISTAR GROUP CO., LIMITED
慕璇電子有限公司",2012-06-22,2019-03-22,"Private, ltd by shares"
2782,1744900,"AIT Information Technologies Limited
雅訊資訊科技有限公司",2012-05-15,,"Private, ltd by shares"
2783,1747288,AITA ENTERPRISE (HK) LIMITED,2012-05-18,2018-08-17,"Private, ltd by shares"
2784,1722721,AITA LIMITED (HK),2012-04-03,,"Private, ltd by shares"
2785,1834809,"AITE TRADE LIMITED
艾特貿易有限公司",2012-12-05,2015-10-02,"Private, ltd by shares"
2786,1814480,"AITECH WINNATEK TECHNOLOGY CO., LIMITED
凱新益技術開發(香港)有限公司",2012-10-19,2016-06-10,"Private, ltd by shares"
2787,1779797,AITI HOME IDEAS COMPANY LIMITED,2012-07-27,2016-04-29,"Private, ltd by shares"
2788,1836825,AITO ASIA TOURS LIMITED,2012-12-10,,"Private, ltd by shares"
2789,1835675,"AITOX LIMITED
艾拓有限公司",2012-12-06,,"Private, ltd by shares"
2790,1763058,"AITUO (HK) INTERNATIONAL GROUP LIMITED
艾拓(香港)國際集團有限公司",2012-06-21,,"Private, ltd by shares"
2791,1818604,"AIU Office Supplies Co., Limited
美亞辦公用品有限公司",2012-10-30,2017-07-07,"Private, ltd by shares"
2792,1830488,"AIVI LEATHER CO., LIMITED
艾唯皮具有限公司",2012-11-26,,"Private, ltd by shares"
2793,1764412,"Aivo Technology Limited
艾為科技有限公司",2012-06-25,2017-02-17,"Private, ltd by shares"
2794,1712105,AIW Holdings Limited,2012-03-01,,"Private, ltd by shares"
2795,1745434,AIWA CORPORATION LIMITED,2012-05-16,2017-12-08,"Private, ltd by shares"
2796,1823182,"AIWAN LIGHTING CO., LIMITED
愛晚燈飾有限公司",2012-11-08,,"Private, ltd by shares"
2797,1812153,"Aiwei Display Co., Limited
愛威展示系統有限公司",2012-10-15,2014-05-09,"Private, ltd by shares"
2798,1763292,"AIWELL TECHNOLOGY LIMITED
鑫正電子科技有限公司",2012-06-21,,"Private, ltd by shares"
2799,1806041,"AIWES MANUFACTURING LIMITED
丹浦森國際貿易有限公司",2012-09-27,2016-02-19,"Private, ltd by shares"
2800,1722422,"AIWI (HK) CO., LIMITED",2012-04-02,2013-11-08,"Private, ltd by shares"
2801,1711832,"AIWIN LIMITED
奧榮有限公司",2012-03-01,2017-11-03,"Private, ltd by shares"
2802,1730057,"AIWIT INTERNATIONAL LIMITED
愛唯特國際有限公司",2012-04-16,2019-01-25,"Private, ltd by shares"
2803,1843534,"AIWUJIN (CHINA) LIMITED
愛無盡(中國)有限公司",2012-12-24,2018-09-07,"Private, ltd by shares"
2804,1754140,AIXIAO LIMITED,2012-06-01,2013-03-28,"Private, ltd by shares"
2805,1707866,"AIXINANNA (HK) OVERALL BATHROOM LIMITED
愛新安娜(香港)整體衛浴有限公司",2012-02-21,2015-10-09,"Private, ltd by shares"
2806,1714765,"AIYIBAI HONG KONG GROUP CO., LIMITED
愛一佰香港集團有限公司",2012-03-08,,"Private, ltd by shares"
2807,1747641,"AIYING DOCTOR INT'L GROUP HOLDING LIMITED
愛嬰博士國際集團控股有限公司",2012-05-21,2019-02-22,"Private, ltd by shares"
2808,1764654,"AIYINGZI LIMITED
愛英子有限公司",2012-06-25,2020-09-11,"Private, ltd by shares"
2809,1762028,"Aiyins (HK) Acoustic Technology Co., Limited
香港愛音仕聲學科技有限公司",2012-06-19,2017-02-10,"Private, ltd by shares"
2810,1823931,"AIYOU WORLD (HK) LIMITED
愛游天下(香港)有限公司",2012-11-12,2016-07-08,"Private, ltd by shares"
2811,1744901,"AIZHIMAN (HONG KONG) FOOD LIMITED
愛之蔓(香港)食品有限公司",2012-05-15,2013-09-13,"Private, ltd by shares"
2812,1714526,AIZHOU LIMITED,2012-03-08,,"Private, ltd by shares"
2813,1812187,AJ Asia Pacific Limited,2012-10-16,,"Private, ltd by shares"
2814,1738779,"AJ Corporate Gifts Company Limited
卓峰(禮品)貿易有限公司",2012-05-02,2018-09-28,"Private, ltd by shares"
2815,1800074,AJ CORPORATION LIMITED,2012-09-13,,"Private, ltd by shares"
2816,1760771,"AJ ECO LIFE HOUSEWARE CO., LIMITED
艾格家居用品有限公司",2012-06-15,,"Private, ltd by shares"
2817,1791699,"AJ GLOBAL LIMITED
翡翠控股有限公司",2012-08-27,2018-03-29,"Private, ltd by shares"
2818,1700682,"AJ MOTOR LIMITED
金興汽車有限公司",2012-01-19,,"Private, ltd by shares"
2819,1822240,"AJ Partners Trading Company Limited
友達力奇有限公司",2012-11-07,2016-08-12,"Private, ltd by shares"
2820,1844592,"AJA ARTS & CRAFTS CO., LIMITED",2012-12-28,2018-07-13,"Private, ltd by shares"
2821,1798577,AJAMI TRADING LIMITED,2012-09-11,,"Private, ltd by shares"
2822,1778113,"AJASCOMINT FOR TRADING AND SERVICES CO., LIMITED",2012-07-25,,"Private, ltd by shares"
2823,1830206,AJATS INTERNATIONAL GROUP LIMITED,2012-11-23,2016-04-22,"Private, ltd by shares"
2824,1698241,Ajax (Hong Kong) Limited,2012-01-11,2018-02-09,"Private, ltd by shares"
2825,1791983,AJC Gallery Limited,2012-08-27,2018-11-09,"Private, ltd by shares"
2826,1780934,"AJC TRADE CO., LIMITED",2012-08-01,2019-04-12,"Private, ltd by shares"
2827,1698524,AJD Capital Investment Limited,2012-01-11,,"Private, ltd by shares"
2828,1838737,"AJD International Logistic Co., Limited
安捷達國際貨運代理有限公司",2012-12-13,2017-09-29,"Private, ltd by shares"
2829,1806778,Ajeto Consult Limited,2012-09-28,,"Private, ltd by shares"
2830,1802576,AJI HK LIMITED,2012-09-19,,"Private, ltd by shares"
2831,1791199,AJINGA International Limited,2012-08-24,,"Private, ltd by shares"
2832,1716238,"AJISEN FRANCHISING (HK) LIMITED
味千特許經營(香港)有限公司",2012-03-13,,"Private, ltd by shares"
2833,1821856,AJJU'S MINES & MINERALS LIMITED,2012-11-06,2019-09-27,"Private, ltd by shares"
2834,1728732,AJK MOTORS LIMITED (HK),2012-04-13,2020-01-31,"Private, ltd by shares"
2835,1726964,AJMN LIMITED,2012-04-11,,"Private, ltd by shares"
2836,1772811,"AjnaPower Originality(H.K.) Corp., Limited
亞哲納新創(香港)股份有限公司",2012-07-12,2016-09-02,"Private, ltd by shares"
2837,1719547,AJR MEDIA CONSULTING LIMITED,2012-03-23,2018-12-14,"Private, ltd by shares"
2838,1700005,AJT Trading Limited (HK),2012-01-17,,"Private, ltd by shares"
2839,1734033,AK Asia Limited,2012-04-20,,"Private, ltd by shares"
2840,1805949,AK BEAUTY LIMITED (d2014-10-03),2012-09-27,2014-10-03,"Private, ltd by shares"
2841,1733705,"AK CAPITAL RESOURCES LIMITED
安騰資本有限公司",2012-04-20,,"Private, ltd by shares"
2842,1702722,"AK Consultant Limited
華強顧問有限公司",2012-02-02,,"Private, ltd by shares"
2843,1707457,AK DesignZoo Limited,2012-02-20,2016-10-14,"Private, ltd by shares"
2844,1703950,AK Education Limited,2012-02-08,,"Private, ltd by shares"
2845,1700188,"AK INTERNATIONAL LIMITED (d2015-10-09)
香港愛克勝國際有限公司",2012-01-17,2015-10-09,"Private, ltd by shares"
2846,1785774,"AK LIGHTING TECHNOLOGY LIMITED
雅凱光電科技有限公司",2012-08-10,,"Private, ltd by shares"
2847,1820921,AK Wang Limited,2012-11-05,,"Private, ltd by shares"
2848,1711060,"AK.ARCHITECTS GERMANY LIMITED
德國亞克建築事務有限公司",2012-02-29,,"Private, ltd by shares"
2849,1777141,"AKA ENTERPRISE LIMITED (HK)
艾卡實業有限公司",2012-07-23,2018-04-06,"Private, ltd by shares"
2850,1742205,"Aka Japanese Food Company Limited
赤日本飲食有限公司",2012-05-09,,"Private, ltd by shares"
2851,1798849,AKA TELECOM LIMITED,2012-09-11,2013-08-30,"Private, ltd by shares"
2852,1766491,AKAAL TRADING LIMITED (d2016-02-19),2012-06-28,2016-02-19,"Private, ltd by shares"
2853,1764796,"AKACIA TRADING COMPANY LIMITED
艾卡西雅貿易有限公司",2012-06-25,2017-02-17,"Private, ltd by shares"
2854,1798888,"Akadio (International) Limited
阿卡迪亞(國際)有限公司",2012-09-11,2018-05-25,"Private, ltd by shares"
2855,1707371,Akai Toy Enterprises Limited,2012-02-20,2015-05-08,"Private, ltd by shares"
2856,1718877,Akama Industry Co. Limited,2012-03-21,,"Private, ltd by shares"
2857,1843035,"AKANG FOOTWEAR INTERNATIONAL LIMITED
香港東泰鞋業國際有限公司",2012-12-24,2017-08-25,"Private, ltd by shares"
2858,1752186,AKANI LIMITED,2012-05-29,2017-09-15,"Private, ltd by shares"
2859,1783005,"Akari Fashion Group Limited
嘉莉時裝集團有限公司",2012-08-06,2016-05-13,"Private, ltd by shares"
2860,1721368,AKARI GLOBAL COMPANY LIMITED,2012-03-30,,"Private, ltd by shares"
2861,1812013,"Akari Medical Group Limited
嘉莉醫療集團有限公司",2012-10-15,,"Private, ltd by shares"
2862,1702382,"Akari Natural Group Limited
嘉莉美妍集團有限公司",2012-01-31,,"Private, ltd by shares"
2863,1839961,AKAtech Asia Limited,2012-12-17,2016-05-27,"Private, ltd by shares"
2864,1818734,Akatsuki Limited (HK),2012-10-31,2020-03-27,"Private, ltd by shares"
2865,1826645,AKEA INVESTMENTS LIMITED (d2016-04-08),2012-11-16,2016-04-08,"Private, ltd by shares"
2866,1789046,"AKERS INTERNATIONAL UNION FOOD (ASIA) LIMITED
阿克斯國際聯合食品(亞太)有限公司",2012-08-20,2016-04-15,"Private, ltd by shares"
2867,1795184,"AKI Fashion Limited
雅佳時裝有限公司",2012-09-03,2019-06-06,"Private, ltd by shares"
2868,1803205,"AKI MART COMPANY LIMITED
秋之百貨有限公司",2012-09-20,2015-04-24,"Private, ltd by shares"
2869,1736124,"AKIA HK DEVELOPMENT LIMITED
愛家香港發展有限公司",2012-04-25,2015-12-18,"Private, ltd by shares"
2870,1738347,AKIDO LIMITED,2012-04-30,2019-02-15,"Private, ltd by shares"
2871,1842648,AKIFOUR TRADING LIMITED,2012-12-21,2016-08-19,"Private, ltd by shares"
2872,1730145,"AKIL INTERNATIONAL TRADE GROUP CO., LIMITED
阿刻立國際貿易集團有限公司",2012-04-17,2016-12-09,"Private, ltd by shares"
2873,1793459,"Akilin Hongkong International Limited
合麒麟香港國際有限公司",2012-08-29,2015-08-28,"Private, ltd by shares"
2874,1753399,Akima ICT Limited,2012-05-31,,"Private, ltd by shares"
2875,1706592,"Akina Group Co., Limited
奧金娜集團有限公司",2012-02-16,,"Private, ltd by shares"
2876,1839861,AKIRA CORPORATION LIMITED,2012-12-17,2018-09-07,"Private, ltd by shares"
2877,1745641,AKIRA TRADING (HONG KONG) LIMITED,2012-05-16,2015-05-08,"Private, ltd by shares"
2878,1785685,"AKITA JAPANESE RESTAURANT LIMITED
秋田日本料理有限公司",2012-08-10,,"Private, ltd by shares"
2879,1750947,"Akiyama Electronic International Limited
秋山電子國際有限公司",2012-05-27,2016-01-15,"Private, ltd by shares"
2880,1704736,AKJ ENTERPRISES LIMITED (d2013-07-12),2012-02-10,2013-07-12,"Private, ltd by shares"
2881,1704735,AKJ TRADING LIMITED (d2013-07-12),2012-02-10,2013-07-12,"Private, ltd by shares"
2882,1796250,AKK LIMITED (HK),2012-09-05,2018-08-17,"Private, ltd by shares"
2883,1797502,"AKK TOOLS CO., LIMITED
培威工具有限公司",2012-09-07,2016-01-08,"Private, ltd by shares"
2884,1833700,"Akka International Marketing Limited
艾卡國際營銷有限公司",2012-12-03,,"Private, ltd by shares"
2885,1724590,"AKKAWI IMPORT AND EXPORT COMPANY LIMITED
阿卡維進出口有限公司",2012-04-07,,"Private, ltd by shares"
2886,1724580,"AKKAWI INTERNATIONAL COMPANY LIMITED
阿卡維國際有限公司",2012-04-07,,"Private, ltd by shares"
2887,1711616,"AKKAZ INTERNATIONAL LIMITED
敖卡國際有限公司",2012-03-01,,"Private, ltd by shares"
2888,1720558,"AKKE TRADING CO., LIMITED
奧科貿易有限公司",2012-03-27,2015-10-02,"Private, ltd by shares"
2889,1837254,"AKLAN INTERNATIONAL HONGKONG LIMITED
阿克蘭國際香港有限公司",2012-12-11,,"Private, ltd by shares"
2890,1786277,AKLAN INTERNATIONAL LIMITED,2012-08-13,,"Private, ltd by shares"
2891,1824333,AKM Mortgages Limited,2012-11-12,2017-08-18,"Private, ltd by shares"
2892,1783900,"AKMYCHINA TRADE CO., LIMITED
艾克米貿易有限公司",2012-08-08,2018-04-27,"Private, ltd by shares"
2893,1760779,Akquimed Limited,2012-06-15,,"Private, ltd by shares"
2894,1743957,AKR INVESTMENTS LIMITED,2012-05-11,,"Private, ltd by shares"
2895,1725332,"AKRAM International Trade Co., Limited
阿拉克姆國際貿易有限公司",2012-04-10,2018-12-14,"Private, ltd by shares"
2896,1833887,"Akron Advisory Limited
亞貝隆顧問有限公司",2012-12-03,,"Private, ltd by shares"
2897,1837399,"AKS JEWELRY CO., LIMITED",2012-12-11,,"Private, ltd by shares"
2898,1700472,"Aksia Hong Kong Limited
亞斯雅香港有限公司",2012-01-18,,"Private, ltd by shares"
2899,1759080,Aktis Financial (Hong Kong) No. 1 Company Limited,2012-06-13,,"Private, ltd by shares"
2900,1753131,AKUADESIGN LIMITED,2012-05-31,,"Private, ltd by shares"
2901,1809982,AKUO ENERGY INDONESIA LIMITED,2012-10-09,,"Private, ltd by shares"
2902,1758977,"AKWISE ELECTRONICS LIMITED
恒睿電子有限公司",2012-06-12,2015-12-11,"Private, ltd by shares"
2903,1830342,AL ALMAS FZE LIMITED,2012-11-26,2014-10-31,"Private, ltd by shares"
2904,1730769,"AL ANDALOUS INTERNATIONAL TRADING CO., LIMITED
安德魯斯國際貿易有限公司",2012-04-17,,"Private, ltd by shares"
2905,1730854,"AL ANDALOUS TRADING CO., LIMITED
安德魯斯貿易有限公司",2012-04-17,,"Private, ltd by shares"
2906,1730866,"AL ARABI TRADING CO., LIMITED",2012-04-17,2018-01-26,"Private, ltd by shares"
2907,1782610,AL ASAR TECH LIMITED,2012-08-03,,"Private, ltd by shares"
2908,1735586,"AL ASWADI GENERAL TRADING CO., LIMITED",2012-04-25,2019-02-08,"Private, ltd by shares"
2909,1735905,AL ATHEER INTERNATIONAL TRADING LIMITED,2012-04-25,,"Private, ltd by shares"
2910,1798517,"AL BASEET INTERNATIONAL TRADE CO., LIMITED",2012-09-11,,"Private, ltd by shares"
2911,1798432,"AL BASEET TRADE CO., LIMITED",2012-09-11,,"Private, ltd by shares"
2912,1750086,AL Consultancy Limited,2012-05-25,,"Private, ltd by shares"
2913,1760418,AL CREATIVE LIMITED (d2016-03-18),2012-06-15,2016-03-18,"Private, ltd by shares"
2914,1704636,"AL DHAFIRI TRADING CO., LIMITED",2012-02-10,2018-01-26,"Private, ltd by shares"
2915,1804211,AL Engineering Consulting Limited,2012-09-24,2015-12-11,"Private, ltd by shares"
2916,1799134,AL EZZ FOR BUSINESS CLEARANCE & TRADING LIMITED,2012-09-12,2018-04-20,"Private, ltd by shares"
2917,1706381,"AL FAYAH INT'L TRADING (HONGKONG) CO., LIMITED
香港愛華國際貿易有限公司",2012-02-16,,"Private, ltd by shares"
2918,1812724,AL FAYAZ TELECOM HK LIMITED,2012-10-17,,"Private, ltd by shares"
2919,1775084,"AL FUAD COMPANY LIMITED
福阿德有限公司",2012-07-18,,"Private, ltd by shares"
2920,1770389,AL HAZMI International Limited,2012-07-09,,"Private, ltd by shares"
