,Reg no.,Name,"Incorp-
orated",Dissolved,Type
863,814857,ALDARAN EASTERN LIMITED,2002-09-20,2008-08-01,"Private, ltd by shares"
864,807898,"ALDER PROFESSIONAL HAIR WEAVING CENTRE LIMITED
奧爾德專業織髮中心有限公司",2002-07-26,2009-04-17,"Private, ltd by shares"
865,811681,"ALDI ENTERPRISES LIMITED
歐迪實業有限公司",2002-08-26,2008-01-04,"Private, ltd by shares"
866,800200,"ALED AMER LIMITED
三友創科有限公司",2002-05-31,2009-06-12,"Private, ltd by shares"
867,799394,"ALEGRIA DEVELOPMENT LIMITED
天地發展有限公司",2002-05-24,2009-04-09,"Private, ltd by shares"
868,805020,"ALEX & WILLIAM INVESTMENT COMPANY LIMITED
舜鳴投資有限公司",2002-07-08,,"Private, ltd by shares"
869,792733,"ALEX ENGINEERING TRADING COMPANY LIMITED
亞力士工程貿易有限公司",2002-04-12,2011-10-28,"Private, ltd by shares"
870,810055,"ALEX GEMS COMPANY LIMITED
愷龍有限公司",2002-08-14,,"Private, ltd by shares"
871,805406,"ALEX INTERNATIONAL GROUP LIMITED
思哲國際集團有限公司",2002-07-10,,"Private, ltd by shares"
872,799861,"ALEX J INTERACTIVE GROUP LIMITED
積士動力有限公司",2002-05-29,2006-03-10,"Private, ltd by shares"
873,812489,"ALEXANDER BROADBAND TECHNOLOGY LIMITED
亞勝股份有限公司",2002-09-02,2008-01-18,"Private, ltd by shares"
874,817739,ALEXCA (H.K.) LIMITED,2002-10-15,2006-02-17,"Private, ltd by shares"
875,821460,"ALFA BETA TRADING CO., LIMITED (d2020-10-30)",2002-11-13,2020-10-30,"Private, ltd by shares"
876,782737,"ALFA FAITH ENTERTAINMENT PRODUCTION LIMITED
澤輝文化娛樂製作有限公司",2002-01-16,2003-05-02,"Private, ltd by shares"
877,824318,"ALFA GLOBAL COMPANY LIMITED
愛爾發環球有限公司",2002-12-06,2006-01-13,"Private, ltd by shares"
878,805923,"ALFA-CHEM LIMITED
雅發塑料有限公司",2002-07-12,2004-04-30,"Private, ltd by shares"
879,810841,"ALFACOM HEALTH SOLUTIONS (HONG KONG) LIMITED
香港國衛資訊科技有限公司",2002-08-19,2006-06-02,"Private, ltd by shares"
880,792276,"ALFRASO COMPANY LIMITED
艾菲高有限公司",2002-04-09,2005-11-25,"Private, ltd by shares"
881,807007,"ALGER CRAFT PRODUCT CO. LIMITED
亞志杰工藝品有限公司",2002-07-19,2007-11-30,"Private, ltd by shares"
882,811557,"ALGOFA LIMITED
雅高發有限公司",2002-08-23,,"Private, ltd by shares"
883,816921,"ALICE INDUSTRIAL LIMITED (d2008-02-15)
愛麗實業有限公司",2002-10-07,2008-02-15,"Private, ltd by shares"
884,797906,ALICIA BUSINESS CONSULTANT LIMITED (d2005-11-04),2002-05-15,2005-11-04,"Private, ltd by shares"
885,811351,ALIGN LIMITED (d2006-09-15),2002-08-23,2006-09-15,"Private, ltd by shares"
886,822043,ALILA INTERIOR DESIGN LIMITED,2002-11-18,2016-11-11,"Private, ltd by shares"
887,807299,"ALISON TRADING COMPANY LIMITED
愛麗貿易有限公司",2002-07-22,2013-05-31,"Private, ltd by shares"
888,823564,"ALIT INTERNATIONAL TRADE (H.K.) CO., LIMITED
艾力特國際貿易(香港)有限公司",2002-11-29,2019-01-11,"Private, ltd by shares"
889,806438,"ALKAYSON LIMITED
天有明有限公司",2002-07-17,,"Private, ltd by shares"
890,787296,"ALL ARTS INT'L PUBLISHING GROUP (HK) LIMITED
綜藝國際出版集團(香港)有限公司",2002-02-27,2007-07-06,"Private, ltd by shares"
891,793016,"ALL BEST ENGINEERING LIMITED (d2004-05-07)
美恒工程有限公司",2002-04-12,2004-05-07,"Private, ltd by shares"
892,785368,ALL BEST GROUP LIMITED (d2016-07-22),2002-02-06,2016-07-22,"Private, ltd by shares"
893,788425,"ALL BLESS INTERNATIONAL LIMITED
永福國際有限公司",2002-03-08,2015-05-15,"Private, ltd by shares"
894,804247,"ALL BLESS LIMITED (b2002-07-02)
江輝有限公司",2002-07-02,2017-07-21,"Private, ltd by shares"
895,796692,"ALL BRIGHT LIMITED (d2009-10-02)
起輝有限公司",2002-05-08,2009-10-02,"Private, ltd by shares"
896,804211,"ALL CHALLENGE INTERNATIONAL LIMITED
安策國際有限公司",2002-07-02,2005-12-02,"Private, ltd by shares"
897,787526,"ALL CHAMPION LIMITED
冠貴有限公司",2002-03-01,,"Private, ltd by shares"
898,787009,"ALL CHANCE INDUSTRIAL LIMITED
盛卓實業有限公司",2002-02-25,2013-09-19,"Private, ltd by shares"
899,790060,"ALL CHANCE LIMITED (d2004-09-17)
永泓有限公司",2002-03-20,2004-09-17,"Private, ltd by shares"
900,804399,"ALL DIRECTIONS HEALTH & VALUE-ADDED CENTER COMPANY LIMITED
全方位保健增值中心有限公司",2002-07-02,,"Private, ltd by shares"
901,783460,ALL EXPERT INVESTMENTS LIMITED,2002-01-21,2007-06-01,"Private, ltd by shares"
902,784417,"ALL EXPRESS LIMITED (d2003-07-18)
泓通有限公司",2002-01-30,2003-07-18,"Private, ltd by shares"
903,788217,"ALL FORTUNE (HK) LIMITED
弘利(香港)有限公司",2002-03-06,2004-10-15,"Private, ltd by shares"
904,785113,"ALL FORTUNE ENTERPRISE LIMITED
利創企業有限公司",2002-02-01,,"Private, ltd by shares"
905,791570,"ALL GOLD INTERNATIONAL LIMITED
永丰國際有限公司",2002-04-03,,"Private, ltd by shares"
906,790059,"ALL GOLD LIMITED
恒鑫有限公司",2002-03-20,,"Private, ltd by shares"
907,817969,"ALL GOOD LIMITED
時好有限公司",2002-10-16,,"Private, ltd by shares"
908,805678,"ALL HONG KONG ENTERPRISE SHARE LIMITED
香港全弘企業股份有限公司",2002-07-12,2009-02-20,"Private, ltd by shares"
909,797968,"ALL LEGEND LIMITED
理駿有限公司",2002-05-15,,"Private, ltd by shares"
910,797976,"ALL LIGHT LIMITED (d2005-05-13)
多輝有限公司",2002-05-15,2005-05-13,"Private, ltd by shares"
911,789513,"ALL PROFIT (CHINA) LIMITED
永盈(中國)有限公司",2002-03-18,2010-02-12,"Private, ltd by shares"
912,788276,"ALL PROFIT (HK) LIMITED (d2004-02-27)
聯盈(香港)有限公司",2002-03-08,2004-02-27,"Private, ltd by shares"
913,796803,"ALL PROFIT PROPERTIES LIMITED
時利置業有限公司",2002-05-08,,"Private, ltd by shares"
914,797791,"ALL PROSPECT INTERNATIONAL LIMITED
益丰國際有限公司",2002-05-15,2004-09-17,"Private, ltd by shares"
915,824259,"ALL RICH MEDIA & INFORMATION CO., LIMITED
沃瑞吉傳媒資訊有限公司",2002-12-04,2004-10-29,"Private, ltd by shares"
916,790665,"ALL RIGHT SUN TRADE DEVELOPMENT COMPANY LIMITED
愛樂信貿易發展有限公司",2002-03-25,2009-05-29,"Private, ltd by shares"
917,794322,"ALL SINO LIMITED (d2007-08-31)
永華有限公司",2002-04-19,2007-08-31,"Private, ltd by shares"
918,816246,"ALL SMART INVESTMENT LIMITED
安俊投資有限公司",2002-10-02,,"Private, ltd by shares"
919,805799,"ALL SUCCESS (HONG KONG) LIMITED
鼎立(香港)有限公司",2002-07-12,,"Private, ltd by shares"
920,784365,"ALL SUCCESS FASHION LIMITED
全成時裝有限公司",2002-01-28,2019-12-27,"Private, ltd by shares"
921,804288,"ALL SUN LIMITED (d2007-12-14)
衡新有限公司",2002-07-02,2007-12-14,"Private, ltd by shares"
922,809737,"ALL SUPERIOR CONSULTANTS LIMITED
安捷顧問有限公司",2002-08-09,2012-06-01,"Private, ltd by shares"
923,788658,"ALL THE BEST SPORT CULTURE & COMMUNICATION LIMITED
百德寶體育文化傳播有限公司",2002-03-11,2006-03-31,"Private, ltd by shares"
924,826572,"ALL TIME LIMITED
泰銓有限公司",2002-12-18,,"Private, ltd by shares"
925,791044,ALL TIMES ENTERPRISE LIMITED,2002-03-28,2007-08-10,"Private, ltd by shares"
926,794046,"ALL TIMES MANUFACTURING COMPANY LIMITED
時泰工藝製品有限公司",2002-04-19,2004-05-21,"Private, ltd by shares"
927,794448,"ALL TRADE INDUSTRIAL LIMITED
展貿實業有限公司",2002-04-22,2003-07-11,"Private, ltd by shares"
928,802290,"ALL VENTURE LIMITED (d2007-10-26)
豪泉有限公司",2002-06-14,2007-10-26,"Private, ltd by shares"
929,824358,"ALL WEATHER SOLAR TECHNOLOGY CO., LIMITED
全天候太陽能科技有限公司",2002-12-06,,"Private, ltd by shares"
930,804267,"ALL WELL (HK) LIMITED
衡華(香港)有限公司",2002-07-02,,"Private, ltd by shares"
931,789611,"ALL WELL HOLDINGS LIMITED (d2007-07-27)
來威集團有限公司",2002-03-18,2007-07-27,"Private, ltd by shares"
932,826127,"ALL WELL INTERNATIONAL LIMITED (d2008-05-02)
恒來國際有限公司",2002-12-18,2008-05-02,"Private, ltd by shares"
933,794431,"ALL WELL LIMITED (d2007-08-24)
來貿有限公司",2002-04-22,2007-08-24,"Private, ltd by shares"
934,785418,ALL WELL RESOURCES LIMITED,2002-02-06,2011-04-01,"Private, ltd by shares"
935,811615,"ALL WIN INTERNATIONAL GROUP LIMITED
同勝國際集團有限公司",2002-08-26,,"Private, ltd by shares"
936,793421,"ALL WISDOM CORPORATE SERVICES LIMITED
捷思商業服務有限公司",2002-04-17,,"Private, ltd by shares"
937,798349,"ALL YIELD INTERNATIONAL LIMITED (d2003-10-31)
盈美國際有限公司",2002-05-17,2003-10-31,"Private, ltd by shares"
938,821729,"ALL-GOLD SUCCESS LIMITED
香港鑫盛投資有限公司",2002-11-15,,"Private, ltd by shares"
939,805636,"ALL-IN-ONE COMMUNICATION COMPANY LIMITED
綜合資訊科技有限公司",2002-07-10,2004-03-26,"Private, ltd by shares"
940,817838,"ALL-IN-ONE JEWELLERY CO., LIMITED
匯豐珠寶有限公司",2002-10-15,2008-02-29,"Private, ltd by shares"
941,809779,"ALL-RIGHT INTERNATIONAL TRADING (H.K.) CO., LIMITED
歐萊國際(香港)有限公司",2002-08-09,,"Private, ltd by shares"
942,819651,"ALLACTIONTRADE.COM (HK) LIMITED
環球集寶有限公司",2002-10-30,2010-03-26,"Private, ltd by shares"
943,782504,ALLAN TSANG & ASSOCIATES LIMITED,2002-01-14,,"Private, ltd by shares"
944,813382,"ALLAU (ASIA) LIMITED
晉健(亞洲)有限公司",2002-09-06,2012-11-02,"Private, ltd by shares"
945,822663,"ALLE INTERNATIONAL LIMITED
哈里國際有限公司",2002-11-22,2012-04-13,"Private, ltd by shares"
946,797019,"ALLEGRO PRO LIMITED
宏略資訊有限公司",2002-05-10,,"Private, ltd by shares"
947,797447,ALLENDY FAREAST LIMITED,2002-05-10,2004-09-30,"Private, ltd by shares"
948,782619,ALLIANCE & ASSOCIATES LIMITED,2002-01-16,,"Private, ltd by shares"
949,782403,"ALLIANCE (CHAN'S) EQUITY HOLDINGS LIMITED
聯和(陳氏)投資集團有限公司",2002-01-11,2015-12-24,"Private, ltd by shares"
950,792257,"ALLIANCE APEX LIMITED (d2006-11-10)
全鋒有限公司",2002-04-09,2006-11-10,"Private, ltd by shares"
951,804152,"ALLIANCE ASIA RESOURCES LIMITED
安聯亞洲有限公司",2002-06-28,,"Private, ltd by shares"
952,792255,"ALLIANCE BEST INTERNATIONAL LIMITED
全好國際有限公司",2002-04-09,2003-10-10,"Private, ltd by shares"
953,798967,"ALLIANCE BEST INVESTMENTS LIMITED
凱澤投資有限公司",2002-05-22,,"Private, ltd by shares"
954,792211,"ALLIANCE BILLION DEVELOPMENT LIMITED
全億發展有限公司",2002-04-08,2007-08-24,"Private, ltd by shares"
955,801735,"ALLIANCE BROKERS LIMITED
健生保險經紀有限公司",2002-06-12,,"Private, ltd by shares"
956,785044,"ALLIANCE CAPITAL (CHINA) LIMITED
聯業(中國)有限公司",2002-02-01,2012-01-27,"Private, ltd by shares"
957,791545,"ALLIANCE CONSTRUCTION ENGINEERING LIMITED (d2007-08-17)
聯億建築工程有限公司",2002-04-03,2007-08-17,"Private, ltd by shares"
958,812225,"ALLIANCE ENTERPRISE INTERNATIONAL LIMITED
銳輝實業國際有限公司",2002-08-30,,"Private, ltd by shares"
959,814978,ALLIANCE FOREX ASIA LIMITED,2002-09-20,2009-02-13,"Private, ltd by shares"
960,804666,"ALLIANCE HONG KONG TRANSPORTATION LIMITED
大聯盟客貨車電召中心有限公司",2002-07-05,2007-11-16,"Private, ltd by shares"
961,784153,"ALLIANCE INFORMATION TECHNOLOGY LIMITED
聯訊網絡科技有限公司",2002-01-25,,"Private, ltd by shares"
962,801674,"ALLIANCE INSURANCE COMPANY LIMITED
聯業保險有限公司",2002-06-10,,"Private, ltd by shares"
963,817887,"ALLIANCE INTER-CONTINENTAL LIMITED
泰和商事有限公司",2002-10-16,,"Private, ltd by shares"
964,791863,"ALLIANCE INVESTMENT HOLDINGS LIMITED
聯合投資集團有限公司",2002-04-04,2014-08-08,"Private, ltd by shares"
965,796807,"ALLIANCE LOGISTICS LIMITED (d2008-10-24)
聯合物流有限公司",2002-05-08,2008-10-24,"Private, ltd by shares"
966,810672,"ALLIANCE MAGNETICS H. K. LIMITED
聯磁香港股份有限公司",2002-08-16,,"Private, ltd by shares"
967,814345,"ALLIANCE ONE LIMITED
利升香港有限公司",2002-09-16,2013-03-08,"Private, ltd by shares"
968,796623,"ALLIANCE POWER INDUSTRIAL COMPANY LIMITED
群勝工業股份有限公司",2002-05-08,2012-07-20,"Private, ltd by shares"
969,825134,"ALLIANCE STAR LIMITED
置星有限公司",2002-12-11,,"Private, ltd by shares"
970,785681,"ALLIANCE SURPLUS INTERNATIONAL LIMITED
海傲國際有限公司",2002-02-08,2010-08-20,"Private, ltd by shares"
971,784537,ALLIANCE TANKERS LIMITED,2002-01-30,2010-12-24,"Private, ltd by shares"
972,825922,"ALLIANCE TECHNOLOGIES COMPANY LIMITED
雙聯科技有限公司",2002-12-16,2013-11-22,"Private, ltd by shares"
973,818198,"ALLIANCE TRAINING INSTITUTE LIMITED
聯創培訓有限公司",2002-10-18,2007-06-01,"Private, ltd by shares"
974,825440,"ALLIANCE WAVE HOLDINGS LIMITED
匯濤集團有限公司",2002-12-13,2010-05-07,"Private, ltd by shares"
975,797170,"ALLIANCEPRO INTERNATIONAL FINANCE & MANAGEMENT COMPANY LIMITED
匯策投資管理有限公司",2002-05-10,2008-10-24,"Private, ltd by shares"
976,803301,"ALLICARE (HK) LIMITED
愛莉珈有限公司",2002-06-21,2009-11-13,"Private, ltd by shares"
977,816932,"ALLIED (HK) INDUSTRIAL COMPANY LIMITED
友誠(香港)實業有限公司",2002-10-07,2006-03-10,"Private, ltd by shares"
978,794954,"ALLIED APEX INVESTMENT LIMITED
協鋒投資有限公司",2002-04-24,2005-07-15,"Private, ltd by shares"
979,802339,"ALLIED BEST DEVELOPMENT LIMITED (d2005-09-02)
滙榮發展有限公司",2002-06-14,2005-09-02,"Private, ltd by shares"
980,789816,"ALLIED BEST LIMITED
信駿有限公司",2002-03-20,,"Private, ltd by shares"
981,819334,"ALLIED CAPITAL (HONG KONG) LIMITED
衛洋(香港)有限公司",2002-10-28,2007-07-06,"Private, ltd by shares"
982,821156,"ALLIED CHAMP ASIA LIMITED
滙昌亞洲有限公司",2002-11-11,2007-08-17,"Private, ltd by shares"
983,815577,"ALLIED CHINESE LIMITED
華信行有限公司",2002-09-25,,"Private, ltd by shares"
984,816247,"ALLIED CITY (HONG KONG) LIMITED (d2008-02-15)
滙城(香港)有限公司",2002-10-02,2008-02-15,"Private, ltd by shares"
985,816841,"ALLIED CITY TECHNOLOGY LIMITED
滙城科技有限公司",2002-10-04,2008-02-15,"Private, ltd by shares"
986,801177,"ALLIED CREATION ASIA LIMITED
滙創亞洲有限公司",2002-06-07,,"Private, ltd by shares"
987,799442,"ALLIED CREATION INVESTMENT LIMITED (d2007-10-05)
滙創投資有限公司",2002-05-27,2007-10-05,"Private, ltd by shares"
988,825280,"ALLIED CREATIVE LIMITED (HK)
聯城有限公司",2002-12-11,,"Private, ltd by shares"
989,791926,"ALLIED DEVELOPMENT INTERNATIONAL LIMITED
聯合發展國際有限公司",2002-04-04,2007-08-24,"Private, ltd by shares"
990,816741,"ALLIED DRAGON (ASIA) LIMITED
寶龍(亞洲)有限公司",2002-10-04,2015-03-27,"Private, ltd by shares"
991,810566,"ALLIED DRAGON INDUSTRIAL LIMITED
滙龍實業有限公司",2002-08-16,,"Private, ltd by shares"
992,810466,"ALLIED DRAGON INTERNATIONAL HOLDINGS LIMITED
滙龍國際集團有限公司",2002-08-16,2009-12-31,"Private, ltd by shares"
993,799441,"ALLIED FAITH (CHINA) LIMITED
滙信(中國)有限公司",2002-05-27,2007-08-03,"Private, ltd by shares"
994,820423,"ALLIED FAME INTERNATIONAL LIMITED (d2005-10-28)
滙揚國際有限公司",2002-11-04,2005-10-28,"Private, ltd by shares"
995,800419,"ALLIED FAME INVESTMENTS LIMITED
鴻滙投資有限公司",2002-06-03,2007-10-12,"Private, ltd by shares"
996,783049,"ALLIED FAMOUS INVESTMENT LIMITED (d2003-10-17)
興滙投資有限公司",2002-01-18,2003-10-17,"Private, ltd by shares"
997,809808,ALLIED FINANCE (HONG KONG) LIMITED,2002-08-09,,"Private, ltd by shares"
998,787236,"ALLIED FIRST HOLDINGS LIMITED
合豐集團有限公司",2002-02-27,2007-07-13,"Private, ltd by shares"
999,800713,"ALLIED GIANT INTERNATIONAL LIMITED (d2009-10-30)
協泰國際貿易有限公司",2002-06-05,2009-10-30,"Private, ltd by shares"
1000,813882,"ALLIED GIANT INVESTMENT LIMITED (d2008-01-25)
滙亨投資有限公司",2002-09-11,2008-01-25,"Private, ltd by shares"
1001,813831,"ALLIED HONEST INVESTMENT LIMITED (d2015-04-17)
滙城投資有限公司",2002-09-11,2015-04-17,"Private, ltd by shares"
1002,807157,"ALLIED INTERNATIONAL INDUSTRIES LIMITED (d2009-12-18)
華昌國際實業有限公司",2002-07-22,2009-12-18,"Private, ltd by shares"
1003,818802,ALLIED INTERNATIONAL LIMITED,2002-10-23,,"Private, ltd by shares"
1004,818893,"ALLIED KING INTERNATIONAL LIMITED
景泰國際有限公司",2002-10-23,,"Private, ltd by shares"
1005,810073,"ALLIED KING TECHNOLOGY LIMITED
聯君科技有限公司",2002-08-14,2005-06-17,"Private, ltd by shares"
1006,805893,"ALLIED MEDICAL PRACTICES GUILD LIMITED
雅聯醫務協會有限公司",2002-07-12,,"Private, ltd by shares"
1007,786504,"ALLIED OCEAN HOLDINGS LIMITED (d2007-06-29)
匯洋集團有限公司",2002-02-19,2007-06-29,"Private, ltd by shares"
1008,783759,"ALLIED OCEAN INTERNATIONAL INVESTMENT GROUP LIMITED
匯洋國際投資集團有限公司",2002-01-23,2012-01-20,"Private, ltd by shares"
1009,799440,"ALLIED OCEAN TRADING LIMITED
聯海貿易有限公司",2002-05-27,2007-10-05,"Private, ltd by shares"
1010,815940,ALLIED PACIFIC ASSOCIATES LIMITED,2002-09-27,2011-06-03,"Private, ltd by shares"
1011,815941,ALLIED PACIFIC DISTRIBUTION LIMITED,2002-09-27,2009-02-13,"Private, ltd by shares"
1012,813300,"ALLIED PACIFIC HOTELS GROUP LIMITED
聯合太平酒店有限公司",2002-09-06,2010-08-06,"Private, ltd by shares"
1013,815942,ALLIED PACIFIC INTERTRADE LIMITED,2002-09-27,2006-02-24,"Private, ltd by shares"
1014,819700,"ALLIED PIONEER INTERNATIONAL LIMITED
聯運國際有限公司",2002-10-30,2008-03-14,"Private, ltd by shares"
1015,825241,"ALLIED PIONEER LIMITED (d2006-04-28)
聯信有限公司",2002-12-11,2006-04-28,"Private, ltd by shares"
1016,814571,"ALLIED PROFIT INVESTMENT LIMITED (d2009-02-06)
聯利投資有限公司",2002-09-18,2009-02-06,"Private, ltd by shares"
1017,797088,"ALLIED PROSPER LIMITED
綽聯有限公司",2002-05-10,,"Private, ltd by shares"
1018,825435,"ALLIED RAISE LIMITED
協昇有限公司",2002-12-13,2009-07-10,"Private, ltd by shares"
1019,810057,"ALLIED RISE CORPORATION LIMITED (d2008-09-26)
集陞有限公司",2002-08-14,2008-09-26,"Private, ltd by shares"
1020,785826,"ALLIED RIVER INTERNATIONAL LIMITED
江滙國際有限公司",2002-02-08,2008-02-06,"Private, ltd by shares"
1021,787844,"ALLIED SHINE INTERNATIONAL LIMITED
滙明國際有限公司",2002-03-04,,"Private, ltd by shares"
1022,804136,"ALLIED STAR GARMENT PRODUCTION COMPANY LIMITED
雅麗星製衣有限公司",2002-06-28,2019-04-04,"Private, ltd by shares"
1023,821157,"ALLIED STATE HOLDINGS LIMITED
邦盟集團有限公司",2002-11-11,2004-11-05,"Private, ltd by shares"
1024,812738,"ALLIED STATE INTERNATIONAL DEVELOPMENT LIMITED
聯邦國際發展有限公司",2002-09-04,2010-01-29,"Private, ltd by shares"
1025,823185,"ALLIED STATE INTERNATIONAL LIMITED (d2004-03-19)
邦盟國際有限公司",2002-11-27,2004-03-19,"Private, ltd by shares"
1026,821158,"ALLIED STATE TECHNOLOGY LIMITED
邦盟科技有限公司",2002-11-11,,"Private, ltd by shares"
1027,825820,"ALLIED SUCCESS INTERNATIONAL LOGISTICS LIMITED
聯亨國際物流有限公司",2002-12-13,2008-05-02,"Private, ltd by shares"
1028,821159,"ALLIED TEAM TECHNOLOGY LIMITED
盟滙科技有限公司",2002-11-11,2008-03-20,"Private, ltd by shares"
1029,783327,"ALLIED TECHNOLOGY DEVELOPMENT LIMITED (d2009-09-11)
百滙科技發展有限公司",2002-01-18,2009-09-11,"Private, ltd by shares"
1030,799397,ALLIED TELESIS (DONGGUAN) LIMITED,2002-05-24,2017-01-13,"Private, ltd by shares"
1031,807825,ALLIED TOOLING & TECHNOLOGIES LIMITED,2002-07-26,2004-11-12,"Private, ltd by shares"
1032,806755,ALLIED UNION CONSULTANTS LIMITED,2002-07-17,2014-11-21,"Private, ltd by shares"
1033,823230,"ALLIED VANTAGE INDUSTRIAL LIMITED
滙利實業有限公司",2002-11-27,2020-06-05,"Private, ltd by shares"
1034,792094,"ALLIED WAY CONSTRUCTION ENGINEERING LIMITED
滙通建築工程有限公司",2002-04-08,,"Private, ltd by shares"
1035,799439,"ALLIED WAY LOGISTICS LIMITED (d2017-10-20)
滙通物流有限公司",2002-05-27,2017-10-20,"Private, ltd by shares"
1036,787600,"ALLIED WAYS LIMITED
滙程有限公司",2002-03-01,,"Private, ltd by shares"
1037,787891,"ALLIED WEALTH MANAGEMENT LIMITED (d2007-07-13)
滙財管理有限公司",2002-03-04,2007-07-13,"Private, ltd by shares"
1038,811010,"ALLIED WEALTHY INTERNATIONAL LIMITED
鴻穎國際有限公司",2002-08-21,2009-01-16,"Private, ltd by shares"
1039,816484,"ALLIED WELL (H.K.) LIMITED
威和(香港)有限公司",2002-10-04,2004-12-03,"Private, ltd by shares"
1040,812042,"ALLIED WELL HOLDINGS LIMITED (d2015-01-02)
高聯集團有限公司",2002-08-28,2015-01-02,"Private, ltd by shares"
1041,801446,"ALLIED WELL INDUSTRIAL LIMITED (d2004-05-07)
滙益實業有限公司",2002-06-07,2004-05-07,"Private, ltd by shares"
1042,800230,"ALLIED WELL INVESTMENT LIMITED (d2007-07-06)
樂威投資有限公司",2002-05-31,2007-07-06,"Private, ltd by shares"
1043,785080,"ALLIED WELL LIMITED (d2007-06-15)
合佳有限公司",2002-02-01,2007-06-15,"Private, ltd by shares"
1044,784772,"ALLIED WINNING LIMITED
雅榮有限公司",2002-02-01,2009-08-07,"Private, ltd by shares"
1045,825844,"ALLIED WORKS CONSTRUCTION ENGINEERING LIMITED
聯標建築工程有限公司",2002-12-16,2009-05-08,"Private, ltd by shares"
1046,789037,ALLINHAND MEDIA LIMITED,2002-03-13,2007-07-20,"Private, ltd by shares"
1047,789915,Allmedco Group Limited,2002-03-20,,"Private, ltd by shares"
1048,813841,"ALLO TECH INVESTMENT CO., LIMITED
愛諾科技投資有限公司",2002-09-11,2008-03-28,"Private, ltd by shares"
1049,783703,ALLOY SERVICES LIMITED (d2014-01-30),2002-01-23,2014-01-30,"Private, ltd by shares"
1050,814473,ALLOYSASIA LIMITED,2002-09-18,2008-08-01,"Private, ltd by shares"
1051,789754,"ALLPLAST COMPANY LIMITED (d2007-07-27)
全塑有限公司",2002-03-20,2007-07-27,"Private, ltd by shares"
1052,802020,"ALLREADY OFFICE SYSTEM LIMITED
第一商業系統有限公司",2002-06-14,2009-11-06,"Private, ltd by shares"
1053,808713,"ALLRED INTERNATIONAL INVESTMENTS LIMITED
歐瑞國際投資有限公司",2002-08-02,2019-03-29,"Private, ltd by shares"
1054,793414,"ALLRICH MOTORS COMPANY LIMITED
全發汽車有限公司",2002-04-17,,"Private, ltd by shares"
1055,789188,"ALLSPORTS ENTERPRISE COMPANY LIMITED
全能運動企業有限公司",2002-03-15,2004-07-23,"Private, ltd by shares"
1056,804165,"ALLTEC LIMITED (d2013-08-30)
香港奧泰科技有限公司",2002-06-28,2013-08-30,"Private, ltd by shares"
1057,797840,"ALLWAY ARTS LIMITED
永樂藝術有限公司",2002-05-15,,"Private, ltd by shares"
1058,783658,"ALLWIN (CHINA) LIMITED
永興(中國)有限公司",2002-01-23,2005-06-30,"Private, ltd by shares"
1059,812322,"ALMA INT'L FURNITURE LIMITED
奧爾瑪國際家私有限公司",2002-08-30,2011-04-29,"Private, ltd by shares"
1060,800662,"ALMAN MACHINERY COMPANY LIMITED
阿爾曼機械有限公司",2002-06-05,2007-09-07,"Private, ltd by shares"
1061,800401,ALMIGHTY HONG COMPANY LIMITED,2002-06-03,2004-08-13,"Private, ltd by shares"
1062,807230,"ALNO (HK) LIMITED
愛諾(香港)有限公司",2002-07-22,2007-11-30,"Private, ltd by shares"
1063,787370,"ALOBON (HONG KONG) COMPANY LIMITED
雅邦(香港)有限公司",2002-02-27,,"Private, ltd by shares"
1064,798978,ALOHA GREATER CHINA LIMITED,2002-05-22,2007-10-05,"Private, ltd by shares"
1065,794283,"ALOHA OUTDOOR FURNITURE COMPANY LIMITED
雅樂戶外用品有限公司",2002-04-19,,"Private, ltd by shares"
1066,786616,ALPHA ACADEMY LIMITED,2002-02-19,,"Private, ltd by shares"
1067,805955,"ALPHA ALLIANCE FINANCE LIMITED
冠聯財務有限公司",2002-07-12,2006-03-10,"Private, ltd by shares"
1068,819469,"ALPHA ALLIANCE LIMITED (d2008-03-14)
冠楠有限公司",2002-10-30,2008-03-14,"Private, ltd by shares"
1069,820499,ALPHA ASIAN TRADING LIMITED,2002-11-06,2012-08-03,"Private, ltd by shares"
1070,814173,"ALPHA BATA INVESTMENTS LIMITED
阿爾法貝特投資有限公司",2002-09-13,2006-06-30,"Private, ltd by shares"
1071,816477,"ALPHA CAPITAL (HK) LIMITED
栢順(香港)有限公司",2002-10-04,2010-02-26,"Private, ltd by shares"
1072,814037,"ALPHA CENTRE LIMITED (HK)
得舜有限公司",2002-09-13,,"Private, ltd by shares"
1073,800185,"ALPHA CKC CORPORATE SERVICES LIMITED
凱潤企管稅計有限公司",2002-05-31,2008-10-24,"Private, ltd by shares"
1074,816165,"ALPHA CLEANING SERVICES LIMITED (d2014-04-04)
科達清潔服務有限公司",2002-10-02,2014-04-04,"Private, ltd by shares"
1075,782537,"ALPHA COMPONENT LIMITED
微矽科技有限公司",2002-01-14,,"Private, ltd by shares"
1076,803768,"ALPHA CONCEPTS INTERNATIONAL LIMITED
奧思國際有限公司",2002-06-26,2007-02-16,"Private, ltd by shares"
1077,822013,"ALPHA CONSULTANCY LIMITED (HK)
匯駿企業顧問有限公司",2002-11-15,,"Private, ltd by shares"
1078,794814,ALPHA CORPORATION LIMITED (d2004-07-02),2002-04-24,2004-07-02,"Private, ltd by shares"
1079,788074,ALPHA CREATE INTERNATIONAL COMPANY LIMITED,2002-03-06,2007-12-21,"Private, ltd by shares"
1080,808009,"ALPHA CROWN HOLDING LIMITED
皓輝集團有限公司",2002-07-29,,"Private, ltd by shares"
1081,820482,"ALPHA ENTERTAINMENT LIMITED (d2010-04-01)
新點子影藝事業有限公司",2002-11-06,2010-04-01,"Private, ltd by shares"
1082,795635,"ALPHA FORTUNE INTERNATIONAL LIMITED
福進國際有限公司",2002-05-02,2007-09-14,"Private, ltd by shares"
1083,806023,"ALPHA FORTUNE LIMITED
利日有限公司",2002-07-12,,"Private, ltd by shares"
1084,807915,"ALPHA GIANT HOLDING LIMITED
鼎照集團有限公司",2002-07-26,,"Private, ltd by shares"
1085,821846,ALPHA GLORY LIMITED (d2007-04-20),2002-11-15,2007-04-20,"Private, ltd by shares"
1086,814528,ALPHA INSURANCE COMPANY LIMITED,2002-09-18,2011-05-27,"Private, ltd by shares"
1087,795421,"ALPHA INTERNATIONAL ENTERPRISE LIMITED (d2004-07-02)
西城行有限公司",2002-04-26,2004-07-02,"Private, ltd by shares"
1088,782511,"ALPHA INTERNATIONAL MARKETING SERVICES LIMITED
姜頌賢國際市務有限公司",2002-01-14,2007-05-25,"Private, ltd by shares"
1089,807916,"ALPHA LEADER HOLDING LIMITED
盛峰集團有限公司",2002-07-26,,"Private, ltd by shares"
