,Reg no.,Name,"Incorp-
orated",Dissolved,Type
1296,814069,"AMMON MOTIVATION HOLDINGS LIMITED
愛馬動力集團有限公司",2002-09-13,2008-01-25,"Private, ltd by shares"
1297,817701,AMN CONSULTING LIMITED (d2006-12-22),2002-10-11,2006-12-22,"Private, ltd by shares"
1298,785375,"AMO ASIA LIMITED
眼力健亞洲有限公司",2002-02-06,,"Private, ltd by shares"
1299,822664,"AMOEBA STUDIO LIMITED
亞米巴工作室有限公司",2002-11-22,2005-05-13,"Private, ltd by shares"
1300,784624,"AMONICS LIMITED
安力光電有限公司",2002-01-30,,"Private, ltd by shares"
1301,817948,"AMPAC TECHNOLOGY CORP., LIMITED",2002-10-16,2008-08-01,"Private, ltd by shares"
1302,808821,"AMPESON TECHNOLOGY COMPANY LIMITED
安培迅科技有限公司",2002-08-02,2006-10-20,"Private, ltd by shares"
1303,801765,"AMPHIBIAN AIRCRAFT LIMITED
安飛飛機有限公司",2002-06-12,2006-02-17,"Private, ltd by shares"
1304,782957,AMPHION LOGISTICS CONSORTIUM LIMITED,2002-01-18,2015-03-20,"Private, ltd by shares"
1305,822474,"AMPIO INTERNATIONAL LIMITED (d2014-02-28)
奧普國際有限公司",2002-11-20,2014-02-28,"Private, ltd by shares"
1306,813665,AMPLE CENTURY INVESTMENTS LIMITED,2002-09-11,2016-01-15,"Private, ltd by shares"
1307,814443,"Ample Chemical (Hong Kong) Corporation Limited
美利普化工(香港)有限公司",2002-09-18,,"Private, ltd by shares"
1308,805160,"AMPLE CONSTRUCTION COMPANY LIMITED
盈信建築有限公司",2002-07-08,,"Private, ltd by shares"
1309,792902,"AMPLE CONSULTANCY LIMITED
安保顧問有限公司",2002-04-12,2007-08-24,"Private, ltd by shares"
1310,802117,"AMPLE INTERNATIONAL DEVELOPMENT LIMITED
艾譜國際發展有限公司",2002-06-14,,"Private, ltd by shares"
1311,813309,"AMPLE INTERNATIONAL GROUP LIMITED
安普國際集團有限公司",2002-09-06,,"Private, ltd by shares"
1312,818068,"AMPLE INTERNATIONAL LIMITED (d2005-10-07)
安寶國際有限公司",2002-10-18,2005-10-07,"Private, ltd by shares"
1313,789425,"AMPLE LIMITED (HK)
毅詠有限公司",2002-03-15,2019-02-01,"Private, ltd by shares"
1314,789020,"AMPLE LOGISTICS LIMITED
安保物流有限公司",2002-03-13,2016-06-10,"Private, ltd by shares"
1315,814444,"Ample Paper Corporation Limited
美利普紙業有限公司",2002-09-18,,"Private, ltd by shares"
1316,785054,"AMPLE RICH LIMITED (b2002-02-01)
通財有限公司",2002-02-01,2015-10-02,"Private, ltd by shares"
1317,816771,AMPLE SINO ASSETS LIMITED,2002-10-04,2011-11-05,"Private, ltd by shares"
1318,825917,"AMPLE SKY LIMITED (d2008-05-02)
天熙有限公司",2002-12-16,2008-05-02,"Private, ltd by shares"
1319,793260,AMPLE SUCCESS LIMITED (d2010-08-20),2002-04-15,2010-08-20,"Private, ltd by shares"
1320,794215,"Ample Trading (HK) Limited
企業貿易(香港)有限公司",2002-04-19,,"Private, ltd by shares"
1321,796789,"AMPLEWAY DEVELOPMENT LIMITED (d2007-09-21)
佳栢發展有限公司",2002-05-08,2007-09-21,"Private, ltd by shares"
1322,799645,AMPM LIMITED,2002-05-27,,"Private, ltd by shares"
1323,824151,"AMPORIUM TRADING (HONG KONG) COMPANY LIMITED
帝佑商貿(香港)有限公司",2002-12-04,2004-05-21,"Private, ltd by shares"
1324,813450,"AMPRO LIMITED (d2008-08-01)
安保有限公司",2002-09-09,2008-08-01,"Private, ltd by shares"
1325,805033,"AMPSON TECHNOLOGY CO., LIMITED
安普生科技有限公司",2002-07-08,2004-01-30,"Private, ltd by shares"
1326,799812,AMRI ADVISORY LIMITED,2002-05-29,2015-08-28,"Private, ltd by shares"
1327,811050,"AMS TELECOM LIMITED (d2010-01-29)
安思電訊設備有限公司",2002-08-21,2010-01-29,"Private, ltd by shares"
1328,805547,AMSALEM BUSINESS TRAVEL (HONG KONG) LIMITED,2002-07-10,,"Private, ltd by shares"
1329,820058,"AMSSY LIMITED
安必信有限公司",2002-11-01,2016-07-15,"Private, ltd by shares"
1330,788196,AMSTERDAM ASIA LIMITED,2002-03-06,2009-07-31,"Private, ltd by shares"
1331,814079,"AMSUN HARDWARE HONGKONG LIMITED
香港晨光五金有限公司",2002-09-13,2016-01-08,"Private, ltd by shares"
1332,797956,AMSUS (HK) LIMITED,2002-05-15,,"Private, ltd by shares"
1333,825416,"AMTD Global Markets Limited
尚乘環球市場有限公司",2002-12-13,,"Private, ltd by shares"
1334,794368,"AMTEX LOGISTICS COMPANY LIMITED
安達物流有限公司",2002-04-22,2005-08-26,"Private, ltd by shares"
1335,794041,"AMTON LIMITED
安通有限公司",2002-04-19,,"Private, ltd by shares"
1336,825158,AMTRONX LIMITED,2002-12-11,,"Private, ltd by shares"
1337,804607,AMX LIMITED (d2006-10-25),2002-07-05,2006-10-25,"Private, ltd by shares"
1338,825425,"AMXON LOCKS LIMITED
岡信建材有限公司",2002-12-13,,"Private, ltd by shares"
1339,783401,AMYBELL'S LEARNING RESOURCE LIMITED,2002-01-21,2005-02-18,"Private, ltd by shares"
1340,822225,"AN DA HONG ENTERPRISES LIMITED
安達鴻企業有限公司",2002-11-20,2006-03-17,"Private, ltd by shares"
1341,790528,"AN SAN HUA CO. LIMITED
安盛華有限公司",2002-03-22,2006-03-31,"Private, ltd by shares"
1342,798512,"AN SENG ENTERPRISES LIMITED
安星(環球)有限公司",2002-05-17,,"Private, ltd by shares"
1343,825390,"AN SHEN MANUFACTURING LIMITED
安紳製品有限公司",2002-12-13,,"Private, ltd by shares"
1344,786119,"AN WING WAH COMPANY LIMITED
安榮華有限公司",2002-02-11,2005-05-27,"Private, ltd by shares"
1345,789086,ANA K. LIMITED,2002-03-13,2008-03-28,"Private, ltd by shares"
1346,826766,"ANABA CHINA LIMITED
安奔汽車電子(中國)有限公司",2002-12-20,2008-05-09,"Private, ltd by shares"
1347,783879,ANADOLU LIMITED (HK),2002-01-25,,"Private, ltd by shares"
1348,823768,ANALOG LIMITED (d2008-04-11),2002-11-29,2008-04-11,"Private, ltd by shares"
1349,799118,"ANALOG POWER LIMITED
環宇科技(國際)有限公司",2002-05-24,2018-01-29,"Private, ltd by shares"
1350,784560,"ANAM INSTRUMENTS (HK) COMPANY LIMITED
亞南精工(香港)有限公司",2002-01-30,2013-03-22,"Private, ltd by shares"
1351,820692,ANATOLIANFOOD (HK) LIMITED,2002-11-06,,"Private, ltd by shares"
1352,800804,ANATUNOV LIMITED,2002-06-05,2019-05-17,"Private, ltd by shares"
1353,793077,ANB PROPERTIES LIMITED,2002-04-15,,"Private, ltd by shares"
1354,818242,"ANCAA ADVERTISING AGENCY LIMITED
安爾格廣告顧問有限公司",2002-10-18,,"Private, ltd by shares"
1355,812679,"ANCHANT DIGITAL LIMITED
安臣數碼科技有限公司",2002-09-04,2010-05-14,"Private, ltd by shares"
1356,803032,ANCHOR CONSULTANCY LIMITED,2002-06-21,,"Private, ltd by shares"
1357,788783,"ANCHOR LINK LIMITED
安培聯業有限公司",2002-03-13,,"Private, ltd by shares"
1358,793977,"ANCHOR PRODUCTION LIMITED
安格製作有限公司",2002-04-19,2005-02-08,"Private, ltd by shares"
1359,822101,"ANCIENTRY (HONG KONG) CO., LIMITED
古道(香港)有限公司",2002-11-18,2009-04-09,"Private, ltd by shares"
1360,788131,"ANCO DEVELOPMENT (HK) LIMITED
盈高創展(香港)有限公司",2002-03-06,,"Private, ltd by shares"
1361,816014,"ANCO MANUFACTURING COMPANY LIMITED
安高制品有限公司",2002-09-30,2012-03-23,"Private, ltd by shares"
1362,794272,"AND CONCEPT & ASSOCIATES LIMITED
同理心創念有限公司",2002-04-19,2009-03-13,"Private, ltd by shares"
1363,786678,"ANDA EMPLOYMENT SERVICES LIMITED
安妥僱傭有限公司",2002-02-20,2004-04-16,"Private, ltd by shares"
1364,812559,"ANDAMAN (HONG KONG) LIMITED (d2014-10-17)
安達萬(香港)有限公司",2002-09-02,2014-10-17,"Private, ltd by shares"
1365,804619,"ANDEL JEWELRY LIMITED
安德爾有限公司",2002-07-05,2006-10-28,"Private, ltd by shares"
1366,812207,"ANDELI DEVELOPMENT LIMITED
安德利發展有限公司",2002-08-30,2017-04-07,"Private, ltd by shares"
1367,811021,"ANDERSON DYEING FACTORY LIMITED
友福(尼龍)染整有限公司",2002-08-21,2004-06-25,"Private, ltd by shares"
1368,809475,"ANDERSON FINANCIAL MANAGEMENT STRATEGY (FAR EAST) ASSOCIATES LIMITED
安德信財務管理策劃(遠東)事務所有限公司",2002-08-07,2009-01-09,"Private, ltd by shares"
1369,809827,"ANDERSON PERSONNEL SERVICE CO LIMITED
毅誠專業人事顧問有限公司",2002-08-09,2011-12-09,"Private, ltd by shares"
1370,809542,"ANDES GROUP LIMITED (d2010-01-08)
安迪士集團有限公司",2002-08-09,2010-01-08,"Private, ltd by shares"
1371,812168,"ANDI (HK) LIMITED
安帝(香港)有限公司",2002-08-28,2007-02-27,"Private, ltd by shares"
1372,790612,"ANDOVER LAND (H.K.) LIMITED
堯泰地產(香港)有限公司",2002-03-25,2016-08-12,"Private, ltd by shares"
1373,803096,"ANDREW NG & PARTNERS ARCHITECTS LIMITED
理進建築師有限公司",2002-06-21,2009-11-13,"Private, ltd by shares"
1374,798403,"ANDUS (ASIA) GROUP LIMITED
安泰(亞洲)集團有限公司",2002-05-17,2010-01-22,"Private, ltd by shares"
1375,827077,"ANDY DESIGN CORPORATION LIMITED
漢廸禮品開發有限公司",2002-12-24,2008-06-27,"Private, ltd by shares"
1376,813187,ANDY INTERNATIONAL LIMITED (d2010-01-29),2002-09-06,2010-01-29,"Private, ltd by shares"
1377,805438,"ANEX FURNISHINGS LIMITED
恆宇木藝有限公司",2002-07-10,2009-07-31,"Private, ltd by shares"
1378,820844,"ANFAIR INDUSTRIAL LIMITED
銨輝實業有限公司",2002-11-08,,"Private, ltd by shares"
1379,812362,"ANGANG GROUP HONG KONG (HOLDINGS) LIMITED
鞍鋼集團香港控股有限公司",2002-08-30,,"Private, ltd by shares"
1380,805906,"ANGEL (CHINA) PROPERTY GROUP CO., LIMITED
安佳(中國)置業集團有限公司",2002-07-12,2008-12-19,"Private, ltd by shares"
1381,812901,"ANGEL BEAUTY (PROPERTY) COMPANY LIMITED
天使美容(物業)有限公司",2002-09-04,2019-10-18,"Private, ltd by shares"
1382,783382,"ANGEL DEVELOPMENT LIMITED (d2007-06-01)
佳琪發展有限公司",2002-01-21,2007-06-01,"Private, ltd by shares"
1383,792175,"ANGEL INDUSTRIAL (HONG KONG) COMPANY LIMITED
安吉斯實業(香港)有限公司",2002-04-08,2011-12-09,"Private, ltd by shares"
1384,826956,"ANGEL LIFE SLIM BEAUTY COMPANY LIMITED
安康發展企業有限公司",2002-12-23,,"Private, ltd by shares"
1385,792108,ANGEL PAL INTERNATIONAL LIMITED,2002-04-08,2007-08-24,"Private, ltd by shares"
1386,792123,"ANGEL QUEEN LIMITED (d2003-03-21)
慧璟有限公司",2002-04-08,2003-03-21,"Private, ltd by shares"
1387,803186,"ANGEL SLIMMING & BEAUTY COMPANY LIMITED
天使纖體美容有限公司",2002-06-21,,"Private, ltd by shares"
1388,782100,"ANGELA FOOD COURT LIMITED
大家姐美食有限公司",2002-01-09,2003-10-24,"Private, ltd by shares"
1389,785124,ANGELA HALL DESIGN LIMITED,2002-02-01,,"Private, ltd by shares"
1390,782072,"ANGLE INVESTMENTS LIMITED (HK)
廣泛投資有限公司",2002-01-09,,"Private, ltd by shares"
1391,817304,ANGLE LIMITED (d2008-02-22),2002-10-09,2008-02-22,"Private, ltd by shares"
1392,815683,"ANGLER ALLIANCE LIMITED
鍇溢有限公司",2002-09-27,2020-07-17,"Private, ltd by shares"
1393,813025,"ANGLO - AMERICAN (INTERNATIONAL) MOTOR RACING SUPPLIES LIMITED
英美(國際)賽車部品有限公司",2002-09-06,2006-11-24,"Private, ltd by shares"
1394,805683,"ANGLO ENTERNITY LIMITED
英恒有限公司",2002-07-12,2019-08-02,"Private, ltd by shares"
1395,817153,"ANGO INTERNATIONAL LIMITED
邁森國際有限公司",2002-10-09,2008-11-28,"Private, ltd by shares"
1396,788292,ANGSANA CHARTERS (ASIA) PRIVATE LIMITED,2002-03-08,2004-06-25,"Private, ltd by shares"
1397,786797,"ANGSTREM ELECTRONICS LIMITED
安特電子有限公司",2002-02-22,2018-03-16,"Private, ltd by shares"
1398,797898,"ANGUS ELECTRONICS TECHNOLOGY LIMITED (d2008-10-03)
安格思電子科技有限公司",2002-05-15,2008-10-03,"Private, ltd by shares"
1399,805367,"ANGUS GROUP (HOLDING) LIMITED
思喬集團(控股)有限公司",2002-07-10,2005-10-21,"Private, ltd by shares"
1400,820010,"ANHAO STRATEGIC COMMUNICATIONS LIMITED
安灝企劃傳訊有限公司",2002-11-01,2008-04-03,"Private, ltd by shares"
1401,814993,"ANHAORUI TOYS&GIFTS (H.K.) LIMITED
安浩瑞玩具禮品(香港)有限公司",2002-09-20,2008-02-01,"Private, ltd by shares"
1402,807983,"Anheuser-Busch Hong Kong Trading Company, Limited
安海斯－布希香港貿易有限公司",2002-07-29,2015-03-22,"Private, ltd by shares"
1403,801904,"ANHING LIMITED
安興有限公司",2002-06-12,,"Private, ltd by shares"
1404,784680,"ANHUA ENTERPRISES LIMITED
安華企業香港有限公司",2002-01-30,2015-03-13,"Private, ltd by shares"
1405,793705,"ANHUI FRATERNITY ASSOCIATION (HONG KONG) LIMITED (THE)
香港安徽聯誼總會有限公司",2002-04-17,,Ltd by guarantee
1406,793199,"ANIC INVESTMENT (CHINA) CO., LIMITED
岸信投資(中國)有限公司",2002-04-15,2007-08-31,"Private, ltd by shares"
1407,822756,"ANIKE DESIGN AND ENGINEERING CO., LIMITED
匯盈設計工程有限公司",2002-11-22,2016-03-18,"Private, ltd by shares"
1408,819406,ANIMAL FARM PLAY & TOYS LIMITED,2002-10-28,2008-08-01,"Private, ltd by shares"
1409,789444,"ANIMATION LIFE PROMOTION LIMITED
安利爾推廣有限公司",2002-03-15,2004-07-30,"Private, ltd by shares"
1410,789400,ANIMDINI DIGITAL ART LIMITED,2002-03-15,2003-10-10,"Private, ltd by shares"
1411,802671,"ANJI INTERNATIONAL (H.K.) LIMITED
安基(國際)有限公司",2002-06-19,,"Private, ltd by shares"
1412,811324,"ANK ENTERPRISE LIMITED
灝昌企業有限公司",2002-08-23,2017-06-02,"Private, ltd by shares"
1413,826085,ANKA LIMITED (d2014-05-09),2002-12-18,2014-05-09,"Private, ltd by shares"
1414,807827,"ANKA TECHNOLOGIES LIMITED
安佳科技有限公司",2002-07-26,2006-09-29,"Private, ltd by shares"
1415,789349,"ANKING CARGO LIMITED
安景貨運有限公司",2002-03-15,2004-12-10,"Private, ltd by shares"
1416,821513,"ANKING CONSULTANTS LIMITED
桉景顧問有限公司",2002-11-13,2018-08-03,"Private, ltd by shares"
1417,811291,"ANKYO DEVELOPMENT LIMITED
朗喬發展有限公司",2002-08-23,,"Private, ltd by shares"
1418,804792,ANL (China) Limited,2002-07-05,2020-07-23,"Private, ltd by shares"
1419,790163,"ANLEY LIMITED
安渝有限公司",2002-03-20,,"Private, ltd by shares"
1420,809101,"ANLINE LIMITED (d2008-10-17)
安軒有限公司",2002-08-05,2008-10-17,"Private, ltd by shares"
1421,814216,"ANNA INTERNATIONAL GROUP (HONG KONG) LANDSCAPE DESIGN CO., LIMITED
安娜國際集團(香港)景觀設計有限公司",2002-09-13,2008-01-25,"Private, ltd by shares"
1422,821863,ANNAPURNA ASIA LIMITED,2002-11-15,2015-10-30,"Private, ltd by shares"
1423,825553,"ANNICE COMPANY LIMITED
亞傳有限公司",2002-12-13,2004-11-05,"Private, ltd by shares"
1424,782964,"ANNIE LIVE & HOUSEWARE LIMITED
安妮生活家居有限公司",2002-01-18,2015-02-18,"Private, ltd by shares"
1425,816650,ANNIEWHO PRODUCTION LIMITED,2002-10-04,,"Private, ltd by shares"
1426,786374,"ANNIL INTERNATIONAL LIMITED
安奈兒國際有限公司",2002-02-18,2008-07-25,"Private, ltd by shares"
1427,821257,"ANNON HOLDINGS LIMITED
正豐設計控股有限公司",2002-11-11,2011-11-18,"Private, ltd by shares"
1428,818386,"ANOSON ENTERPRISES LIMITED
諾森企業有限公司",2002-10-21,2009-03-13,"Private, ltd by shares"
1429,805829,ANOVATION INTERNATIONAL LIMITED,2002-07-12,2016-12-23,"Private, ltd by shares"
1430,817239,ANS INVESTMENT LIMITED,2002-10-09,,"Private, ltd by shares"
1431,786739,"ANSEL COMMUNICATIONS INTERNATIONAL COMPANY LIMITED
安晟咨詢國際有限公司",2002-02-20,2010-10-15,"Private, ltd by shares"
1432,798715,"ANSEN ENTERPRISES MANAGEMENT CO. (SHENZHEN) LIMITED
深圳市安信保企業策劃有限公司",2002-05-21,2006-02-03,"Private, ltd by shares"
1433,790044,"ANSETT ENTERPRISES LIMITED
安捷企業有限公司",2002-03-20,2015-07-31,"Private, ltd by shares"
1434,816852,"ANSHAN IRON & STEEL REFRACTORIES CO., LIMITED
鞍山鋼鐵耐火材料有限公司",2002-10-04,2005-09-02,"Private, ltd by shares"
1435,799558,ANSMANN ENERGY INTERNATIONAL LIMITED,2002-05-27,,"Private, ltd by shares"
1436,786294,ANSON & PARTNERS LIMITED,2002-02-15,,"Private, ltd by shares"
1437,807554,"ANSON INTERNATIONAL TRADE CO., LIMITED
安順國際貿易有限公司",2002-07-24,2014-03-28,"Private, ltd by shares"
1438,802840,ANSON PRINTING (HK) LIMITED,2002-06-19,2003-11-14,"Private, ltd by shares"
1439,785780,"ANSON TRADING LIMITED (d2013-04-05)
雅新貿易有限公司",2002-02-08,2013-04-05,"Private, ltd by shares"
1440,796608,"ANSONPO ENTERPRISE LIMITED
安信寶企業有限公司",2002-05-08,2011-06-30,"Private, ltd by shares"
1441,809109,"ANSTAR INTERNATIONAL LIMITED (d2005-10-28)
安星國際有限公司",2002-08-05,2005-10-28,"Private, ltd by shares"
1442,807022,"ANSUN HOLDING CO., LIMITED
安信股份有限公司",2002-07-19,,"Private, ltd by shares"
1443,801564,"ANSUN LIMITED (d2005-10-28)
安潤有限公司",2002-06-10,2005-10-28,"Private, ltd by shares"
1444,812693,"ANSWELL INTERNATIONAL (HONG KONG) LIMITED
安士威國際(香港)有限公司",2002-09-04,2012-09-07,"Private, ltd by shares"
1445,812492,"ANSWER TECHNOLOGY COMPANY LIMITED
安可科技有限公司",2002-09-02,2009-07-17,"Private, ltd by shares"
1446,802989,"ANT TECHNOLOGY (ASIA) LIMITED
安達科技(亞洲)有限公司",2002-06-21,,"Private, ltd by shares"
1447,799413,"ANTAR LIMITED (d2003-11-14)
斗科有限公司",2002-05-27,2003-11-14,"Private, ltd by shares"
1448,795073,"ANTEC LIMITED (HK)
協科有限公司",2002-04-26,,"Private, ltd by shares"
1449,806516,"ANTEL HOLDINGS LIMITED
安泰集團有限公司",2002-07-17,,"Private, ltd by shares"
1450,817046,"ANTEPA HONG KONG LIMITED
安特帕香港有限公司",2002-10-09,2007-04-20,"Private, ltd by shares"
1451,809106,"ANTEX INTERNATIONAL LIMITED (d2011-06-24)
安迪國際有限公司",2002-08-05,2011-06-24,"Private, ltd by shares"
1452,794390,"ANTEX WINDOW FASHIONS LIMITED
安達藝窗有限公司",2002-04-22,,"Private, ltd by shares"
1453,781704,"ANTHONY ENTERPRISE LIMITED (d2009-07-31)
安達利實業有限公司",2002-01-07,2009-07-31,"Private, ltd by shares"
1454,788499,"ANTHONY GARMENT LIMITED
安東尼服裝有限公司",2002-03-08,2007-07-20,"Private, ltd by shares"
1455,807627,"ANTHONY HO ARCHITECTS LIMITED
何國聰建築師事務所有限公司",2002-07-24,2004-09-17,"Private, ltd by shares"
1456,790518,"ANTHONY KITCHEN LIMITED
安東尼小廚有限公司",2002-03-22,,"Private, ltd by shares"
1457,812589,"ANTHROPODS LIMITED (HK)
人部有限公司",2002-09-02,,"Private, ltd by shares"
1458,824804,"ANTI-ALLERGY MEDICAL HOLDINGS LIMITED
香港安吉醫療控股有限公司",2002-12-09,2008-04-25,"Private, ltd by shares"
1459,809079,"ANTI-MONEY LAUNDERING NETWORK, LIMITED (THE)",2002-08-05,,"Private, ltd by shares"
1460,824686,"ANTIFIRE TECHNICAL SERVICES COMPANY LIMITED
安煇技術服務有限公司",2002-12-06,,"Private, ltd by shares"
1461,808938,"ANTON (H.K.) LIMITED (d2009-12-31)
安東(香港)有限公司",2002-08-02,2009-12-31,"Private, ltd by shares"
1462,809104,"ANTON DEVELOPMENT LIMITED (d2011-04-01)
達東發展有限公司",2002-08-05,2011-04-01,"Private, ltd by shares"
1463,783791,"ANTROMAX TRADING COMPANY LIMITED
安和明貿易有限公司",2002-01-23,2015-07-10,"Private, ltd by shares"
1464,784347,"ANTSMAN (ASIA PACIFIC) INDUSTRIAL LIMITED
安士文(亞太)實業有限公司",2002-01-28,,"Private, ltd by shares"
1465,796726,ANTZ CREATIVE LIMITED,2002-05-08,2019-04-18,"Private, ltd by shares"
1466,796626,ANTZ WORKSHOP LIMITED,2002-05-08,,"Private, ltd by shares"
1467,791390,ANUSCHKA LIMITED,2002-04-03,2008-04-03,"Private, ltd by shares"
1468,808939,"ANWAY (H.K.) LIMITED (d2007-12-14)
威安(香港)有限公司",2002-08-02,2007-12-14,"Private, ltd by shares"
1469,789494,"ANWEI TECHNOLOGY (HK) CO. LIMITED
安偉科技(香港)有限公司",2002-03-18,2007-12-14,"Private, ltd by shares"
1470,800157,ANYTHING UN LIMITED,2002-05-31,,"Private, ltd by shares"
1471,816492,ANYTIME (ASHLEY) LIMITED,2002-10-04,,"Private, ltd by shares"
1472,827031,"ANYTIME CHINA EXPRESS COMPANY LIMITED
全日通中港速遞有限公司",2002-12-24,2018-12-31,"Private, ltd by shares"
1473,806421,"ANYWAY INTERNATIONAL INVESTMENT COMPANY LIMITED
偉成國際投資有限公司",2002-07-17,2020-05-22,"Private, ltd by shares"
1474,803382,"ANYWHERE TECHNOLOGIES (HONG KONG) LIMITED
縱橫科技(香港)有限公司",2002-06-24,2012-11-16,"Private, ltd by shares"
1475,822850,"ANZI INTERNATIONAL MARKETING LIMITED (d2008-04-03)
安佶市務拓展國際有限公司",2002-11-22,2008-04-03,"Private, ltd by shares"
1476,795365,"AO CONTAINER LINES (HK) LIMITED
華美船運(香港)有限公司",2002-04-26,2018-08-10,"Private, ltd by shares"
1477,795364,"AO FREIGHT (HK) LIMITED
華美貨運(香港)有限公司",2002-04-26,,"Private, ltd by shares"
1478,801668,"AO LI DA ELECTRON LIMITED
奧力達電業有限公司",2002-06-10,2014-10-10,"Private, ltd by shares"
1479,811239,"AO MENG INDUSTRIES LIMITED
奧盟實業有限公司",2002-08-21,2018-04-06,"Private, ltd by shares"
1480,785745,"AO XIANG (HOLDINGS) LIMITED
翱翔(集團)有限公司",2002-02-08,2007-06-22,"Private, ltd by shares"
1481,790890,"AOBA BUSINESS CONSULTING LIMITED
青葉顧問有限公司",2002-03-27,,"Private, ltd by shares"
1482,807137,"AOHONG HOLDINGS LIMITED (d2005-03-18)
澳宏控股有限公司",2002-07-22,2005-03-18,"Private, ltd by shares"
1483,822624,"AOK INVESTMENT HOLDINGS CO., LIMITED
奧科投資控股有限公司",2002-11-20,2009-03-20,"Private, ltd by shares"
1484,807831,"AOMI MISTING SYSTEM LIMITED
青海冷霧系統有限公司",2002-07-26,2005-01-28,"Private, ltd by shares"
1485,805363,"AON AGENCIES HONG KONG LIMITED
怡安代理香港有限公司",2002-07-10,,"Private, ltd by shares"
1486,784486,"Aon Assurance Agencies Hong Kong Limited
怡安快易保險代理有限公司",2002-01-30,,"Private, ltd by shares"
1487,817343,"AON LIFE INSURANCE AGENCIES (HK) LIMITED
怡安人壽保險代理(香港)有限公司",2002-10-09,2016-02-11,"Private, ltd by shares"
1488,805342,"AON SERVICES HONG KONG LIMITED
怡安服務香港有限公司",2002-07-10,,"Private, ltd by shares"
1489,811223,"AONE INDUSTRIAL LIMITED
壹壹實業有限公司",2002-08-21,2011-12-09,"Private, ltd by shares"
1490,784810,"AONENG ELECTRICAL APPLIANCES CO., LIMITED
奧能電工有限公司",2002-02-01,,"Private, ltd by shares"
1491,810131,"AOPEC INTERNATIONAL GROUP LIMITED
奧佩克國際集團有限公司",2002-08-14,2007-12-28,"Private, ltd by shares"
1492,802983,"AOPU APPLIANCE (AUSTRALIA) LIMITED
奧普電器(澳大利亞)有限公司",2002-06-21,2007-11-02,"Private, ltd by shares"
1493,796665,"AOSEN FURNITURE GROUP (H.K.) CO., LIMITED
奧森傢俬集團(香港)有限公司",2002-05-08,2008-10-24,"Private, ltd by shares"
1494,822648,"AOSEN PTY LIMITED
澳森電腦編織商標有限公司",2002-11-22,,"Private, ltd by shares"
1495,787621,"AOSHI INT'L GROUP (H.K.) GARMENT LIMITED
傲世國際集團(香港)服裝有限公司",2002-03-01,2007-07-13,"Private, ltd by shares"
1496,781576,"AOSHIJIA TRADING COMPANY LIMITED
奧世嘉商貿有限公司",2002-01-07,2012-01-06,"Private, ltd by shares"
1497,817371,"Aotea Asia Pacific Company Limited
日賢良彩有限公司",2002-10-11,2015-02-18,"Private, ltd by shares"
1498,818597,"AOUTION INDUSTRIES DEVELOPMENT LIMITED
奧聖實業發展有限公司",2002-10-23,,"Private, ltd by shares"
1499,811649,"AOW TECHNOLOGY CONSULTANCY LIMITED
亞諾科技咨詢有限公司",2002-08-26,2012-12-07,"Private, ltd by shares"
1500,803478,"AOYAGI RMZ LIMITED
青柳熱研有限公司",2002-06-26,,"Private, ltd by shares"
1501,797591,"AOYAGI WORKS LIMITED
青柳中國有限公司",2002-05-13,,"Private, ltd by shares"
1502,791426,"AOZORA ENTERTAINMENT (HK) LIMITED
奧華數碼(香港)有限公司",2002-04-03,2005-07-29,"Private, ltd by shares"
1503,806859,"AP DESIGN & LICENSING CONSULTANT LIMITED
盈峰設計工程及牌照顧問服務有限公司",2002-07-19,2007-11-30,"Private, ltd by shares"
1504,815847,"AP INTERNATIONAL GROUP (HONG KONG) CO LIMITED
艾派國際集團(香港)有限公司",2002-09-27,,"Private, ltd by shares"
1505,797944,"AP LEI CHAU BILLIARD CLUB COMPANY LIMITED
鴨利洲桌球會有限公司",2002-05-15,2004-10-15,"Private, ltd by shares"
1506,789389,"APA ARCHITECTS LIMITED
東柏建築師(香港)有限公司",2002-03-15,,"Private, ltd by shares"
1507,804434,APA DESIGN AND CONTRACTING LIMITED,2002-07-03,,"Private, ltd by shares"
1508,784627,APAC 3G LIMITED,2002-01-30,2007-06-08,"Private, ltd by shares"
1509,815046,APAC GROUP LIMITED (HK),2002-09-20,,"Private, ltd by shares"
1510,794079,APAC MANAGEMENT SERVICES LIMITED,2002-04-19,2009-11-13,"Private, ltd by shares"
1511,781845,"APACHE (H.K.) LIMITED
阿帕奇 (香港) 有限公司",2002-01-09,2018-06-15,"Private, ltd by shares"
1512,809298,"APC INTERNATIONAL LIMITED (d2012-12-28)
埃彼克國際有限公司",2002-08-07,2012-12-28,"Private, ltd by shares"
1513,786106,"APC SURVEYING & BUILDING LIMITED
全管綫專業測量有限公司",2002-02-11,,"Private, ltd by shares"
1514,822968,"APE, LIMITED",2002-11-25,,"Private, ltd by shares"
1515,805674,"APEC LANDSCAPE DESIGN ENGINEERING COMPANY LIMITED
雅克景觀設計工程有限公司",2002-07-10,2006-03-24,"Private, ltd by shares"
1516,822712,"APECI HOLDINGS LIMITED
朗鼎基金管理有限公司",2002-11-22,2008-04-03,"Private, ltd by shares"
1517,792860,"APEX (ASIA) INDUSTRIAL LIMITED
華栢實業有限公司",2002-04-12,,"Private, ltd by shares"
1518,786085,APEX ADVISORY GROUP LIMITED,2002-02-11,2015-05-08,"Private, ltd by shares"
1519,813316,APEX CAPITAL (ASIA) LIMITED,2002-09-06,2008-01-18,"Private, ltd by shares"
1520,826402,"APEX CENTURY GROUP LIMITED
達維集團有限公司",2002-12-18,2005-04-15,"Private, ltd by shares"
1521,809427,"APEX CITY CONSULTANTS LIMITED
振城顧問有限公司",2002-08-07,,"Private, ltd by shares"
1522,787643,"APEX CONSULTANCY CO. LIMITED
俊峰顧問有限公司",2002-03-01,2004-07-23,"Private, ltd by shares"
1523,797150,"APEX CONSULTING SERVICES LIMITED (d2005-12-16)
捷峰顧問有限公司",2002-05-10,2005-12-16,"Private, ltd by shares"
1524,797501,"APEX CREATIVE COMMUNICATIONS LIMITED
三源傳藝有限公司",2002-05-13,2012-10-26,"Private, ltd by shares"
1525,815813,"APEX ELECTRICAL INDUSTRIES (HK) LIMITED
經典電器工業有限公司",2002-09-27,2011-06-03,"Private, ltd by shares"
1526,785590,APEX ENERGY INTERNATIONAL COMPANY LIMITED,2002-02-06,2013-03-08,"Private, ltd by shares"
